0,清热、利湿
2702,止渴、补气、健脾胃、生津、补血
2703,安神、解毒、平肝、利湿、消肿、清热
2704,利湿、降气、化痰、止血、清热
2705,利湿、解毒、清热
2706,散结、化痰、消肿、止咳、镇惊、清热
2707,除湿、解毒、凉血、祛风
2708,除湿、解毒、祛风
2709,除湿、行气、止痛、祛风
2710,除湿、消食、止痛、健脾
2711,明目、补肝、调中
2712,止咳、敛疮、止痢
2713,滋阴、补肾
2714,杀虫、敛疮
2715,敛疮、杀虫、明目、清热
2716,通血脉、利水、消肿、和胃、健脾
2717,祛瘀、凉血、止痛、止血
2718,解毒、清热
2719,疏肝、行气、化痰、散结
2720,行气、导滞
2721,宽中、化痰、燥湿、理气、健胃、散寒
2722,理气、止痛、散结
2723,行气、止痛
2724,宽中、消积、化痰、下气
2725,化湿、和胃
2726,润肺、生津、理气、和胃
2727,祛瘀、解毒、消肿、清热
2728,消积、解毒、活血、利湿、止痛、清热
2729,利水、化痰、止咳、清热
2730,解毒、收敛、止血、清热
2731,活血、固涩、收敛、止血
2732,收敛、止咳、止血、清热
2733,活血主财经、解毒、消肿
2734,除湿、舒筋、解毒、接骨、活血、杀虫、止血、祛风
2735,利窍、解毒、清火
2736,解毒、消肿、利尿、清热
2737,止痛、祛风
2738,祛风、解毒、止痛、清热
2739,驱风、除湿、解毒、清热
2740,解毒、止痛、消肿、理气、行滞、健脾
2741,解毒、杀虫、燥湿、清热
2742,解毒、杀虫、燥湿、清热
2743,解毒、杀虫、燥湿、清热
2744,解毒、止痛、消肿、清热
2745,解毒、活血、消肿、清热
2746,行气、止痛、杀虫
2747,行气、止痛、杀虫、燥湿、止痒、清热
2748,疗癣、杀虫
2749,杀虫、解热
2750,祛湿、杀虫、止痒、清热
2751,利湿、清热
2752,解蛇毒
2753,解毒、清热
2754,消积、凉血、利尿、清热
2755,解毒、利水、通窃、杀虫
2756,杀虫、解毒
2757,拔毒、散结、敛疮
2758,散结、利水、消肿、清热
2759,祛风湿、解热毒
2760,温补肾阳
2761,解毒、清热
2762,解毒、清热
2763,和胃、止痢、清热
2764,清湿热、解毒
2765,解毒、涤热、清暑、明目
2766,止渴、透疹、生津、清热
2767,止痛、杀虫、燥湿、清热
2768,燥湿、镇痛、清肠
2769,疏风、生津、明目、清热
2770,解毒、活血、祛风湿、清热
2771,解毒、止痛、消肿、清热
2772,解毒、消痈、消肿、清热
2773,除湿、解毒、清热
2774,解毒、凉血、利湿、清热
2775,清肝火、解热毒
2776,活血、行气、燥湿、止带
2777,解毒、杀虫、通便、清热
2778,杀虫、清热、燥湿、祛风
2779,解毒、凉血、止血、清热
2780,除湿、平喘、解蛇毒、止痛、消肿、利尿、止咳、祛风
2781,止血、消肿、祛风
2782,解毒、凉血、止血、清热
2783,燥湿、健胃、驱蛔、清热
2784,解毒、凉血、利尿、清热
2785,活血、利湿、止血、清热
2786,活血、调经、化痰、止咳、利水、通便
2787,凉肝、利窍、活血、去翳、明目、清热
2788,健胃、利尿、醒神
2789,明目、退翳
2790,行气、利水
2791,消炎、活络、止痛、祛风
2792,解毒、透疹、凉血、清热
2793,止泻、解毒、利湿、清热
2794,清肺、化痰、通便、滑肠
2795,利气宽胸散结、清肺、化痰
2796,宽胞、散结、润燥、化痰、滑肠、清热
2797,散瘀、通络、止痛、祛风
2798,止血
2799,散瘀、止痛、止血
2800,止咳、化痰
2801,通淋、利尿、清肺热
2802,解表、退黄、利湿、清热
2803,活络、止痛、舒筋、祛风
2804,解表、止咳、清热
2805,清肺、益气
2806,止泻、燥湿、涩肠、清热
2807,除湿热
2808,健胃、补肾
2809,止咳、止血
2810,收敛、利尿、通淋、止血
2811,解毒、清热
2812,祛风、解毒、消肿、清热
2813,安神、止血
2814,散瘀、凉血、消肿、止血
2815,润肺、化痰、止咳、下气
2816,行气、止痛、利湿、消肿
2817,除湿、通络、活血、祛风
2818,凉血、利尿、清热
2819,解毒、清热
2820,清利湿热
2821,和中、消食
2822,解毒、散结
2823,解毒、散结、利水、杀虫、逐瘀、清热
2824,解毒、散结、消热、止痛、化痰、消肿
2825,活血、通经
2826,散瘀、解毒、消肿、清热
2827,解毒、止痛、消肿、清热
2828,解表、疏风、止咳、宣肺
2829,除湿、镇咳、活血、行气、补虚、祛风
2830,燥湿、解毒
2831,和中、散风、止血、化湿、发表
2832,续筋、散瘀、接骨、止血
2833,除湿、活血、能络、祛风
2834,祛瘀、活血、止痛、消肿
2835,凉血、清热
2836,退黄、散瘀、活络、止痛、利湿、祛风
2837,除湿、活血、止痛、祛风
2838,除湿、驱虫、解毒、利水、通淋、清热、祛风
2839,解毒、清肺、止咳、清热
2840,利小便、解毒、清热
2841,除湿、止痛、祛风
2842,解毒、燥湿、发表、清热
2843,消积、解毒、敛疮、杀虫
2844,健胃、理气、止痛
2845,补心、安神、安心、补脾、益气血
2846,生肌、解毒、敛疮、祛风
2847,化浊、通淋
2848,散结、行气、燥湿、止血
2849,清利湿热、化浊、蠲痹
2850,利湿、清热
2851,下乳
2852,祛风、解毒、利水、止痛、通淋、清热
2853,补气
2854,平喘、散结、利水、行气、化痰、通淋
2855,滋阴、安神、健胃、壮阳、补肾
2856,止痛、利湿、清热
2857,补气、祛风湿、消肿毒、补血
2858,活血、缩尿、补肾
2859,理气、止痛
2860,消食、下气
2861,开窍、祛风
2862,止血
2863,润肺、化痰、止咳、清热
2864,调经
2865,解毒、化痰、止咳、清热
2866,解毒、活血、利湿、清热
2867,解毒、活血、消肿、清热
2868,解毒、活络、舒筋、清热
2869,解毒、泻炎、燥湿、清热
2870,滋阴、清热
2871,除湿、平喘、清热、通络、解毒、活血、杀虫、止咳、祛风
2872,安神、平肝、固涩、收敛、潜阳、镇惊
2873,解毒、消痈、利湿、清热
2874,定惊、泻肝、燥湿、清热
2875,活血、止痛、清热、利湿
2876,凉血、活血、止痛、清热
2877,散瘀、凉血、止痛、清热
2878,安神、除烦、镇惊、清热
2879,益阴气
2880,解毒、敛疮、凉血、止痢
2881,驱虫、解毒、乙脑、凉血、止血、防治流感、清热
2882,消食、温中、行气、健胃
2883,除湿、解表、散瘀、祛寒、疏风、止痛
2884,调经、行气、活血、止痛
2885,排脓、解毒、清肺、消肿
2886,解毒、凉血、利湿、清肺、止咳、止血
2887,调经、补肝、活血、明目
2888,除湿、补虚、止血、祛风
2889,润肺、解毒、活血、利湿、杀虫、止咳、止血、清热
2890,祛痰、益气、止咳、止血、健脾
2891,和中、止咳、明目、调气
2892,解毒、止痛、杀虫、消肿
2893,消食、通经、化积、破瘀、消肿、止血
2894,强筋骨、润肠、壮阳、补肾
2895,利湿、解毒、清热
2896,活血、清湿热、利肝胆、化瘀
2897,解毒、杀虫、燥湿、清热
2898,燥湿、杀虫、清热
2899,续筋、解毒、接骨、清热
2900,平喘、解毒、活络、凉血、利湿、止咳、舒筋、清热
2901,凉血、清热
2902,祛瘀、止痛
2903,利咽、清肺、止咳、明目
2904,除湿、解毒、镇痛、祛风
2905,透表、清热
2906,解毒、消肿
2907,消疳、健脾
2908,解毒、利尿、止血、清热
2909,消食、利水、消肿、止痒、健脾、祛风
2910,解毒、利胆、凉血、清热
2911,祛风、除湿、解毒、疗疮、凉血、止血
2912,消疳、健脾
2913,散瘀、消肿
2914,消肿、利尿
2915,通经络、祛风湿、消肿毒、益气血
2916,祛风、通络、活血、利湿、清热
2917,止咳、解毒、消炎
2918,散瘀、解蛇毒、接骨、活血、止痛
2919,润肺、化痰、止咳、散寒、下气
2920,益血、补气、利尿、止血
2921,活血、利湿、止血、清热
2922,除湿、解毒、化痰、止咳、祛风
2923,益肾、滋阴、生津、养胃
2924,润肺、解毒、消肿、止咳
2925,解毒、止痉、生津、祛风
2926,驱风、解暑、活血、消肿
2927,解毒、消肿
2928,止渴、解毒、润燥、清热
2929,补血、益气
2930,滋阴、强筋、壮骨、补肾
2931,清热解毒散结
2932,蚀疣
2933,散瘀、活血、利湿、止血、祛风
2934,活血、利湿、舒筋、祛风
2935,软坚、化痰、泻火、明目、清热
2936,祛痰、凉血、止咳、清热
2937,除湿、通络、祛风
2938,生肌、止血、敛疮
2939,泻火、清热
2940,镇惊、清热
2941,生津、除烦、利尿、泻火、清热
2942,辟秽、解毒、止血、清热
2943,利水、通淋、生津、清热
2944,除湿、活血、止痛、祛风
2945,止痛、解毒、消肿
2946,排脓、解毒、清肺、止咳
2947,解毒、杀虫、泻火、化瘀
2948,凉血、利湿、清肺、止咳、止血、清热
2949,利湿、化瘀、清热
2950,杀虫、清肝、泻下
2951,止血、止泻、解毒
2952,除烦、透疹、利尿、生津、止呕、清热
2953,止痛、利湿、消肿、清热
2954,安神、健脾胃、安心、益气血
2955,解表、行气、止痛、驱蛔
2956,利水、解毒
2957,祛痰、安神、定惊、降逆
2958,辟秽、止痛、行气
2959,温中、助阳
2960,除湿、止痛、祛风
2961,利湿、清热
2962,解毒、清热
2963,利湿、解毒、清热
2964,利湿、降压、清热
2965,解毒、凉血、止血、清热
2966,解毒、清热
2967,散瘀、解毒、止痛、利尿、通淋、清热
2968,祛风定惊止痉
2969,清热解毒消肿
2970,解毒、清热
2971,退黄、解毒、清热
2972,解毒、消肿、散结、风热、感冒、清热
2973,安神、接骨、健脾
2974,止痛、散结
2975,健胃、理气、止痛
2976,除湿、止痛、散寒、祛风
2977,行气、止痛、散寒、祛风
2978,镇痛、止泻、镇咳
2979,接骨、行气、止血、化瘀
2980,消积、生津、清热
2981,解毒、清热
2982,退翳、透疹、清热
2983,利水、祛瘀、润肠
2984,燥湿、清热、解毒、降逆
2985,利湿、清热、解毒
2986,退黄、散结、利湿、消肿、和胃、健脾、清热
2987,排脓、止痛、消肿、理气、散寒、祛风
2988,湿中、止痛、理气、散寒
2989,解毒、凉血、杀虫、清热
2990,解毒、和胃
2991,解毒、续骨
2992,止咳、解毒、清热
2993,解毒、止痛、消肿、清热
2994,调经、破血、消症、止痛
2995,散瘀、解毒、接骨、清热
2996,散瘀、解毒、止痛、清热
2997,消积、利水、定喘、化痰
2998,散瘀、解毒、止痛、清热
2999,祛瘀、解毒、止痛、清热
3000,明目、祛翳、清热
3001,敛疮、收湿
3002,和中、解表、解毒、疏风、行气、活血、消肿、化湿
3003,止血
3004,温中、行气、止痛、补血
3005,祛瘀、杀中止痒。、活血、除温、祛风
3006,舒筋、利湿、止泻
3007,利咽、润肠、清肺、化痰、通便、止咳
3008,清热、解毒、利湿、止痛、消肿、止血
3009,活血、除湿
3010,利湿、健脾
3011,解毒、消炎、止泻、收敛
3012,平肝、利水、消肿、清热
3013,安神、益气、养心、生津
3014,明目、清肝
3015,止泻、解毒、消肿、止血
3016,解毒、活血、消肿、化瘀
3017,强筋骨、散风湿、活血、补肾
3018,去翳、生肌、敛疮、收湿、明目、止痒
3019,止泻痢
3020,消疳、解毒、化痰、止咳、止血、清热
3021,祛风、凉血、止痛、利尿、止血、清热
3022,杀虫、止渴
3023,下气、宽胸、生津、止渴、和中、止痛
3024,消食、解毒、利湿、消肿、健胃、清热
3025,解毒、活血、止痛、清热
3026,通经、解毒、消肿、利尿、下乳、清热
3027,解毒、润燥、活血、消肿、补虚、祛风
3028,止痛、通络
3029,润肌、补气、壮骨、润肤、补血、壮筋
3030,平喘、祛风湿、解郁、止咳
3031,平喘、祛风湿、消肿毒、止咳
3032,收涩、镇惊、解毒
3033,定惊、清热
3034,解毒、通络、凉血、止痛、消肿、清热
3035,解毒、利湿、消肿、祛风
3036,止咳、清热
3037,活血消肿止痛
3038,利尿、解毒、清热
3039,除湿、活血、止痛、祛风
3040,解毒、清热
3041,利血、解毒、活血、利尿、清热
3042,调经、止痛、涩带、清热
3043,利咽、解毒、疏风、利湿、止咳、清热
3044,消食、解毒、止泻、接骨、活血、利湿、理气、清热
3045,消食、润肺、止咳、健脾
3046,解毒、透疹、平肝、止痛、利尿、清热
3047,解毒、凉血、消痈、止血
3048,除湿、止痒、祛风
3049,解毒、清热
3050,解毒、止痒、杀虫
3051,散瘀、止痛、消肿、止血
3052,散瘀、利湿、止血、祛风
3053,祛风、解毒、利水、通淋、泻火、除痛
3054,散瘀、解毒、消肿、清热
3055,止痛、利湿、消肿、祛风
3056,散瘀、止痛、止血
3057,解毒、利尿、清热
3058,消滞、和中、祛湿、解毒、散寒
3059,利尿、清热
3060,除湿、通络、活血、祛风
3061,凉血、解毒
3062,解毒、清热
3063,活血、解毒、通络
3064,除湿、解毒
3065,止血、消肿、止痛、清热、解毒
3066,除湿、止血、止痢
3067,散滞、祛寒、止痛、理气
3068,解毒、利水、凉散瘀、消肿、清热
3069,养血、行气、消肿、健脾
3070,解毒、散结、活血、清热
3071,祛风湿、活血、止血、补肾、续骨
3072,活血、止痛
3073,散瘀、止血、解毒
3074,软件坚散结、除湿、去积、暖胃、祛风
3075,明目、清肝
3076,化痰、镇咳
3077,利水、消肿
3078,化骨鲠、去面、去斑
3079,化骨、软坚
3080,泻火、清心
3081,理气、和中、解表
3082,除湿、止痒、祛风
3083,利水、活血、温阳、祛风
3084,消积、泻下
3085,祛风、散结、凉血、止痒、化瘀、清热
3086,益肾、补肺
3087,活血、止痛
3088,镇痛、清热
3089,解毒、消暑、凉血、清热
3090,退黄、疏风、止咳、清热
3091,散瘀、排脓、托毒、消肿、止血
3092,活络、舒筋、散寒、祛风
3093,固精、平肝火、清心火、止血
3094,益肾、固精、安神、止泻、养心、补脾
3095,收涩、止血
3096,益肾、涩精、清心、止血
3097,利湿、止痒
3098,解毒、泻火、燥湿、止痒
3099,解毒、活血、止痛、消肿、止血、清热
3100,解毒、散结、凉血、消肿、止血、清热
3101,散瘀、去湿、消风、止血
3102,消瘀、止血
3103,强筋、益气、活血、消肿、止血、健脾、补肾
3104,解毒、清肺、消肿、止咳
3105,解毒、消肿、收敛、止血
3106,调经、行气、活血、止痛
3107,散结、化痰、止血、清热
3108,散结、止咳、化痰、降逆、生津、止血、清热
3109,行气、祛风湿、活血、止痛、补肝肾
3110,利尿、清热
3111,散结、燥湿、止血、清热
3112,养颜、下气、散结
3113,解蛇毒、行气、活血、散寒、祛风
3114,血、益气养、解毒、散结、止血、祛风
3115,解毒、祛风湿、杀虫、开郁结
3116,止痛、行气、和中
3117,舒肝、和胃、利水、解毒
3118,理气、止痛、清肺、止咳
3119,降火、生津、解疮毒、润肺、清心
3120,解毒、清热
3121,下气、降逆
3122,解毒、凉血、清肺、止咳
3123,止渴、清肺、化痰、生津
3124,镇痛、解痉
3125,杀虫、截疟、攻癣
3126,解毒、敛疮、活血、止血
3127,止咳、清肺、解毒
3128,凉血、清肺、止咳、明目
3129,解毒、利水、活血、消肿
3130,厚肠胃、御风寒、填精髓、补五脏
3131,解毒、接骨、利湿、消肿、止血、清热
3132,通经、解毒、利湿、清热
3133,顺气、开郁
3134,泽皱、润肤、补虚、祛风
3135,破积、逐饮、泻水、杀虫
3136,导滞、消食、降气、化痰
3137,消食、解渴、化痰、利尿、止血、下气
3138,生肌、精气、止血、补益
3139,补精、解毒、益气、通乳
3140,益气血、强筋骨
3141,解毒、降压、活血、消肿、清热
3142,宁神、降压、清热
3143,活血、行气、止痛、祛风
3144,明目、去翳
3145,平喘、化痰
3146,止咳、利湿、清热
3147,祛痰、敛疮、催吐、镇惊
3148,祛痰、解毒、散结、止咳
3149,消积、解毒、利湿、通淋、健脾、清热
3150,除湿、安胎、降压、祛风
3151,强筋、壮骨
3152,胜湿、止痛、散寒、祛风
3153,消积、补血、解毒、敛疮、杀虫、燥湿
3154,调经、解毒、利水、活血、止痛、理气
3155,解毒、凉血、消肿、除蒸
3156,解毒、和胃
3157,解毒、消暑、利尿、清热
3158,散热、散风、解毒、透疹、祛风湿
3159,止渴、解毒、清暑、利尿、退目翳
3160,解酒毒
3161,解毒、消暑、凉血、清热
3162,解毒、利水、消暑、清热
3163,解毒、活血、消肿、止痢、截疟、清热
3164,解毒、消肿、润腩、祛风
3165,消瘿、散结
3166,祛风、祛瘀、活血、止痛、壮阳、补肾
3167,养血、止血、止带、益精
3168,理气、止血、壮阳、健脾、补肾
3169,除湿、强骨、补肾、止咳、止血、祛风
3170,益肾、养阴、止血、清热
3171,补肾阳、益精气
3172,安神、补气、生津、益精
3173,除湿、止痛、补虚、祛风
3174,调经、温肾、生精、补血、止血、壮阳
3175,补阳益服、生精、润燥
3176,养血、益气、助阳、祛风
3177,解毒、凉血、止痛、清热、止血、祛风
3178,强筋骨、壮肾阳、益精血、托疮毒
3179,涩精、补气、敛疮
3180,敛疮、清热、解毒
3181,涩肠、止痢、健脾、消食
3182,祛风湿、强筋骨、补肝肾
3183,收敛、止血、助阳、补肾
3184,泻火、解毒、通便
3185,精血、安胎、止血、补益
3186,解毒、活血、利湿、消肿、止血、清热
3187,散结、软坚、化痰、清热
3188,强筋骨、补肾阳、行血、益精血、消肿
3189,消积、解毒、活血、止痛
3190,除湿、解毒、活血、祛风
3191,补虚赢、强筋骨、生肌、除风湿、止泻痢、敛疮
3192,解毒、散瘀、祛风
3193,除湿、散瘀、解毒、祛风
3194,解毒、消肿
3195,祛痰、解毒、催吐、利尿
3196,散结解毒止痛
3197,安神、益气、健脾
3198,调经、润燥、活血、补血
3199,泻下、解毒、消瘰、清热
3200,解毒、清热
3201,解表、止咳、止血、散寒
3202,解毒、清热
3203,止泻、解毒、敛疮、涩肠、止血
3204,解毒、清热
3205,解毒、清暑、健脾、养胃
3206,解毒散溃疡
3207,益胃、解毒、除烦、目渴、健脾
3208,解毒、利骨、柔筋、祛风
3209,解毒、平肝、凉血、息风、明目、清肝
3210,解毒、活血、舒筋、清热
3211,解毒、利尿、清热
3212,益清、消积、破聚、除烦、清热、益阴、明目、养胃
3213,续筋、解毒、接骨、理肺、止咳、清热
3214,散瘀、解毒、消肿、止血
3215,排脓、解毒、凉血、清肝、化瘀、清热
3216,安神、开胃、养心、健脾
3217,止咳、润肺
3218,散瘀、解毒、和湿、消肿、止痒、清热
3219,解毒、清热
3220,止咳、清热、祛风
3221,清肺、解毒、敛疮
3222,解毒、凉血、止血、清热
3223,消疮毒、祛风湿
3224,润泽肌肤、美容
3225,凉血、解毒
3226,解毒、凉血、活血、利湿、通便、滑肠、清热
3227,宁神、降压、清热、解毒
3228,健脾、养胃、润肺、化痰
3229,解毒、止痛、消肿、清热
3230,解毒、凉血、止血、清热
3231,祛湿、解毒、凉血、清热
3232,利湿、解毒、清热
3233,解毒、利尿、通淋、清热
3234,活血、止痛、消肿
3235,开胃、利膈
3236,补血、益气
3237,温脾、杀虫、通便、补火、壮阳、止痒
3238,解毒、消肿
3239,凉血、利尿、通淋、清热
3240,止咳、宣肺、化痰
3241,止泻、散结、化症、止血、止带、健脾
3242,调经、强筋、活血、壮骨
3243,润肺、解毒、化痰、消肿、止咳、清热
3244,解毒、活络、消肿、舒筋
3245,养血、安胎、活血、止痛
3246,燥湿、止带
3247,解毒、清热
3248,除湿、活络、舒筋、祛风
3249,解毒、止痛、消肿、清热
3250,解毒、利水、凉血、消肿、止血、清热
3251,止痛、通络
3252,解毒、散结
3253,除湿、解毒、活血、破瘀、消肿、祛风
3254,止咳、解毒、清热
3255,除湿、疏肝、活络、利水、祛风
3256,补虚益肾强腰
3257,除湿、活血、止痛、祛风
3258,祛瘀、活络、止痛、舒筋
3259,滋阴、止渴、润燥、清热、益肺、养胃
3260,解毒、清热
3261,燥湿、解毒、止痒
3262,除湿、散结、化瘀、祛风
3263,解毒、敛疮、止血、清热
3264,凉血、解毒、清热
3265,宽中、消食、降气、化痰
3266,活血、止痛
3267,利胆、清肝
3268,散风、散寒、通阳气
3269,消食、利水、消肿、理气
3270,散痈、解毒、消肿、清热
3271,解毒、定惊、化痰、清热
3272,解毒、活血、通乳、清热
3273,生肌、排脓、温中、散寒
3274,解毒、消斑、凉血、清热
3275,益肾、强筋、活血、补脾
3276,平喘、解毒、止咳、止血、清热
3277,除湿、利尿、祛风
3278,解毒、活血、截疟、化湿、健脾
3279,解毒、利尿、通淋、清热
3280,杀虫、消肿、涤络、止痒
3281,消食、温中、散寒、下气
3282,通脉、活血、止痛、温经
3283,祛风湿、健脾胃
3284,和中、消食、利胆、利尿
3285,解毒、散结、疏散、风热
3286,解毒、利水、消肿、通淋
3287,调经、解毒、活血、凉血、止血、清热
3288,解毒、利湿、泻火、健脾
3289,抗肿、抗瘤
3290,益气、温中、利水
3291,止血、安胎
3292,排脓、止痛、消肿
3293,散血、止血
3294,利咽、消肿、退翳、明目、清热
3295,利水、通淋
3296,解毒、敛疮
3297,和胃、安胎、利水、通乳、下气、健脾
3298,益气、生津
3299,生肌、解毒、止血、清热
3300,益血、行气、止痛、化痰、利湿、补脾、明目
3301,利咽、凉血、清热
3302,解毒、利湿、消肿、清热
3303,解毒、凉血、清肺、止咳、止血、清热
3304,提高免疫功能、化疗的毒副反应、降低血脂、减轻癌症放疗
3305,明目、利水、清热
3306,消积、除胀、散瘀、解毒
3307,散瘀、生肌、止痛、止血
3308,透疹、清热、发表、止痒、祛风
3309,生肌、敛疮、燥湿、清热
3310,润肺、解毒、散结、活血、消肿、止咳
3311,祛湿、杀虫、止痒、清热
3312,散热、散风、杀虫
3313,祛湿、解毒、杀虫、消肿、止痒、清热
3314,散瘀、胜湿、透疹、活血、发表、祛风
3315,解毒、止痛、消肿、清热
3316,止血、敛疮
3317,消疳、止痛、清肺、止咳、止血、健脾
3318,活血、止血
3319,玫毒、止痛、杀虫、消肿、止痒、祛风
3320,凉血、解毒、清热
3321,利湿、清热
3322,活血、通络
3323,泻火、解毒
3324,驱虫、解毒
3325,益胃、利水、消肿、补脾
3326,熄风、解毒、平肝、清热
3327,止痛、催产
3328,杀虫
3329,活络、健脾、舒筋、附温
3330,解毒、凉血、止血、清热
3331,清湿热、解疮毒
3332,驱虫、解毒、止血、清热
3333,解毒、凉血、利湿、止血、清热
3334,安神、养心
3335,利小便、祛风湿
3336,活血、止痛、壮骨、利关节、壮筋
3337,除湿、活血、舒筋、祛风
3338,解毒、泻火、燥湿、清热
3339,解毒、活血、杀虫、止血
3340,止痛、活络、祛风
3341,祛瘀、祛湿、解毒、活血、止痛、利尿、止血、清热
3342,解毒、止痛、杀虫、消肿、清热
3343,除湿、解毒、消热、祛风
3344,止渴、养血、润燥、清热
3345,生发、润肤、祛风
3346,解痉、止痛、消肿
3347,解毒、和胃、破积
3348,健中、解毒、消肿、和胃
3349,解毒、凉血、利尿、通淋、止血、清热
3350,解毒、活血、利尿、清热
3351,解毒、活血、利尿、通淋、消肿、清热
3352,除湿、消食、发汗、杀虫
3353,凉血、舒筋、解毒
3354,解毒、凉血、利湿、消肿、止血、清热
3355,泻火、解毒
3356,散瘀、解毒、消肿、祛风
3357,解毒、醒神、敛疮
3358,解毒、利水、消肿、清热
3359,燥湿、解毒、清热
3360,解毒、活血、止血、化瘀
3361,明目、清热
3362,熄风、散结、平肝、凉血、通淋、除热、消痰、止血
3363,除湿、解毒、祛风
3364,止渴、解毒、催生断片、生津、清热
3365,除湿、理气、散寒、祛风
3366,解毒、散结、化痰、消肿、利尿、清热
3367,除湿、散结、消痈、祛风
3368,清肺、化痰、通淋、利尿
3369,生肌、解毒、收敛、清热
3370,生津、清热
3371,疏风、凉血、退翳、明目、止血、清热
3372,燥湿、止痒
3373,行气、健胃、消食
3374,导滞、调中、行气、止痛
3375,滋阴、润肺、止咳、养胃
3376,强筋骨、通络、利水、行气、活血、消肿、补肝肾、祛风
3377,通脉、活血、利尿、清热
3378,通络、活血、行气、止痛、散寒、祛风
