0,清热、利湿
6023,通经、解毒、活血、利尿、通淋、清热
6024,凉血、止血
6025,祛瘀、解毒、消肿
6026,平喘、解毒、止咳、清热
6027,解毒、敛疮、止痛、清热
6028,健胃、消食
6029,活血、接骨
6030,调经、活血、理气、健脾
6031,解蛇毒、祛风湿、强心、利尿
6032,活血、止痛、截疟
6033,消症、化瘀
6034,散瘀、消肿、止咳、止血、清热
6035,祛风散寒解表、消结
6036,除湿、祛风
6037,温中、健胃、理气、散寒
6038,消食、温中、解毒
6039,消积、杀虫
6040,安神、敛疮、镇惊、止血
6041,胜湿、止痛、止痉、祛风
6042,通络、敛疮、平肝、活血、息风、消肿
6043,祛风湿、强筋骨
6044,止血、解毒、活血、消肿
6045,调经、散结、活血、涩精、消肿、止带
6046,调经、解毒、活血、消肿
6047,祛风湿、解毒、杀虫
6048,健胃、理气
6049,散瘀、活血、止痛、消肿
6050,解蛇毒
6051,除湿、活络、舒筋、祛风
6052,调经、解毒、凉血、活血、止血、通络、清热
6053,利水、消肿、清热、解毒
6054,行气、止痛、利湿、清热
6055,除湿、消积、健脾、祛风
6056,滋阴、润肺、生津、养胃
6057,通经、解毒、利水、清热
6058,下骨鲠、解毒、清热
6059,解毒、散结、消肿、清热
6060,除湿、活血、行气、祛风
6061,利尿、通淋
6062,祛瘀、利尿、通淋、止血
6063,和胃、利尿、清热
6064,调中、开胃、消肿、利尿
6065,活血、止痛
6066,理气、止痛、散风
6067,利湿、健脾
6068,降压、降血、降脂
6069,利胆、消肿、利尿、清肝
6070,疏肝、利胆
6071,健脾胃、安神、利肝胆
6072,解毒、利湿、消肿、清热
6073,驱虫
6074,安神、凉血、养心、清热
6075,安神、镇静
6076,除湿、通络、活血、舒筋、化瘀、祛风
6077,止渴、润肺、除烦、清胃、明目、镇心
6078,解毒、止咳、止血、清热
6079,调经、化温、活血、止带
6080,调经、散瘀、凉血、消肿
6081,除湿、散瘀、散结、消肿、止血、祛风
6082,利水、解毒、通经
6083,除湿、解毒、活血、祛风
6084,平喘、通络、活血、止咳
6085,调经、养血
6086,敛汗、止泻、解毒、消肿
6087,散瘀、止痛、理气、止血
6088,解毒、散结、补虚、健脾
6089,解毒、利湿、化瘀、祛风
6090,解毒、疏风、清热
6091,定痛、消肿、止血、化瘀
6092,降气、暖肾、温中
6093,活血、祛湿、解毒
6094,止血、利尿、清热
6095,止血、解毒、止痒
6096,清热润肺止咳
6097,止咳、清肺、化痰
6098,止痛、固齿
6099,除湿、适血、止痛、舒筋、祛风
6100,除湿、止泻、止血、祛风
6101,解毒、温中、止痛、消肿、止血、散寒、祛风
6102,温中行气止痛
6103,熄风、去翳、解毒、平肝、止咳、明目、止血、清热
6104,滋阴、宁心、潜阳、补肾
6105,和中、祛湿、发表、清热
6106,利水、止痛、活血
6107,解毒、理气、和胃、清热
6108,解毒、凉血、止血、清热
6109,除湿、散瘀、活血、祛风
6110,消积、解毒、敛疮、健脾
6111,解毒、散结、利尿、通淋、明目、祛风
6112,清肺、化痰、散结
6113,调经、解毒、止血、清热
6114,益肾、敛肺、活血、止血
6115,祛风、解毒、利湿、止痛、清热
6116,解毒、止痛、杀虫、截疟
6117,除湿、行气、涩精、止痛、止带、祛风
6118,解毒、利水、生津、清热
6119,祛风湿、杀虫、止痒
6120,祛风、除湿、止痛、利尿
6121,益肾、补气
6122,温肾、壮阳
6123,驱风、除湿、散瘀、止痛、化痰、止咳
6124,解毒、润燥、补虚、祛风
6125,润肺、泽肌肤、止咳、止带
6126,化痰、消瘿
6127,散瘀、解毒、补血、止血
6128,收涩、敛疮
6129,解郁、安神、养心
6130,益精、助阳、补肾
6131,解毒、凉血、杀虫、通便、消肿、止血、止痒
6132,凉血、止血、通便
6133,散瘀、解毒、消肿、清热
6134,除湿、消食、止泻、健胃
6135,凉血、杀虫、通便、止血、止痒、清热
6136,补肾、养血、益气、益精
6137,填髓、润肺、解毒、泽肤、益阴、清热
6138,止血、接骨
6139,解毒、和络
6140,解毒、通络、活血、利湿
6141,解毒排脓消痈
6142,解毒、清热
6143,敛肺、定喘、生津、涩肠
6144,益精、补肾
6145,解表、清热
6146,燥湿、散寒
6147,解毒、润燥、补虚、和胃
6148,养血、温中、益气、壮阳、健脾、补肾
6149,散瘀、活血、利尿、清热
6150,祛瘀、消肿、补虚
6151,缩小便
6152,润肤、健脑、补虚
6153,平喘、止泻、活血、消肿、止咳、止血
6154,解毒、清肠、消肿、止痢
6155,止血、解毒
6156,除湿、祛风、止血、补肾
6157,止血、散瘀
6158,解毒、利湿、消肿、清热
6159,润肺、解毒、消痈、补脾、养肝
6160,解毒、通络、杀虫、祛风
6161,解疮毒、通经络、祛风湿、杀虫
6162,开窍、化痰、镇惊、清热
6163,祛痰、安神、益气、养心、止咳、健脾
6164,解百草毒、止呕、降逆
6165,止血、强筋骨、补肾
6166,明目、养血、补肝
6167,止咳、利水、补肺
6168,活血、止痛、消肿、止血
6169,消食、化痰、理气、和胃
6170,健脾胃、补虚损
6171,解毒、退翳、止咳、明目、清热
6172,润肺、杀虫、止咳、止痒
6173,燥湿、解毒、清热
6174,散瘀、活血、止痛、理气
6175,肺肾、补益、止血、益精
6176,强筋骨、胜湿、祛风
6177,养血、润燥、通便、祛风
6178,活血、平肝
6179,疏风、截疟、解表
6180,生肌、活血、止痛、止血
6181,解毒、活络、凉血、舒筋
6182,解表、平喘、利湿、止咳
6183,解毒、消肿、润肠
6184,散结、润肠、活血、消肿、通便、化瘀
6185,解毒、凉血、散血、消肿
6186,祛痰、宁心、安神、解毒、开窍、消肿
6187,止咳、化痰、解表
6188,利湿、解毒、清热
6189,调经、活血、息风、清热
6190,解毒、活血、消肿、清热
6191,解毒、止痢、化湿、清热
6192,活络、利水、渗湿、祛风
6193,燥湿、止痒、祛风
6194,解毒、行气、活血、止痛、消肿、止血
6195,利水、消肿、敛疮
6196,和中、消食、止血、生津、涩肠、解酒、解烦
6197,止血、化瘀
6198,健胃、宽中、透疹
6199,逐水、玫毒、破瘀
6200,逐水、解毒、散结
6201,祛痰、逐饮、解毒、泻水、杀虫、止咳
6202,消食、开胃、化积、健脾
6203,活血、消肿、利尿、清热
6204,活血、止痛
6205,解毒、清热
6206,定惊、清热
6207,收敛、软坚
6208,解毒、利湿、止痛、消肿、清热、祛风
6209,止痛、解毒
6210,镇惊、解毒、息风
6211,消积、解毒、行水、杀虫、破瘀
6212,理气、温中
6213,止咳、平喘
6214,润燥、利水、滑肠、下气
6215,行气破积、杀虫、清热
6216,辟秽、化湿
6217,疏肝、止能、利胆、活血、解郁、行气、凉血、清心
6218,利湿热、清肺热、解疮毒
6219,活血、降脂
6220,解毒、清热、明目、祛风
6221,排脓、解毒、消痈、利尿、通淋、清热
6222,解毒、止痛、理气、清热
6223,解毒、润肤、和胃、祛风
6224,止血、收敛
6225,强筋、壮骨
6226,杀虫、止痒、散瘀、止痛
6227,开郁、活血、止痛、降逆
6228,鲜毒、利水、通淋、清热
6229,止咳、疏风、清热
6230,除湿、解毒、活血
6231,定喘、止痛、通淋
6232,利湿、解毒、清热
6233,解毒、清热
6234,止咳、平喘、祛痰
6235,消瘀、解毒、利水、通淋、止血、清热
6236,散瘀、消肿、补肝肾、养、血止血
6237,祛瘀、消肿
6238,除湿、解毒、活血、祛风
6239,催吐、截疟
6240,解毒、凉血、止血、清热
6241,益肾、止血、健脾
6242,解毒、止痛、秀疹、清热
6243,吐风、利二便、消肿毒、吐痰
6244,解毒、杀虫、消肿、清热
6245,消积、驱虫、利水、化痰、下气
6246,解毒、消肿
6247,解毒、利湿、消肿、清热
6248,解毒、散结、利湿、清热
6249,行气、杀虫、润肠
6250,止血、收敛、解毒
6251,解毒、活血、止痛、消肿、理气、清热
6252,破血、散结、行水、化痰
6253,缓中、润燥、补虚、生津
6254,定喘、敛肺
6255,益肾、活血、健脾、祛风
6256,调经、解毒、止痛、清热
6257,庋显、解毒、止痒
6258,除湿、祛风
6259,消积、散瘀、明目、清肝
6260,安神、通络、养心、祛风
6261,凉血、止血
6262,祛瘀、行气、止咳、止带
6263,补充痰止咳、解毒、涩精、利湿、清热、健脾、补肾
6264,解毒、利湿、止咳、止血、清热
6265,除湿、平喘、止痛、止咳、散寒、祛风
6266,舒筋活血止痛
6267,除湿、活血、止痛、祛风
6268,强筋骨、生肌、益气
6269,调经、止泻、活血、祛风湿、收敛
6270,理气、消食
6271,止咳、平喘
6272,除湿、通经、活络、祛风
6273,平喘、祛瘀、接骨、活血、止咳
6274,解毒、活血、利湿、消肿、止血
6275,活血、止痛
6276,凉血、解毒、清热
6277,除湿、养血、止血、舒筋
6278,除湿、解毒、止痛、消肿、清热、祛风
6279,燥湿、解毒、清热
6280,镇痛、止血
6281,凉肝、疏风、止血、清热
6282,解表、解毒、消肿、祛风
6283,疏风、活血、止痛、清热
6284,止咳、固脱、解毒
6285,散瘀、生肌、活血、止血
6286,止血、解毒、敛疮
6287,平喘、通络、活血、止咳、散寒、祛风
6288,解毒、止痛、消肿、清热
6289,解表、解毒、活血、截疟
6290,消积、化食、散风、止咳
6291,解毒、活血、祛暑、清热
6292,调经、疏风、行气、活血、止痛、发表
6293,解毒、止痛、利湿、止血、清热
6294,行气、止痛、温中
6295,除湿、祛风、消肿、清热
6296,敛肺、解毒、定惊、利湿、止咳、清热
6297,解毒、利水、通淋、清热
6298,解毒、疏散、风热、活络
6299,解毒、平肝、利尿、镇惊、止血、清热
6300,生肌、止泻、健胃、止血
6301,行气、止痛、止泻痢
6302,排脓、解毒、活血、清热
6303,止咳、止血、滋补强壮
6304,涩肠、止血、止带
6305,解毒、行气、止痛、消肿
6306,宽中、消食、平喘、化痰、止咳、理气
6307,行气、止痛、化痰
6308,疏肝、止咳、理气、宣肺
6309,醒酒、消食、化痰
6310,胜湿、祛风
6311,解毒、散结、止咳、清热
6312,降压、止痛、消肿、清热
6313,止咳、止血、清热
6314,润肠、通便
6315,活血、解毒、通络
6316,润肠、通便
6317,解毒、消肿、散结
6318,解毒、活血、止痛、祛风
6319,平顺、止搐、解痉、止痛、止咳、麻醉
6320,强心、利尿
6321,除湿、温中、活血、止痛、理气、祛风
6322,除疳、消积
6323,祛瘀、解毒、止痛、燥湿、清热
6324,解毒、杀虫、截疟、清热
6325,解毒、消肿
6326,散结、活络、消肿、舒筋
6327,镇痛、止血
6328,解毒、消肿、杀虫
6329,除湿、活血、止痛、祛风
6330,祛痰、平喘、镇咳、止痢
6331,凉血、止血
6332,清热、祛风
6333,消痈、祛风湿、消肿、补肝肾
6334,通络、活血、止痛、祛风
6335,清热、利小便、祛风
6336,解毒、涩精、消肿、止血、壮阳、补肾
6337,解表、解毒、清暑、利湿
6338,暖肾缩尿固精、温脾止泻摄涎
6339,调经、解毒、活血、消肿、利尿、清热
6340,解毒、补中、杀虫、益气
6341,散瘀、解毒、止痛、消肿
6342,温肾、缩尿、通络、疏风、活血、止咳
6343,敛汗、降火、润肺、化痰、止痢、生津
6344,解毒、收敛、止咳、止血
6345,解毒、敛疮、清热
6346,敛汗、降火、润肺、化痰、止痢、生津
6347,解毒、活血、止痢、清热
6348,解毒、消肿
6349,止血、解毒、补虚
6350,解毒、利水、消肿、清热
6351,祛风、除湿、清热、解毒、消痈、排脓
6352,补血、解毒
6353,missing
6354,利水、消肿
6355,明目、利湿、清热
6356,利咽、解毒、利湿、清肺
6357,解毒、凉血、利尿、清热
6358,滋阴、止泻、平肝、清肺
6359,除湿、散瘀、止痛、祛风
6360,利湿、解毒、清热
6361,发表
6362,顺气、消积
6363,解毒、利湿、止痛、止咳、化瘀、祛风
6364,解毒、清热
6365,祛风、活血、利水、消肿、清热、解毒
6366,明目、乌发、解毒
6367,健胃、润肺、补虚
6368,除湿、解毒、活血、行瘀、祛风
6369,解毒、活血、止痛、清热
6370,祛风湿、强筋骨
6371,和胃、散结、化痰、消肿、止咳、止呕
6372,驱虫、止痢、清热
6373,利尿、清热
6374,清虚热、除疳热
6375,活血、祛瘀、止痛
6376,调经、活血、消肿、拔毒
6377,散瘀、止血
6378,除湿、调经、活血、清热、止痒、祛风
6379,解毒、和胃
6380,止血、止带
6381,润肌、解毒、补五脏、润肤、祛风
6382,生肌、解毒、托疮
6383,熄风、解毒、镇惊、清热
6384,生肌、解毒、镇惊、清热
6385,调经、活血、凉血、清热
6386,凉血、活血、止痛、利湿、消肿、止血
6387,行气、止痛
6388,散瘀、解毒、消肿、清热
6389,补气、止血
6390,止咳、清肺、利咽
6391,止泻、敛肺、镇痛、止咳、涩肠
6392,解毒、透疹、止痛、利尿、消肿、止咳、理气、发表
6393,行气血、消肿毒、止痛
6394,祛风、解毒、活血、清热
6395,散结、行气、止痛、消肿、散寒、祛风
6396,止痒、祛风
6397,行气、利湿、退翳、祛风
6398,止痛、祛风
6399,解表、消热、利湿、祛风
6400,解毒、活络、清热、祛风
6401,除湿、通经、平喘、止泻、止痛、止咳、祛风
6402,明目、利尿、清肝
6403,润肺、补肾
6404,解毒、收敛、止血、清热
6405,解毒、透疹、升举清阳、发表、清热
6406,利水、解疮毒、祛风
6407,止泻、解毒、敛疮、活血、收敛、止血
6408,散瘀、定痛、消肿、止血
6409,解毒、脾胃、调和、清热
6410,通经、活血、下乳、止血
6411,活血、止血、解毒、消积、利湿、清热
6412,活络、舒筋、散寒、祛风
6413,散瘀、解毒、清湿热、杀虫、理气
6414,消积、开胃、解毒、凉血、利湿、清热
6415,定风痫、壮骨、壮筋
6416,利水、通淋
6417,止渴、解毒、消肿、生津、补脾、健胃
6418,利湿、止血、驱蛔、清热
6419,解毒、收敛、止血、清热
6420,利水、退热、根截疟
6421,祛痰、解毒、催吐、消肿
6422,解毒、清热
6423,安神、利尿、抗痨、健脾
6424,解毒、截疟、清热
6425,温肾、止痛、理气、壮阳
6426,除湿、解表、散瘀、疏风、行气、消肿
6427,解毒、解暑、消肿、清热
6428,益胃、明目、健脾、清热
6429,除湿、通络、活血、祛风
6430,除湿、解毒、止痛、散寒、祛风
6431,温中、止痛、杀虫、止痒
6432,凉肝、解毒、化滞、止血、健脾、清热
6433,止咳、利尿、清热
6434,消食、温中、健胃、理气
6435,敛疮、润肠、杀虫、通便
6436,温肾、润肺、化痰、润肤、通便、助阳
6437,通经络、祛风湿、止痛、消肿
6438,解毒、清热
6439,解毒、清肠
6440,除湿、通经、散结、活血、化瘀、祛风
6441,止咳、平喘
6442,解毒、止痛、消肿、清热
6443,调经、解毒、活血、清热
6444,平喘、散瘀、镇咳、止痛
6445,利尿、通淋、止血、清热
6446,敛汗、止痛、舒筋、清热
6447,目渴、提神、利尿、清热
6448,行气、止痛、化湿、祛风
6449,解毒、发表、截疟、清热
6450,missing
6451,消肿、止带、清热、解毒
6452,和中、解表、退热、化湿
6453,截疟、清热
6454,理气、和中、止血
6455,解毒、利湿、通淋、止血、驱蛔、清热
6456,祛风通络止痛
6457,散瘀、解毒、退翳、消肿、明目、清热
6458,解毒、清热
6459,理气、止痛
6460,利水、散结
6461,止痛、祛寒、温经
6462,利湿、解毒
6463,止泻痢
6464,利小便、除烦热、生津液
6465,强壮、补虚
6466,滋阴、解毒、散结、软坚、杀虫、潜阳
6467,解毒、祛风
6468,解毒、清热
6469,熄风、止痛、消肿、镇惊
6470,益肾
6471,解表、通络、疏风、利湿、止痛
6472,解毒、利尿、通淋、清热
6473,调经、解毒、利尿、清热
6474,调经、散瘀、润肺、止咳
6475,退黄、解毒、利湿、止痢、清热
6476,利咽、解毒、消肿、止血、清热
6477,理气、和胃
6478,通经、散瘀、利尿、清热
6479,杀虫、敛疮、止痒
6480,消疳、杀虫、益气、健脾
6481,止痛、利湿、止痒、祛风
6482,生津、止血、利尿
6483,益肾、补脾、催乳
6484,止痛、止血
6485,壮骨、舒筋、祛风
6486,活血、益气、补虚、舒筋
6487,解毒、截疟、清热
6488,解毒、止痛、清热、祛风
6489,利尿、通淋
6490,行气、杀虫、温中
6491,杀虫
6492,补骨髓、固筋脉
6493,安神、清热、利水、消肿、杀虫、健脾
6494,疗疮、定惊、利尿、清热
6495,凉血、利湿、止痢、清热
6496,祛痰、解毒、利水、消肿、通淋
6497,祛风、散瘀、杀虫、止咳、清热
6498,行气、止痛、明目、清肝
6499,益肾、除湿、养血、补虚、理气、壮阳
6500,除湿、通络、止痛、祛风
6501,解毒、活血、利湿、清热
6502,活血、通脉
6503,开胃、润燥、除热、厚肠
6504,敛肺、固肾、止痛、涩肠
6505,开胃、利水、健脾、清热
6506,止咳、温中、行气、去斑
6507,透疹、消瘤去瘢、行气、止痛、发表
6508,调经、杀虫、益气阴
6509,益肾、补血
6510,止泻、健脾
6511,止咳、化痰
6512,消食、活血、通乳、化瘀
6513,散瘀、胜湿、疏风、止痛、化痰、止咳
6514,润肺、养阴
6515,气血、温中、散寒、补益
6516,排脓、除痹、利湿、舒筋、健脾、清热
6517,种湿、杀虫、通淋、清热
6518,益气补中化痰止咳、养阴、润燥
6519,消积、驱虫、续盘骨、祛风湿
6520,止汗、固表、收敛、止血
6521,补虚、和胃、健脾、益精
6522,消积、祛痰、驱虫、利尿
6523,除湿、解毒、止痛、清热、祛风
6524,调经、解毒、活血、清热
6525,止血、化痔
6526,解毒、消痈、利湿、清热
6527,解毒、散结、清热
6528,截疟
6529,除湿、通络、活血、祛风
6530,明目、退翳
6531,熄风、滋阴
6532,祛风湿、续骨、续筋
6533,散瘀、解毒、利湿、祛风
6534,滋阴、润燥
6535,活血、通络
6536,止血、敛疮
6537,利、滋阴、开胃、补虚、下乳、健脾
6538,散瘀、解毒、敛疮、止痛
6539,祛寒湿、消冷积、杀虫、蚀恶肉
6540,解毒、升高血小板、杀虫、通淋
6541,调经、止咳、补虚
6542,解毒、退翳、明目、清热
6543,散寒、补虚
6544,温中、壮骨、健脾、壮筋
6545,祛湿、解毒、消肿、止血、清热
6546,解毒、利湿、消肿、清热
6547,生津、止渴
6548,解毒、清热
6549,止咳、降逆
6550,调经、止带
6551,解毒、杀虫
6552,解毒、杀虫、理气、化湿
6553,止血、解毒、止痢
6554,益气、健脾
6555,和中、解表、止泻、祛风
6556,驱虫、解毒、清热
6557,活血、止痛
6558,强筋、补肾
6559,行气、活血、止痛、祛风
6560,解毒、凉血、利尿、清热
6561,散瘀、开胃、解毒、消肿、止血、健脾
6562,止血、接骨
6563,利尿、解毒、清热
6564,祛湿、清热
6565,解毒、活血、止痛、清热
6566,止血、消炎
6567,行血、散毒
6568,行气、杀虫、止痢
6569,清湿热、止痢
6570,止咳、化痰、补肺
6571,解毒、活血、止痛、清热
6572,凉血、降压
6573,利水、消肿、清热、解毒、凉血、止血
6574,续筋、散瘀、接骨、止痛
6575,解表、通络、疏风、治血
6576,清肺、利尿、止咳、清热
6577,除湿、益气
6578,解毒、利水、化瘀、清热
6579,解毒、清热
6580,解毒、消肿、利尿、清热
6581,益肾、调经、补肺、清肺、止咳、止血
6582,解毒、定喘、止咳、清热
6583,平喘、散瘀、利水、止痛
6584,温中、活血、止痛、理气、散寒、祛风
6585,驱虫、温中、止痛、燥温、散寒、止痒
6586,活血、祛风湿、清热祛痰止咳、舒筋
6587,解毒、止务、清热
6588,止血、化痰、通络
6589,除烦、利尿、生津、清热
6590,祛风湿、止痹痛
6591,益气、固脱
6592,补气、润肺、利湿、养阴、止咳、清热
6593,除湿、解毒、止痒、祛风
6594,安胎、除烦、凉血、化痰、止呕、清热
6595,消食、润肺、解毒、活络、健腺、止咳、舒筋、清热
6596,滑痰、降火、利窍、清热
6597,温补肾阳
6598,解毒、清热
6599,解毒、除烦、利尿、清心
6600,消痈、祛风湿、止痛、消肿、散寒
6601,解毒、敛疮
6602,利咽、解暑、生津、清热
6603,解毒、消肿、去瘀、清热
6604,散瘀、解毒、利水
6605,解毒、消肿、利尿、止血、清热
6606,强壮、祛痰、散瘀、止痛、消肿、补虚、止咳、止血
6607,解毒、补中、杀虫、益气
6608,活血、利湿、化痰、止咳、祛风
6609,祛瘀、活血、清肺、养阴
6610,化痰、定惊、清热
6611,解毒、敛疮、去湿、清热
6612,去湿、解毒、敛疮
6613,除湿、祛风
6614,止血、接骨
6615,生肌、排脓、解毒、止痛
6616,解毒、祛风
6617,止渴、养阴、益气、清热
6618,解毒、止痛、理气、清热
6619,除湿、止血、解毒
6620,解毒、活血、止痛、清热
6621,安神、止痛、消肿、止咳、镇静、清热
6622,安神、解毒、明目、镇心、清热
6623,解毒、清热
6624,凉血、化痰、止血、清热
6625,定痛、散瘀、凉血、止血
6626,解毒、消肿
6627,凉血、利湿、止血、清热
6628,祛痰、行水、定喘、下气
6629,除湿、通经、活络、祛风
6630,追风、活络、舒筋、散寒
6631,解毒、凉血、祛风湿、止血、清热
6632,除湿、解毒、通络、活血、消肿、祛风
6633,去腐、生肌、解毒、活血
6634,生肌、活血、祛风湿、止痛、化毒
6635,消斑、祛风
6636,除湿、通络、止痛、祛风
6637,固脱、杀虫、收敛、燥湿
6638,调中、止痛、理气、散寒
6639,益肾、滋阴
6640,祛风湿、止痒
6641,解毒、清热
6642,散瘀、解毒、凉血、消肿、止血
6643,回乳、散瘀、解毒、安胎、凉血、利尿、止血、清热
6644,散瘀、解毒
6645,安胎、解毒、凉血、利尿、止血、清热
6646,透疹、除烦、凉血、清心
6647,散瘀、解毒、止痛、清热
6648,消积、平肝、利湿、消肿、补血、镇心、健脾
6649,驱虫
6650,滋阴、强筋、壮骨、补虚
6651,除湿、止痛、解热、祛风
6652,透脓、搜风、杀虫、消毒
6653,散热、散结、润肠、化痰、通便、祛风
6654,生发、解毒、祛风
6655,通闭、祛痰、散结、开窍、杀虫、止咳
6656,理气、和胃
6657,散瘀、消炎、消肿、止咳
6658,除湿、散瘀、解毒、活血、清热、祛风
6659,解毒、清热
6660,解表、疏风、止痒、清热
6661,平喘、解毒、消肿、泻火
6662,滋阴、止渴、除烦、润燥、泻火、清热
6663,散瘀、活血
6664,散寒、解表
6665,益气、收敛、明目、清热
6666,解毒、消肿、利尿、清热
6667,解毒、消肿、利尿、通淋
6668,解毒、明目、清肝、清热
6669,益肾、通脉、止咳、下乳
6670,祛风湿、益肾气
6671,利水、渗湿、通淋、泄热
6672,解毒、清热
6673,解毒、行水、化痰、消肿、杀虫、止咳
6674,解毒、活血、行水、消痈、消肿、化瘀
6675,解毒、清热
6676,止泻、镇咳、涩肠、止血
6677,调经、止泻、止痛、补脾、止血、祛风
6678,解毒、敛疮
6679,解毒、消肿、止痢、止咳、清热
6680,解毒、利湿、消肿、清热
6681,催产
6682,散瘀、解毒、消肿、清热
6683,利湿、催产、清热
6684,散瘀、解毒、催产、利湿
6685,生津、止痉、止渴
6686,散瘀、通络、止痛、祛风
6687,止痛、解毒、清热
6688,解毒、活血、止痛、清热
6689,通络、活血、止痛、祛风
6690,调经、解表、解郁、化痰、止咳、祛风
6691,解毒、截疟
6692,止泻、收敛
6693,调经、活血、利尿、清热
6694,活血、散瘀、止痢
6695,解毒、清热
6696,强筋骨、补气、利水、祛风湿
6697,壮元阳、下乳汁、温肺气
6698,活血、清心火、通络
6699,除痞、消积、化痰、破气
6700,通络、化痰、息风、止痉
6701,missing
6702,止渴、解酒毒、利大小便、除烦、止呕
6703,止渴、解毒、除烦、清热
6704,辟秽、除臭
6705,疗痔、消食、活血、舒筋
6706,活络、解酒、止血、祛风
6707,止痛、敛血
6708,活血、解毒、消肿
6709,息风、清热
6710,止血、收敛
6711,解毒、活血、消肿、清热
6712,凉血、清肺、止咳、止血
6713,凉血、利湿、止血、清热
6714,解毒、除烦、凉血、利湿、泻火、清热
6715,活血、止痛、清利咽喉
