0,清热、利湿
1,祛风、除湿、散寒、止咳
2,散瘀、止痛
3,温经、止血、散寒、止痛、祛湿、止痒
4,温肾、壮阳
5,祛风、活血、利水、消肿
6,祛风、除湿、温中、止泻、活血、解毒
7,解毒
8,活血、通络、镇痉、祛风
9,温脾、安胎、益气、升提
10,解毒、清热、燥湿、泻火
11,散寒、止痛、利湿、解毒
12,行气、消积、杀虫
13,消积、化症、杀虫、截疟
14,滋阴、润燥、补血、止血
15,清热、降火、排脓、止咳
16,化湿、消暑、和中、行气
17,栽疟、健胃、理气、止痒
18,除湿、活血、散瘀、祛风
19,祛湿、行瘀、通经
20,舒筋、活络、接骨、止痛
21,通络、止痛、收敛、涩肠、止泻、止血
22,敛肺、止咳、涩肠、止泻
23,除湿、通络、散寒、祛风
24,解毒、活血、止痛、清热
25,解毒、利湿、消肿、清热
26,解毒、活血、止痛、清热
27,祛风湿、活血、止痛
28,降火、清热
29,解毒、泻火、止血、清热
30,清热、祛风
31,解毒、散结、止痛、清热
32,软坚、散结、利小便、活血、止痛、疏肝、和胃
33,活血、通脉、行气、利湿、止痛、清热
34,舒筋、活络、截疟、祛风、除湿
35,利尿、通淋、解毒、止痛、消肿、清热
36,除湿、散瘀、止痛、祛风
37,散瘀、解毒、杀虫
38,止咳、平喘、解毒、清热
39,祛瘀、解毒、化痰、散结、止痛、清热
40,除湿、散风、化痰、止咳、止痛、化瘀
41,理气、止痛、散寒
42,理气、止痛、散风
43,除湿、舒筋、活络、散瘀、止痛、祛风
44,通络、活血、利湿、消肿
45,调经、祛瘀、通络、止痛
46,除烦、利尿、清肺、止咳、清热
47,益肾、调中
48,定痛、止咳、止血、清热
49,散瘀、解毒、消肿、清热
50,活血、清热
51,除湿、强筋、壮骨、补肾、助阳、祛风
52,通关、开窍、峻下、寒积
53,解毒、活血、杀虫、祛风
54,解毒、温中、杀虫、镇痛、散寒、祛风
55,温中、消积、解毒、杀虫
56,蚀疮、泻下寒积、逐水、退肿、杀虫、祛痰、利咽
57,明目、调经、补肾
58,润肠、通便、活血、化瘀
59,解毒、清热
60,解毒、杀虫、止血、清热
61,消积、杀虫、止血、清热
62,解毒、活络、清热、祛风
63,活血、解毒
64,逐水、利尿
65,养阴、清肺、益胃、生津
66,明目、清肺、解毒
67,解毒、止痛、消肿、清热
68,解毒、止痛、利湿、消肿、清热
69,祛瘀、解毒、止痛、化痰、散结、清热
70,解毒、利湿、止痛、消肿、止痒、清热
71,除湿、散瘀、通络、祛风
72,降逆、止呕、消痞、散结、燥湿、化痰
73,利湿、解毒、清热
74,健胃、消食
75,杀虫、截疟、祛风湿、补肝肾、活血、调经
76,活血、止血
77,除湿、通络、活血、祛风
78,解毒、消肿、清热
79,调经、解毒、消肿、止血、发表、祛风
80,解毒、接骨、利湿、消肿、清肝
81,解毒、凉血、利湿、消肿、止血、清热
82,利湿、清热
83,解毒、利水、消肿、清热
84,祛风湿、通经络
85,解毒、凉血、止血、清热
86,止泻、收敛
87,益肾、宁心
88,利水、解毒、清热
89,除湿、通络、止痛、祛风
90,解毒、止痛、理气、清热
91,解毒、祛风
92,除湿、排脓、止痛、通窃、消肿、祛风
93,除湿、平喘、散瘀痛、止咳、祛风
94,missing
95,missing
96,missing
97,解毒
98,驱虫、消肿
99,行气、活血、化湿、祛风
100,健脾、行水、开胃、消食
101,清热利尿通淋
102,散瘀、解毒、止痛、止血、清热
103,散热、散风、利水湿、定喘咳
104,消积、化痰、杀早、清热
105,解毒、凉血、止痛、清热、止血、祛风
106,祛风湿、止痛
107,消积、解毒、敛疮、行气
108,解毒、敛疮、止痛、祛风
109,祛风、驱虫、活血、利湿、清热
110,利温、驱虫、止咳、清热
111,消肿、补益、气阴、利水
112,解毒、行气、活血、止痛、清热、祛风
113,利湿、解毒、清热
114,补气、益肺、健脾
115,解毒、清热、燥湿、止痒、祛风
116,被肾壮阳、舒筋、活血、益肺、健脾
117,疗疮、解毒、利尿、通淋、益阴、清热
118,解毒、利湿、消肿、清热
119,解毒、活血、利湿、祛风
120,解毒、止痛、利尿、消肿、泻火
121,杀虫、解毒、清热
122,解毒、凉血、杀虫、止痢、燥湿、清热
123,散瘀、解毒、活血、杀虫
124,解毒、调气、散结、清热、止痒、祛风
125,润肠、乌发
126,润肺、宽肠、消痰、下气
127,疏风、宣肺、理气、消食、解鱼蟹毒
128,消食、安胎、止痛、顺气
129,止咳、平喘、祛痰
130,安胎、止汗、利水、益气、燥湿、健脾
131,清热解毒消肿
132,强筋骨、疗疮、消食、解毒、益精血、补肝肾、健脾
133,固脱、敛疮、收湿、涩肠、止血
134,涩肠、止血
135,除湿、杀虫、祛风
136,凉血、明目、解毒、益精
137,解表、升阳、清热
138,缓急、养血、和营、止痛、敛阴、平肝
139,调经、活血、化痰、止咳
140,消食、化滞、止泻
141,和中、缓急、润燥、生津
142,理气、解毒、通便
143,理气、利湿、解毒
144,活络、舒筋、散寒、祛风
145,散瘀、解蛇毒、止痛、止血
146,解毒、利尿、止咳、镇病
147,利尿、通便、清热
148,驱虫、消食、截疟
149,泻肺、降气、下痰、止嗽
150,通络、止痛、杀虫、理气、祛风
151,止痛、利湿、止痒、祛风
152,鲜毒、凉血、止血、清热
153,消食、杀虫
154,生肌、止血
155,解毒、活血、消肿、通淋、泄浊、化瘀
156,生肌、解毒、止血、清热
157,行气、定喘、止痛、止咳、散寒、祛风
158,解毒、行气、利湿、消肿、散寒、祛风
159,补肾
160,解毒、润燥、通便、清热
161,散瘀、活血、行气、止痛
162,除痰、开噤、消疮、止血、涩肠、止泻、利咽、生津
163,止血、解毒
164,止血、定痛
165,凉血、利尿、通淋、生津、止血、清热
166,解毒、凉血、散血、化痰、止咳、清热
167,凉血、止血
168,解毒、止痛、消肿、清热
169,解毒、利湿、消肿、清热
170,除湿、解毒、通络、活血、清热、祛风
171,止咳、固精
172,补肾阳、益精气
173,祛风、解毒、利湿、清热
174,化痰、和胃、敛疮
175,消积、止泻、利湿
176,平喘、排石、利湿、通淋、止咳、清热
177,调经、利水、活血、清热
178,利湿、止血、清热
179,散瘀、解毒、敛疮、消肿
180,和中除烦止渴、益气
181,消痈、清热
182,生肌、解毒、散结、敛疮、止痛、清热
183,消积、解毒、明目、理气
184,理气活血止痛
185,除湿、解毒、敛疮、活血、消肿、清热
186,行气、活血
187,燥湿、清热
188,化痰、利尿、止咳、清热
189,行气、止咳、化湿
190,除湿、解毒
191,行气、开胃
192,止咳、润肺、生津
193,止痛、化痰、清热、祛风
194,补中、托毒、益气、消肿
195,逐饮、散结、化痰、消肿
196,利气、温中、化痰、散寒
197,续筋、解毒、接骨、利尿、消肿、止血、化瘀、清热
198,蚀腐、溃脓、消痈、杀虫
199,清热、解毒、镇咳
200,生肌、消肿、收敛、止血
201,凉血、止血
202,解毒、利湿、消肿、清热
203,解毒、凉血、消肿、清热
204,止咳、和血、散瘀
205,除湿、散瘀、活血、清热
206,止咳、散结、清肝
207,除湿、活血、止血、祛风
208,解毒、活血、止痛、消肿、止咳、清热
209,定惊、祛风
210,疏风、定惊
211,除湿、散瘀、止血、祛风
212,续伤、散瘀、活血、止痛
213,退黄、解毒、利湿、清热
214,活络、止痛、舒筋、祛风
215,清心、安神
216,除湿、解毒、活血、行气、消肿、祛风
217,散热、散风、调肠、调胃、宣肺气
218,利湿、清热
219,活血、止痛、散寒、祛风
220,除湿、祛风、解毒、清热
221,祛风湿、舒筋络
222,润肺、杀虫、止痒、清热
223,除湿、清肺、止咳、祛风
224,解毒、敛疮、收湿、清热
225,凉血、利湿、止血、清热
226,活血、养心、敛肺、涩肠
227,祛风湿、强筋骨、催乳
228,益气、补虚
229,定喘、止带、缩尿、敛肺
230,通络、活血、利湿、祛风
231,祛瘀、活血、散寒、祛风
232,除湿、活血、止痛、祛风
233,杀虫、燥湿、止血、止痒
234,止血、解毒
235,祛痰、通经络、解毒、镇痛、祛风
236,止痛、消肿
237,祛风湿、清湿热、止痛、化瘀
238,祛痰、解毒、止泻、杀虫、燥湿、止血
239,解毒、利水、通淋、清热
240,暖肾、温中、敛疮、涩肠、止血
241,润皮、润肤、解毒肿
242,疗疮、通络、止痒、祛风
243,活血、通络
244,除湿、散风、止痛、止咳
245,消食、开胃、温中、行气、化湿、止呕
246,安神、利湿、止血、清热
247,解暑、清热
248,解热、抗疟
249,解毒、消肿、清热
250,清肺、止咳、解毒、消肿
251,凉血、利尿、止血、清热
252,强筋、壮骨、益损、补虚
253,消暑、化湿、健脾
254,利小便、祛风湿
255,消瘀、祛湿、收涩、清热
256,祛湿、解毒、止血、清热
257,解毒、活血、止痛、清热
258,凉血、活血、止痛、止血、清热
259,解毒、活血、利湿、清热
260,利尿明目退翳、清热
261,滋阴、解毒、润燥、清肺、消肿、补肾
262,润肺、止咳、和胃、健脾
263,利湿、清热
264,平喘、利湿、止血、清热
265,除烦、解渴、退热、消暑
266,润肺、止泻、化痰、生津、止血、解热
267,散瘀、解毒、止痛、化湿、和胃、清热
268,敛汗、止血、补虚
269,益血、补气、止痛、杀虫
270,行气、活血、通乳
271,利湿、解毒、清热
272,利湿、解毒、清热
273,止渴、补虚、清热
274,除湿、平喘、通络、活血、祛风
275,利咽、祛痰、解毒、活血、利湿、清热
276,解毒、利水、止痛、通淋、清热、祛风
277,祛风、解毒、利尿、清热
278,除湿、通经、活络、定惊、搜风、止痛
279,凉血、清热
280,宁心、安神、润肺、清热
281,安神、润肺、养阴、清心
282,消积、止血、清毒散火
283,润肺、杀虫、灭虱、止咳
284,散瘀、生肌、接骨、活血
285,止痛、消肿、止血、化瘀
286,温脾、平喘、止泻、纳气、助阳、补肾
287,散瘀血、续筋、祛风湿、续骨
288,利湿、明目、止血、清热
289,解毒、清热
290,解毒、清热
291,和湿、通淋、清热、祛风
292,止渴、填骨髓、润肺、通血脉
293,止渴、解毒、清热
294,解毒、利尿、清热
295,散瘀、止痛、化痰、消痞
296,止渴、解毒、利尿、清热
297,散瘀、解毒、止咳、清热
298,除湿、通经、活血、止痛、化瘀、祛风
299,利咽、活血、止咳、理气
300,解毒、敛疮、活血、消肿
301,散结、消肿、收涩、止痒
302,通乳、益气
303,生津、解酒、醒脾、除烦
304,利胆、清肝、助运、健脾
305,利湿、清肠
306,散瘀、解毒、活血、清热
307,止痛、平肝
308,强筋骨、益气力
309,解毒、通络、活血、消肿
310,利咽、解毒、凉血、清热
311,排脓、解毒、活血、清热
312,解毒、清热
313,燥湿、解毒、止痒
314,解毒、活血、利湿、下乳
315,散瘀、凉血、止痛、清热
316,利咽、清肺、消肿、止血
317,安胎、活血、祛风湿、止痛、补肝肾、下乳
318,止痛、清热
319,除湿、催乳、活血、止痛、祛风
320,化瘀消肿解毒
321,活血消肿止痛
322,活络、舒筋、散寒、祛风
323,止血、解毒
324,散瘀、解毒、止痛、消肿、止血、清热
325,消食、解毒、利水、活血、止痛、杀虫、通便
326,健脾利湿和胃、活血、消肿
327,补益
328,和胃、敛疮
329,生肌、敛疮
330,散热、散风、解毒、明目
331,解毒、止痛、消肿、清热
332,解毒、收敛、止血、清热
333,消积、通经、祛瘀、行气
334,消暑、化湿、健脾、和胃
335,解毒、消肿、消暑、利湿
336,和中、化湿
337,和中、健脾、解暑、化湿
338,消暑、止血、化湿
339,解毒、消肿、清热
340,消食、温中、行气、止痛、降逆、散寒、截疟
341,温中、止痛、散寒、下气
342,祛痰、解毒、化瘀、清热
343,蠲痹、益气、补虚、祛风
344,敛汗、安神、润肠、通便、养心
345,疗疮、驱风、除温、解毒
346,生肌、敛疮、凉血、止血
347,和中、安神、止血、祛风
348,解毒、清热
349,解毒、敛疮、凉血、生发
350,利尿、通淋、明目、止血、清肝
351,止咳、解表
352,消积、化痰、生津、清热
353,散瘀、解毒、止痛、清热
354,杀虫、止痒、祛风
355,补五脏、强筋骨、益气血
356,温中、行水、止痛、理气
357,补血、益心肝、补气
358,强筋骨、安神、祛风湿、镇惊
359,滋阴、解毒、明目、清热
360,止渴、解毒、明目、清热
361,解毒、止血、化瘀、清热
362,解毒、凉血、清肺、化痰、止痢、止血
363,除湿、消疳、通络、化痰、健脾、清热
364,消积、化痰、燥湿、清热
365,止咳、解毒、止痢
366,消食、和胃、止泻
367,平喘、止咳、明目、清肝
368,养血、润燥、平肝、止血
369,祛风湿、利湿浊
370,解毒、收敛、止血、清热
371,利湿、解毒、祛风
372,解毒、消痈、利湿、祛风
373,散瘀、解毒、止痛、杀虫、祛风
374,解毒、凉血、利湿、消肿、止血、清热
375,解毒、止泻、清热
376,利水、杀虫、通淋、止痒
377,补肺、养阴、生津、健脾
378,凉血、透疹
379,除湿、平喘、止咳、止血、祛风
380,润肺、解毒、行气、活血、益气、消肿、止咳、补肾
381,解毒、凉血、止血、清热
382,蚀疮、散结、逐瘀、攻毒
383,止血
384,通窍、通经、利水、活血
385,续筋、接骨、清湿热、解毒
386,祛风湿、壮肾阳
387,润肺、止咳、止痒、祛风
388,生肌、解毒、敛疮、清热
389,明目、益气、补肾
390,发汗、止痛、镇静、解热
391,解毒、消肿
392,补肾阳、壮腰膝
393,角毒、利尿、止咳、清热
394,泻下、导滞、通络、消肿、利窍、拔毒
395,滑肠、润肤
396,除湿、消肿、拔毒、祛风
397,解痉、活血、消肿、祛风
398,除湿、止痛、祛风
399,missing
400,凉血、止血
401,健胃、止咳、止渴
402,消积、驱虫、行水、下气、截疟
403,活血、止血、敛汗、涩精、止痛
404,解毒、行气、止痛、清热
405,解毒、凉血、止血、清热
406,清热解毒利湿
407,解毒、止痛、消肿、清热
408,平喘、解毒、平肝、利水、通淋、止咳、明目
409,平喘、利水、化痰、止咳、宣肺
410,解毒、清热
411,解毒、活血、清热、祛风
412,解毒、清热
413,止咳、润肺
414,疏风、清热
415,疏风、清热
416,散热、散风、清头目
417,散热、散风、清头目、透疹、解郁、利咽喉
418,固精、祛风杀虫止痒、壮阳
419,除湿、通络、舒筋、祛风
420,除湿、解毒、通络、活血、消肿、祛风
421,活络、散结、消肿、舒筋
422,抗癌
423,除湿、活络、舒筋、祛风
424,解毒、通淋、止血、清热
425,清利肝胆
426,解毒、敛疮、止血、清热
427,解毒、定惊、止血、清热
428,解毒、散结、定惊、祛风
429,利湿、解毒、健脾
430,平喘、解毒、利湿、消肿、止咳、清热
431,解毒、利水、消肿、清热
432,解毒、清热
433,除湿、祛风、解毒、活血、止痛、清热
434,滋阴、通络、活血、清热
435,清退虚热、滋阴、补肾
436,滋阴、散结、软坚、退热
437,活血被动瘀、接骨、续筋
438,行气、宽中
439,解毒、杀虫、止痒、祛风
440,固脱、缩尿、补中、益气
441,开郁、祛瘀、活血、行气、止痛、祛风
442,除湿、祛风
443,除湿、行气、止痛、祛风
444,祛瘀、活血、利湿、祛风
445,温中、行气、止痛、和胃
446,通经、利尿、下乳、清热
447,肋运、清肺、养阴、健脾
448,行气、活血、止痛、散寒、温经
449,消积、利湿、杀虫、通淋、止血、清热
450,胜湿、止痛、发表、祛风
451,益肾、固脱、补肝、收敛
452,凉血、解毒
453,利湿、解毒、清热
454,润肺、散结、化痰、消肿、止咳、清热
455,平喘、止痛、止咳、舒筋
456,缓泻
457,凉血、通虚热、清热
458,利湿、健脾、祛风
459,祛痰、止泻、渗湿、利尿、明目、清热
460,解毒、凉血、利尿、清热
461,活血、益气养阴润肺
462,祛风、利湿、止咳、清热
463,凉血、止咳、止血、清热
464,解毒、清热
465,利湿、止咳、止血、清热
466,止咳、化痰、平喘
467,降气、宣散风热、祛痰
468,解毒、止痛、消肿、清热
469,逐饮、泻水
470,祛寒、温中、止痛、健胃
471,除湿、活血、舒筋、祛风
472,明目、解毒、清热
473,解毒、利湿、清热、祛风
474,解毒、平肝、抗癌、清热
475,散瘀、止血、解毒
476,解毒、通络、活血、清热
477,解毒、凉血、止血、清热
478,止咳、化痰、平喘
479,除湿、解毒、活血、祛风
480,调经、补血
481,解毒
482,生肌、止血、定痛
483,解毒、活血、消肿、祛风
484,活血、调经、清热、解毒、通利二便
485,明目、清心
486,除湿、活血、止痛、祛风
487,止渴、缩尿、固肾、明目
488,解毒、利水、行气、消肿、明目
489,利水消肿退黄、清热解毒消痈
490,散瘀、接骨
491,生肌、敛疮、收湿、收敛、涩肠、止血
492,祛瘀、凉血、活血、清热
493,活血、补脾、缓肝、散瘀
494,益肾、解毒、活血、定喘、利湿、消肿、健脾、祛风
495,解毒、收敛、止血、清热
496,续筋、接骨、收敛、止血
497,调经、活血、行气、止痛
498,活血、行瘀、祛风、胜湿、解毒、止痛
499,利咽、祛痰、排脓、清肺
500,利水、消肿
501,止痛、泻火、祛风
502,除湿、止痒、祛风
503,利湿、解毒、消热
504,散热、除湿、解毒、祛风
505,透疹
506,止血、利尿、清热
507,利水、解毒、消肿
508,和脾、止痢
509,补气、通络、止咳、助阳
510,解毒、消肿、止痒、祛风
511,除湿、活血、止痛、杀虫、止痒、祛风
512,除湿、散瘀、解毒、凉血、祛风
513,除湿、活血、止痛、祛风
514,消积、散瘀、止痛、舒筋
515,涩肠、收敛、止痛
516,调经、消食、敛肺、活血、止咳、健脾
517,收涩、止痛、止血、健胃、消食
518,健胃、消食、止泻
519,解毒、消炎、止痛、清热
520,平肝、解郁、明目、祛风
521,燥湿、解毒、清热
522,无
523,止血
524,除湿、利水、活血、止痛、消肿、祛风
525,祛瘀、解毒、凉血、清热
526,燥湿、抗癌、解毒
527,利小便、祛风湿、解疮毒
528,散瘀、解毒、活血、清热
529,宁心、安神、解毒、活络、止痛、消肿
530,散结、软坚、活血、止痛
531,调经、和血
532,解毒、利湿、消肿、清热
533,活血、止痛、泻火、清热
534,解毒、利湿、清热、祛风
535,除湿、舒筋、散寒、祛风
536,追风、活络、壮阳、舒筋、散寒、补肾
537,补气、生津、止渴
538,润澡、解毒、通窍
539,祛风、解毒、散结、平肝、定惊、清热
540,疗疮、解表、解毒、清热
541,除湿、通络、活血、止咳、祛风
542,除湿、祛风、解毒、通络、消肿、清热
543,杀虫
544,滋阴、解毒、生津、清热
545,降火消痰平喘
546,解毒、去积、止痛、杀虫、消肿、燥湿
547,消食、除烦渴、解毒、清头目、化痰、利尿
548,调经、解毒、活血、强心、利尿、清热
549,宽胸、开胃、醒酒、怡神、生津、清热
550,解毒、消肿
551,消积、散瘀、消毒、利湿、止血、下气
552,调经、止疼、活血、理气
553,活血、驱虫、利尿
554,消积、通经络、祛风湿、止痛
555,解表、解毒、利湿、清肺、补虚、健脾
556,消积、平喘、散结、止咳
557,安神、行气、活血、止痛
558,解毒、利水、通淋、清热
559,散瘀、解毒、止痛、清热
560,燥湿温中祛痰截疟
561,散热、散风、利水、活血、截疟、舒筋、健脾
562,温中、行气、燥湿、健脾
563,降血糖
564,祛风湿、通经络
565,散瘀、安神、妥毒、养心
566,解毒、活血、消肿、祛风
567,除湿、散瘀、止痛、祛风
568,解毒、利水、消肿、清热
569,宁心、安神、利水、清热
570,行气、止痛、散寒、祛风
571,行血气、散风、止痛、散寒
572,降压、止痢、祛风
573,除湿、解毒、降压、平肝、杀虫、祛风
574,止痛、解毒、祛风
575,解毒、利水、消肿、祛风
576,平喘、祛痰、镇咳
577,除湿、祛风
578,解表、平喘、化痰、止咳
579,除湿、解毒、疏风、行气、活血、截疟、清热
580,解毒、散结、消肿、清热
581,除湿、解毒、行气、消肿、降血压、健脾、祛风
582,解毒、祛风湿、消肿、降血压
583,解毒、降压
584,强盘骨、祛风湿、活血、消肿
585,活血、解毒、清热
586,祛痰、泻下、解毒、杀虫、止咳、清热
587,祛湿、止痛
588,目咳、止痛、散寒
589,解毒、消肿
590,解毒、消肿
591,利湿、清热
592,祛风、止痛、止痒
593,消肿毒、清湿热
594,祛风、散瘀、解毒、活血、消肿、清热
595,除湿、活血、止痛、祛风
596,散瘀、止血
597,调经、散瘀、活血、止痛
598,解毒、消肿
599,解毒、利尿、止咳、清热
600,解毒、理肺、止咳、清热
601,截疟、滋阴、补虚
602,定惊、祛风
603,消积、定惊、壮骨、益气
604,行气、活血
605,抗癌
606,除湿、解毒、活血、止痛、利尿、祛风
607,鲜毒、清热
608,消积、散瘀、消肿、补虚
609,行气活血止痛、祛风湿
610,消积、解毒、定惊、止痛
611,去腐、生肌、接骨、消肿
612,和胃、温中、理气、止呕
613,行气、止痛、温通经脉
614,止渴、疗疳、杀虫、生津
615,退翳、明目、止血、祛风
616,解毒、消肿、止痢、止血
617,除湿、通经、活血、化浊、和胃、祛风
618,止痛、解毒、透疹
619,疗疮、止渴、解毒、止血
620,止血、解毒
621,利尿渗湿止血、解毒
622,止泻、解毒、敛疮、止血
623,止血、敛疮
624,降平、凉血、止血、止带
625,解毒、利水、消肿、健脾
626,疗伤、接骨
627,散瘀、止血、清热、利湿
628,除湿、清热
629,胜湿、活血、止痛、祛风
630,凉血、止咳、止血、清热
631,解毒、止痛、消肿、清热
632,清热、解毒
633,调经、生肌、明目、止血、清肝
634,解毒、收敛、止血、清热
635,利湿、清热
636,健胃、行气、解毒
637,利咽、解毒、清肺、消肿、止血
638,解毒、清热
639,除湿、祛风
640,祛瘀、活血、止痛、消肿
641,除湿、祛风
642,除烦、补阴、清热
643,消肿、和胃
644,劫痰、截疟
645,调经、强筋骨、活血、补肝肾
646,行气、止痛、强腰膝、补肝肾
647,解毒、平肝、利湿、祛风
648,活血、止痛、化痰、止咳
649,补肾、解毒、养阴、清热
650,舒肝、清泄湿热、利胆
651,散瘀、解毒、清暑、消肿
652,凉肝、润肺、止痛、消肿、止咳、清热
653,凉肝、定惊、明目、祛风
654,通窍、散瘀、驱虫、解毒、止血
655,散瘀、解毒、散寒、祛风
656,明目、温肾、解毒
657,通阳、散寒
658,通阳、解毒、杀虫、发表
659,解毒、凉血、利尿、止血
660,解毒、平肝、利湿、清热
661,利水、止血
662,滋肾、利水、清肝、明目、健脾
663,利水、杀虫、解毒
664,明目、利尿、祛风
665,解毒、疏风、消肿、清热
666,安神、润肠、通便、养心
667,凉血、化痰、止痢、止咳、止血、清热
668,解毒、敛疮、活络、祛风
669,通络、活血、止痛、祛风
670,活络、止痛、舒筋、祛风
671,催乳
672,除湿、祛风、解毒、清热
673,止渴、除烦、利尿、清心
674,missing
675,除烦、凉血、止呕、清热
676,止渴、解毒、止血、清热
677,除烦、定惊、化痰、清热
678,止血
679,下乳
680,明目、解毒
681,滋阴、潜阳
682,利湿、解毒、清热
683,解毒、散结、活血、凉血、通淋、止咳
684,解毒、祛署、杀虫、化湿
685,除湿、行气、止痛、祛风
686,散瘀、解毒、消肿、祛风
687,解毒、利湿、止血、清热
688,燥湿、杀虫、解毒
689,利咽、宣散风热、透疹、退翳、止痉、明目、祛风
690,熄风、透疹、疏散、风热、退翳、止痉、明目
691,解酒、杀虫、生津、涩肠、止血
692,消积、散瘀、解毒、安蛔、止血
693,玫毒、通经、散结、活血
694,杀虫、燥湿、涩肠、止血、止带、清热
695,除烦、止血、止呕、清热
696,消食、杀鱼蟹毒、解酲、化痰、快气利隔、降逆、和胃
