0,清热、利湿
9526,清热、止痛
9527,清热、敛疮
9528,杀虫、疗癣
9529,散风、止痛、祛湿、宣肺、通鼻、杀虫
9530,补中、益气、升阳、举陷
9531,清热、解毒、祛风、除湿
9532,清热、凉血
9533,清热、解毒、清肝火、理气、止痛、杀虫、止痒
9534,消食、导滞、消积、解毒、涩脾、止痢
9535,调经、止血
9536,清热、解毒、活血、止痛
9537,清热、利尿、驱风
9538,清热、利肺、平肝、潜阳、清热、利尿
9539,镇咳、祛痰、平喘、消炎
9540,行水、利湿热、益心、润肺
9541,清热、止痛、泻火
9542,祛风、除湿、解毒
9543,和解、退热、疏肝、解郁、升提、中气
9544,收敛、止血
9545,开窍、宁神、化湿、和胃
9546,健脾、利湿、平喘、散瘀、消肿
9547,退虚热、清疳热
9548,理气、和胃、利肺、化痰
9549,除热、燥湿、涩肠、止血、杀虫
9550,收敛、止血
9551,健脾、补肾、固精、缩尿
9552,祛风、除湿
9553,解毒、消痈、透疹
9554,活血、化瘀、祛风、除湿
9555,健脾、益气
9556,舒筋、活络、止泻
9557,舒筋、活络、活血、化瘀
9558,续伤、接骨
9559,活血、调经、凉血、止痢、利水、消肿、清肺、止咳
9560,清热、利湿、活血、调经
9561,清热、解毒
9562,祛风、除湿、消肿、止痛
9563,清热、解毒
9564,消炎、止血、涩肠、活血、止痛
9565,清热、泻火、凉血、解毒
9566,温肾、壮阳、祛风、除湿、补虚
9567,清热、化痰、宽胸、利气、排痈、消肿
9568,消炎、止痛、解毒、止痉
9569,清肝、明目、凉血、止血
9570,凉血、化瘀
9571,清热、解毒
9572,祛风、强筋骨
9573,清热、解毒、舒肝、和胃、健胃、止痛
9574,涩肠、止痢
9575,清热、解毒
9576,活血、化瘀、解毒、疗疮
9577,散结、祛痰
9578,催乳、解毒、补益精血
9579,清热、解毒
9580,滋阴、润肺、驱蛔、止痛
9581,清热、解毒、凉血、散结、利尿、通乳
9582,泻火、解毒
9583,养胃、生津、滋阴、除热
9584,消肿、散瘀
9585,清热、解毒、消肿、止痛
9586,清热、解毒、淡渗、利尿
9587,凉血、止血
9588,祛风、通络
9589,固肾、缩尿
9590,解毒、消肿
9591,强壮筋骨、活血、祛瘀
9592,温寒、止泄、温寒、止痛、温寒、消瘕
9593,清热、消炎、消肿、止痛
9594,益肾、壮阳、调经、养血
9595,解毒、消肿
9596,敛疮、生肌
9597,温经、止痛
9598,杀虫、解毒
9599,祛风、除湿
9600,温中、散寒
9601,清热、解毒、散瘀、止血
9602,祛风、除湿、祛瘀、止痛
9603,健脾、开胃、消肿、利水
9604,蚀肉、疗疮
9605,解毒、疗疳
9606,收敛、止血
9607,滋补强壮
9608,解毒、疗疮
9609,清热、解毒
9610,利水、渗湿、化瘀、止痛
9611,安神
9612,祛风湿、壮筋骨、止痛、消肿
9613,凉血、止血、祛风、解毒
9614,清热、降火、固脾、止泻
9615,温中、散寒、祛风、止痛、利水、消肿
9616,补肾、益气、利湿、化痰
9617,祛瘀、消肿
9618,行气、止痛
9619,养胃、生津、滋阴、除热
9620,滋阴、润肺
9621,清热、解毒
9622,缓急、止痛、润肤、防裂
9623,升阳、举陷
9624,清热、解表
9625,清热、解毒、凉血、止血
9626,润肠、通便、清热、化湿、杀虫、解毒
9627,祛风、除湿、消积、导滞、疗疳、除疾、截疟、消肿、散瘀、解毒、疗疮
9628,养血、止血
9629,解毒、敛疮
9630,解表、退热、清热、利湿
9631,温肾、壮阳、活血、调经
9632,祛风、除湿、散寒、止痛
9633,舒筋、通络、消肿、化瘀
9634,宣肺、解表、祛风、止痛、健胃、消积
9635,祛风湿、平喘
9636,消肿、镇痛、清热、解毒
9637,解毒、散结
9638,除臭、杀虫
9639,行气、止痛、降逆、调中、温肾、纳气
9640,活血、调经、祛风、镇惊、行气、止痛
9641,温经、通阳、散瘀、消肿
9642,拔毒、消肿
9643,催产、止血
9644,祛风、除湿、健脾、益气
9645,祛风、散寒、除湿、止痛
9646,滋阴、泻火
9647,补脾、健胃、止渴、生津、平补、肝肾
9648,清热、解毒、化痰、止咳
9649,清热、利湿、清泻肝火、清热、止咳
9650,收敛、止血
9651,清热、消炎
9652,祛风、发汗、解毒、消肿
9653,散寒、解表
9654,清热、解毒
9655,补肾、壮阳、散结、通络、通经、活血、催产、补肾、纳气
9656,止痛、消肿
9657,活血、祛瘀、化痰、宽胸、补脾、健胃
9658,清热、解毒、消肿、止痛
9659,清热、解毒、利湿、通淋、催乳
9660,祛风、除湿、燥湿、疗疮
9661,热解毒
9662,收涩、消肿
9663,利水、通淋、通经、下乳
9664,清热、散结、止咳、消肿、涩肠、止泻、解蛇毒、续筋、接骨
9665,清热、解毒、消肿、镇痛、凉血、止血
9666,涩肠、止泻、舒筋、镇痛
9667,清热、解毒、祛风、除湿
9668,活血、经瘀
9669,抗菌、消炎、祛风、除湿、活血、止痛
9670,清热、解毒、疏风、透疹
9671,消肿、解毒
9672,健脾、消食
9673,化痰、止咳、祛瘀、消肿
9674,杀虫、消积
9675,破血、逐瘀、攻毒
9676,止咳、平喘、抗癌、镇痛
9677,清热、渗湿、消肿、解毒
9678,解毒
9679,补气、安神、强精、滋肾、祛风、活血
9680,理气、和中、祛瘀、止血
9681,散瘀、消肿
9682,止泻
9683,理气、开郁、辟秽、和中
9684,清热、解毒、凉血、止血
9685,解毒、止痛、去翳
9686,清热、解毒
9687,益髓、填精、清肺、止咳
9688,驱蛔、杀虫、明目、去翳
9689,平肝潜、降压
9690,搜风、胜湿、散寒、止痛、开痰、下气、温肾、壮阳、解毒、疗疮
9691,散瘀、止血、补益
9692,止咳、平喘、驱虫、止泻
9693,祛风、散寒、健脾
9694,行血、通经、消肿、止痛
9695,利水、消肿
9696,清热、燥湿、利尿、杀虫
9697,消食、化积、活血、化瘀
9698,消肿、散瘀
9699,清温、解热
9700,利尿、通淋、消食、健胃
9701,祛风湿、利水、消肿
9702,清肝、息风
9703,补气、健脾、除烦、止渴
9704,祛湿、止痛
9705,燥湿、解毒、清热、消炎、收敛、止血
9706,理气、止痛、舒筋、活血
9707,滋阴、补肾、利水、通淋
9708,祛风、除湿、温经、散寒
9709,解毒、止痛
9710,清热、解毒、散瘀、止血
9711,杀虫、灭鼠
9712,化瘀、活血、祛风、除湿、解毒、泻火
9713,理气、止痛
9714,解毒、消肿
9715,补益肝肾
9716,清热、利湿、清肺、止咳、祛风、除湿、利尿、消肿、活血、调经、健胃、消食
9717,清热、解毒、利胆、退黄
9718,滋补、肺肾、利尿、消肿
9719,燥湿、祛寒
9720,活血、散瘀、活血、止血、祛风、除湿、止咳、化痰
9721,祛风、除湿
9722,涌吐、解毒
9723,辛凉解表、清热、解毒
9724,温胃、止痛
9725,祛风、除湿
9726,消肿、止痛、接骨
9727,清热、燥湿
9728,行气、止痛、催产、助产、消肿、止痛
9729,消痰、软坚
9730,补肾、益精、清肺、止咳
9731,清热、利湿、祛风、解毒
9732,解毒消肿祛痰镇痉
9733,疏风、解表
9734,解毒、活血、祛瘀
9735,宽中、下气、消食、温经、活络
9736,散寒、止咳、祛风、除湿
9737,杀虫、疗癣
9738,温肾、壮阳
9739,补气、升阳、益卫、固表
9740,清热、解毒、化瘀、止血
9741,清热、解毒、滋补、平肝、散结
9742,祛风、除湿、散瘀、止血
9743,清热、燥湿、解表、退热
9744,养阴、润燥、补中、益气
9745,行气、消胀、止痛
9746,定心、安神、止咳、化痰
9747,祛风、除湿、利尿、镇痛
9748,败毒、消痈、活血、通络、祛风、杀虫
9749,清热、止呕
9750,凉血散瘀止血
9751,清热、利湿、镇惊、解毒
9752,清热、利湿
9753,清热、解毒、杀虫、止痛
9754,凉血、止血
9755,活血、散瘀
9756,清热、解毒、止血、止带
9757,祛风、除湿、化痰、止咳
9758,消肿、止痛、活血、止血
9759,活血、祛湿、消炎、止痛
9760,清热、止泻
9761,清热、利湿、解毒、生肌
9762,清火、化痰、镇惊、定癎
9763,解表散寒祛风除湿
9764,截疟
9765,清肺、止咳、燥湿、止痢、生肌、敛疮、收敛、止血
9766,清热解毒和血止痛
9767,清热、消炎
9768,通络、除湿、祛风、除湿、止痛
9769,镇痛、解痉、平肝、熄风、解毒、消肿、敛汗、涩肠、止血、杀虫、止痒
9770,疏风、清热、行气、消痰、活血、通淋、镇心、安神
9771,凉血、止血、利湿、清热
9772,清热、解毒、通经、止痛
9773,清热、平肝、熄风、镇惊
9774,温经、活络、健胃、利湿
9775,解毒、消肿
9776,凉血、止血
9777,活血、散瘀
9778,散瘀、消肿、续筋、续骨
9779,接骨、疗伤
9780,补肺、止咳、化痰、止血、生肌
9781,疏散、风热、止痛、消炎
9782,散瘀、止痛、止血
9783,祛风、通络
9784,温中、散寒、祛风、止痛
9785,清热、化痰、利水
9786,行气、止痛、凉血、止血
9787,消肿、止痛
9788,清热解毒补肝益肾
9789,通经、下乳
9790,活血、调经
9791,疏风、行气、活血、止痛
9792,祛风、散寒、温中、止痛、杀虫、止痒
9793,镇痛、止血、清热、解毒
9794,解毒、消肿、散瘀、止痛
9795,祛风、除湿、舒筋、活络
9796,祛风、行气
9797,涩肠、止泻
9798,镇静、安神、温中、和胃
9799,清肝、健脾、消食、杀虫
9800,祛瘀、止痛、接骨
9801,消肿、解毒、泻下、通便
9802,祛风、散寒、杀虫、止痛
9803,清热、解毒、散结、利咽、散寒、止痛、活血、平肝、潜阳
9804,清热、解毒、敛疮、止疼
9805,舒筋、活络、生肌、敛创
9806,通络、止痛
9807,补中、益气、截疟
9808,清热、拔毒、生肌
9809,发汗、除湿、活血、止痛
9810,祛风、除湿
9811,清热祛痰定惊安神
9812,清热、解毒、凉血、止血
9813,止血、化瘀、消炎、解毒
9814,去瘀、止痛、顺气、化痰
9815,杀虫
9816,驱风、解表、芳香化浊、清热、燥湿、宣表、和中
9817,清热解毒排脓生肌消肿止痛
9818,补益脾肾调经养血
9819,祛风、除湿、祛瘀、止痛、接骨
9820,清热、利湿、消肿、解毒
9821,消肿、止痛
9822,祛风、清热、利尿、解毒
9823,健脾、开胃
9824,清肺、止咳
9825,软坚、散结、通便、镇咳
9826,消炎、收敛、散寒、止痛
9827,清热、利湿、健脾、补虚、解毒
9828,清热、平肝、杀虫
9829,止咳、化痰
9830,消肿、止血
9831,解毒、敛疮
9832,清热、化痰、利水、通淋、凉血、解毒
9833,清热、解毒、清热、化痰、利尿、通淋
9834,清热、解毒、泻热、消肿
9835,理气、止痛、散毒、生肌
9836,活血、调经、消肿、散瘀
9837,清热、消炎、解热毒
9838,去腐、生肌、收敛、止血、清热、退烧
9839,祛风、除湿、杀虫、止痒、调气、活血、熄风、止痉
9840,清热、解毒、清热、利尿
9841,宣散风热
9842,清热、利湿
9843,活血、除湿
9844,解毒、疗疮
9845,疏风、清热、利尿、通淋
9846,消瘿、止带
9847,疏肝、清热、解毒、消肿
9848,润肺、止咳
9849,滋补强壮
9850,收敛滋补、生津、止渴、止汗
9851,活血、破瘀、清肝、除翳、降气、平喘、清热、解毒
9852,清肝、明目
9853,和中、下气、散瘀、活血
9854,止血消肿清肺利喉
9855,清热、利湿、和胃、止呕、清热、止咳、活血、化瘀
9856,消肿、解毒
9857,清热、凉血、截疟
9858,清肺、止咳、涩肠、止泻
9859,清热、解毒、祛风湿、祛瘀、通经
9860,收敛、止血、解毒、消肿
9861,散寒、祛湿
9862,祛风、除湿、补肾、壮阳
9863,回阳、救逆、散寒、止痛
9864,清热、解毒、凉血、止痢
9865,活血、祛瘀、消肿、止痛
9866,滋阴、补虚
9867,清热、解毒、消痈、消肿
9868,软坚、散结
9869,活血、化瘀
9870,清热、利湿、解毒、消肿、散瘀、止痛
9871,补气、壮阳、养心、止血
9872,清热、解毒
9873,和解、少阳、疏肝、理气
9874,清热、止咳、活血、定痛、接骨、续筋
9875,清热、解毒、凉血、止血、消瘀、止痛
9876,止咳、化痰、解毒、消肿、健脾、和胃
9877,补肾、填精
9878,祛风除湿续伤止痛
9879,解毒、消炎
9880,散瘀、消肿
9881,补虚弱、清胃热、止血、解毒
9882,散结、活瘀、消肿、止痛、解毒、清热
9883,行气、活血、祛风湿、止痛
9884,凉血、止血
9885,祛痰、止咳、宽胸、利气
9886,清热、解毒、解表、利水、通淋、活血、散瘀
9887,止泻
9888,和胃、宽肠、利水
9889,利水、消肿、杀虫、疗癣、止血
9890,益气补益
9891,清热、利湿、镇惊、解毒
9892,祛风、除湿
9893,清热、止咳、平肝、息风
9894,清热、解毒
9895,补中、益气、益气、生津、清利湿热、祛风、止痒
9896,止咳、化痰、祛风、除湿、强筋、壮骨、涌吐、毒物
9897,解毒
9898,活血、祛瘀
9899,清热、解毒、凉血、止血
9900,疏风、透表、凉血、解毒
9901,润肠、通便
9902,清利湿热
9903,清热、解毒、通利、小便、凉血、散结
9904,清热、泻火
9905,疏风、清热、凉血、止血、解毒、消肿
9906,止血、生肌、收口
9907,止咳、止痰、消炎
9908,泻火、解毒、凉血、止血
9909,清热、解毒、杀虫、止痒
9910,利胆、退黄、通淋、利尿、消痈、散肿
9911,息风、止惊、止痈
9912,清热、利湿、补虚、益损、活血、止血
9913,解毒、止血、熄风、止痛
9914,祛风、除湿、舒筋、活络、通痹
9915,清肺、祛痰、清心、除烦
9916,利咽、止痛
9917,清热、解毒
9918,化痰止咳活血止血
9919,祛风、除湿、行血、调经、温中、止痢
9920,清热、解毒
9921,散瘀、消肿
9922,清肺热、利尿、通淋
9923,利尿、通淋、祛湿、消肿
9924,益气、延年
9925,活血、益气、补精、固气
9926,清肝明目解毒疗疮
9927,舒筋、活络、补虚
9928,活血、化瘀、凉血、止血
9929,清热、止泻
9930,清热、解毒、消炎、止痛、收敛、生肌
9931,滋阴、补肾
9932,益气、升阳、益卫、固表、托毒、生肌
9933,补肾、固精
9934,凉血、活血
9935,祛瘀、止痛、清热、利湿
9936,接骨
9937,滋阴、补虚
9938,解毒、消肿
9939,清心
9940,镇惊安神泻下通腑解毒疗疮
9941,解毒、消肿、化痰、散积
9942,清热、解毒、生肌
9943,宣肺、止咳
9944,散寒、止痛
9945,清热、解毒、健胃、利湿
9946,清热、解毒
9947,化痰、散结
9948,健脾、补气、固精、缩尿
9949,祛风、止痒、解郁、调经
9950,清热、燥湿
9951,活血、祛瘀、利尿、祛湿
9952,清热、润肺、敛阴、安神、除湿、杀虫
9953,清热、解毒
9954,解毒
9955,息风、止痉、消肿、解毒
9956,行气、止痛
9957,清肝、明目、收敛止痢
9958,活血、止血、清热、通淋
9959,补肝肾、益精血、软坚、消瘿、补血、止血
9960,凉血、止血、清热、解毒
9961,活血、祛瘀、调经、化瘀
9962,清肝、泻火、清热、除湿、健脾、开胃
9963,活血、止痛
9964,止咳、平喘、温经、止痛
9965,清肺、化痰
9966,活血、散瘀、健脾、消疳、利水、消肿、解毒、疗伤
9967,行气、止痛、养血、止血
9968,清热、凉血、化湿、通络
9969,温肾、壮阳
9970,清肝、明目、平肝、潜阳
9971,清热止咳凉血解毒
9972,疗癣、解毒
9973,解毒、消肿、止血
9974,清热、解毒、利湿、止泻、消食、导滞
9975,发汗、解表、止咳、平喘、解表、利水
9976,清热解毒安神镇静去腐生肌
9977,清热、解毒、消肿、止痛、清肺、止咳、活血、止血
9978,祛风、解表、利气、消痰、清火、解毒
9979,收湿、敛疮
9980,祛风湿、活血脉、强筋骨
9981,散瘀、消肿、镇痛、止血、祛痰、开窍
9982,清热、解毒、利湿、活络、凉血、止痛
9983,理气、化湿、活血、止血、消积、解毒
9984,缓泻、催吐
9985,祛风、散寒、止痛
9986,疏风、清热、解毒、消肿、凉血、止痢
9987,除风、和血
9988,消食化积燥湿止痢
9989,熄风、镇惊、通便、攻毒、破瘀、止痛
9990,散风、除湿、利水、通淋
9991,凉血、止血、消瘀、散肿
9992,和血、止血、散血、消瘀
9993,清热、祛瘀、消肿、解毒
9994,补心、安神、止咳、祛痰
9995,补脾、益气
9996,清热、解毒
9997,解毒、消肿、活血、止痛
9998,化痰、止咳、清热、息风
9999,凉血、止血
10000,清热豁喉定惊安神
10001,活血、调经、散瘀、止痛
10002,解毒、消肿、活血、止血
10003,清热、解毒、祛风、杀虫
10004,清热、解渴、凉血、通淋
10005,清热、解毒
10006,清热、活血
10007,清热、解毒、清热、止咳、清热、利胆
10008,清热、解毒
10009,和血、止血、祛风、止痛、涩肠、止泻
10010,活血、散瘀
10011,宣肺、止咳、祛湿、消肿、祛湿、止痛
10012,清热、凉肝、润肺、止咳
10013,清热、止渴、祛风、除湿
10014,清热、解毒、除湿、止痢、杀虫、驱蛔
10015,清热、消肿、利水、通淋
10016,理气、化湿、祛风、除湿
10017,清热、镇惊
10018,消炎、解毒、祛风湿止痛
10019,利胆、退黄、化痰、止咳、凉血、止血
10020,舒筋、活血
10021,填精、补虚
10022,淡渗、利水
10023,活血、散瘀、消肿、止痛
10024,清热、解毒
10025,凉血、解毒、消肿、止痛
10026,润肺、止咳、止渴、除烦
10027,拔毒、消肿
10028,生津、止渴
10029,祛风、除湿、消炎、止痛
10030,祛风湿、解毒
10031,解疮毒、消痈、消肿、杀虫
10032,清热、解毒、祛风、除湿、接骨、续伤
10033,健脾、和胃
10034,清热、除烦
10035,清热、除烦、清肝、息风、利尿、解毒
10036,驱风、散寒、除湿、止痛
10037,驱杀蛔虫、收敛、止血
10038,疏风、解表、消肿、止痛
10039,活血、祛瘀、调经
10040,杀虫、清热、解毒
10041,清热、解毒、行气、活血
10042,祛风、活血
10043,辛温解表、祛风、胜湿、祛风、消肿
10044,收敛、止血
10045,健脾、和胃、补益肝肾
10046,清热、通便
10047,清热、解毒、清热、利尿
10048,强心、利尿、祛痰、定喘、祛瘀、止痛
10049,祛风、除湿、清热、除蒸
10050,解毒、止血
10051,补肾、固精、止咳、平喘
10052,解热、生津
10053,益气、补虚、和胃、止渴
10054,解表、散寒
10055,发表、散寒、散瘀、止痛
10056,滋阴、止渴
10057,清热、解毒、活血、消肿
10058,清热、解毒、健脾、开胃
10059,清热、解毒
10060,温肺、止咳、温肾、壮阳、温肺、壮阳、通乳
10061,发汗、解暑、利湿、行水
10062,除湿、疗疮
10063,祛风、除湿、行气、止痛
10064,驱风、祛湿、强筋、壮骨
10065,驱风、逐湿、强筋、壮骨
10066,补血、止血、散瘀、调经、益脾、健胃
10067,补益脾肺
10068,清热、解毒
10069,补肝
10070,软坚、散结
10071,利膈化痰止吐
10072,清热、解毒、凉血、利尿
10073,润肺、化痰
10074,健脾、止痢、助消化
10075,降逆、止呕、祛风、除臭
10076,活血、调经、养心、除烦、凉血、消痈
10077,通经、活络、行水、利尿
10078,清热、解毒
10079,补中、益气、生肌、长肉
10080,清热、解毒、平肝、息风
10081,散寒、化积、祛瘀、消肿
10082,解毒、化浊
10083,清热、解毒
10084,降逆、止咳、清热、通淋、益气、填精、除邪、镇惊、行气、散结
10085,祛风、除湿
10086,疏风、清热、止咳、杀虫
10087,理气、活血
10088,聪耳、益智
10089,祛风、除湿、杀虫、消积、利水、化湿
10090,清热、燥湿、凉血、解毒
10091,祛风、除湿、舒筋、止痛
10092,清热、解毒
10093,清热、润肺、消肿、止痛
10094,止咳、平喘、解毒、透疹、滋补强壮、解毒、排脓
10095,解毒、疗咽
10096,疏风、搜风
10097,杀虫、止痒
10098,清热、除烦、清热、利尿
10099,祛风、明目、解毒、散结
10100,活血、止血、宁心、利湿、消肿、解毒
10101,止血、止泻
10102,温中、止血、蚀疮、生肌
10103,清热、解毒
10104,散瘀、止痛、收敛、止血
10105,清热、解毒
10106,清热、消肿
10107,下气、定喘
10108,收涩、固脱
10109,行气、止痛、消食、解毒、清肺、止咳
10110,生津、止渴
10111,行气、止痛
10112,清热、解毒
10113,熄风
10114,清热、利尿、开胃、消食
10115,missing
10116,除湿、祛风
10117,补气、健脾、泻火、解毒
10118,清热、解毒、收湿、止痒
10119,消肿、止痛
10120,接骨、止痛、解毒、消肿、明目、退翳
10121,制酸、止痛、收湿、敛疮
10122,行气、止痛、接骨、散瘀、消肿、解毒
10123,养血、生肌、补脾、健胃、温肾、止遗
10124,杀虫、解毒、消肿、止漏
10125,利湿、退黄
10126,养心、安神、清肝、泻火
10127,化痰、止咳、宣肺、透疹、解热、燥湿
10128,催产、助生
10129,温胃、杀虫、明目
10130,益阴、补血、益气、填精、消瘿、散结、止痢
10131,清热、解毒、活血、散瘀
10132,镇静、熄风
10133,温中、健脾、活血、散瘀、化痰、止咳、补脾、束带
10134,行气、活血、散瘀、止痛
10135,祛风、解表、解毒、除湿、强壮筋骨
10136,发汗、解表
10137,化痰、止咳、润肠、通便
10138,祛瘀、散结、攻毒
10139,清热、解毒、祛瘀、消肿
10140,祛风、活血、消肿、止痛
10141,消炎、杀菌、生肌、长肉
10142,宁心、安神、凉血、散瘀
10143,润肺、止咳
10144,解毒、止痛
10145,清热、利尿、解毒、消肿
10146,疏风杀虫止痒、活血、止血
10147,理气、止痛
10148,养心、安神
10149,化痰、止咳、解毒、消肿
10150,活血、去瘀
10151,健脾、消食
10152,燥湿收敛、清热、解毒
10153,解毒、消肿
10154,化瘀、疗伤
10155,清热、止咳、杀虫、止痒
10156,祛风、解毒
10157,清肝、利胆、祛风、解表
10158,和胃、止痛、利尿、消肿、通经、调经
10159,益气、活血
10160,温中、和胃
10161,疏肝、止痛
10162,清热、除烦、凉肝、息风
10163,清热、降气、益气、补虚
10164,解毒、利尿、活血、消肿
10165,滋阴、补血、止血
10166,清热、利湿
10167,清热、解毒、通利、小便、凉血、散结
10168,祛风、散寒、祛湿、止痛
10169,清热、解暑
10170,生肌、愈疮
10171,活血、散结
10172,清热、解毒
10173,清热、凉血、凉血、止血
10174,发汗、解表、祛风、止痉
10175,祛痰、解毒、行血、消肿
10176,清热、利水、通淋
10177,祛风、止痛、解毒、消肿、补虚、下乳
10178,清热、解毒、清肝、明目
10179,下气、调中、化痰、醒酒
10180,止咳、化痰
10181,化脓、除疳
10182,清热、解毒
10183,止咳、化痰、消肿、解毒、活血、接骨
10184,理气、止痛
10185,清热、透疹
10186,破积、逐水、止咳逆、催吐、杀虫、解毒
10187,宣肺、止咳
10188,解毒、消肿
10189,散瘀、止痛、解毒、止痒
10190,破血、行瘀
10191,清热、利咽、凉血、止血
10192,清热、解毒
10193,清热、凉血、解毒
10194,活血、通经、泻下
10195,温经、止痛、活血、消肿
10196,清热、燥湿
10197,疗疮、止血
10198,祛痰、散结、解毒、祛瘀
10199,止咳、化痰、解毒、消肿、利尿、通淋、接骨、续伤
10200,止咳、平喘、行气、止痛、利尿、通淋
10201,解毒、消肿
10202,行气、活血
10203,清热、泻火
10204,补肾、壮阳
10205,疗伤、止血
10206,清热、化痰、抗菌、消炎
10207,滋阴、润燥
10208,清热、解毒、散结、消肿
10209,清热、解毒、消肿、止痛
10210,清热、解毒、平肝、熄风
10211,接骨、疗伤
10212,清肝、明目、宽胸、消痰
10213,清肺、利咽喉、生津、止渴
10214,行气、消胀、消食、导滞
10215,发汗、透疹、续伤、接骨
10216,和肝、健脾、养血、止血、导滞
10217,抗癌
10218,滋阴、开胃、化痰、利膈
10219,散瘀、消肿、通经、活络
10220,暖胃、止呃、健脾、消食
10221,祛风、除湿、温中、行气
10222,回阳、救逆
10223,清热、解毒、利水、通淋
10224,健脾、和胃、消食、化积、涩肠、止痢
10225,温中、止痛、强筋、壮骨
10226,解表、散热、顺气、化痰
10227,生津、止渴、益阴、退热
10228,温中、散寒、涩肠、止泻
10229,清热、利尿、活血、散瘀
10230,祛风、除湿、壮腰、健肾
10231,清热、解毒
10232,清热、解毒、止咳、消食、化积
10233,清肺、化痰、止血
10234,破血、调经、祛风、除湿、化痰、平喘、利水、消肿
10235,滋补肝肾、止咳、平喘
10236,平喘、疗疮
10237,补气、益肾
10238,清热、解毒、祛瘀、止痛
