序号,方名,规范名,经典,出处,主治,功用,功用大类,功用小类,处方,炮制,方解,禁忌,化裁,附方,文献,用法用量,名家论述,备注
10023026,活血丹,nan,nan,《永类钤方》卷二十二引彭氏家传方,打扑伤损，折骨碎筋，瘀血肿痛烦闷；风痰瘫痪顽痹；妇人血风，产后败血，浮肿，血气痛，风劳发动，四肢酸痛。,nan,nan,nan,青桑灰1斤（好醋杀火），大栗间（焙）1两6钱，骨碎补（制，焙）1两6钱，南星（生姜汁浸1宿，焙）1两6钱，赤芍药（焙）1两6钱，白芍药（焙）1两6钱，牛膝（洗，焙）1两6钱，川乌（炮）1两6钱，雄黑豆1两6钱，自然铜（醋淬）8钱，木鳖子肉（切，和面炒赤）8钱，净细辛1两（焙），没药4钱（另研），乳香6钱（另研），白胶香3钱，血竭6钱（或番降节代）。,上为末，糯米粉醋煮糊丸，杵千下，众手丸，缓则发裂；大丸重6钱（湿），中丸3钱（湿），候干，以漆搽手上，将两三丸挪漆为衣收用。以纱葛袋收挂净处，经久不坏。,nan,孕妇勿服。,nan,nan,nan,nan,nan,nan
10023079,活血散瘀汤,nan,nan,《外科正宗》卷三,活血散瘀。治产后恶霹不尽，或经后瘀血作痛，或男子跌打损伤后瘀血流注肠胃作痛，渐成内痈；及腹痛大便燥结者。亦可用以治疗委中毒，局部肿痛微硬，屈曲艰难。,nan,nan,nan,川芎、当归尾、赤芍、苏木、牡丹皮、枳壳、瓜蒌仁（去壳）、桃仁（去皮、尖）各3克，槟榔2克、大黄（酒炒）6克。,nan,nan,nan,nan,nan,nan,上药十味，清水400毫升，煎至320毫升，空腹时服。药滓再煎再服。,方中川芎、当归尾、赤芍药、牡丹皮、苏木、桃仁活血祛瘀，通调血脉；枳壳、槟榔破气消积，疏通气道；大黄、瓜蒌仁攻逐瘀结，润肠通腑。且槟榔、枳壳亦助大黄攻逐；归、芎、苏、芍之破瘀，得利气之品，则祛瘀之功益着。全方配伍甚佳。但究属攻破之剂，凡血虚无瘀者，切忌妄用。,nan
10023082,活血散瘀汤,nan,nan,《外科正宗》卷八,活血散瘀，破气消积，润肠通便。主治肠痈；产后恶露不尽，或经后瘀血作痛；或暴急奔走，或男子杖后，瘀血流注肠胃作痛，渐成内疽，腹痛，大便燥者。委中毒，木硬肿痛微红，屈曲艰难。,nan,nan,nan,川芎1钱，归尾1钱，赤芍1钱，苏木1钱，牡丹皮1钱，枳壳1钱，瓜蒌仁（去壳）1钱，桃仁（去皮尖）1钱，槟榔6分，大黄（酒炒）2钱。,nan,nan,nan,nan,nan,nan,水2茶钟，煎8分，空心服，滓再煎服。,nan,nan
10023150,火龙丹,nan,nan,《十便良方》引常器之方(见《普济方》卷三四八),产后血刺晕迷，败血上冲，不省人事；及儿枕痛，小腹腰痛，一切疼痛不可忍者。,nan,nan,nan,百草霜不拘多少（罗过，再研极细）。,上用头醋作面糊为丸，如弹子大，朱砂为衣。,nan,nan,nan,nan,nan,每服1丸，火烧焰出，醋内蘸过，再烧再蘸，尽醋半盏为度。细研，以酒半盏，童便半盏，调下。初1服，减腹内痛；两服败血自下，神体和畅；3服调理诸疾。,nan,nan
10023229,藿香散,nan,nan,《圣惠》卷七十八,产后霍乱吐利，烦渴不止。,nan,nan,nan,藿香3分，香薷3分，白术3分，麦门冬（去心，焙）3分，葛根（锉）3分，厚朴（去粗皮，涂生姜汁炙令香熟）3分，人参（去芦头）3分，桂心半两，芦根1两（锉），白豆蔻半两（去皮），甘草1分（炙微赤，锉）。,上为粗散。,nan,nan,nan,nan,nan,每服3钱，以水1中盏，入生姜半分，竹叶3-7片，大枣3个，煎至6分，去滓温服，不拘时候。,nan,nan
10023245,藿香汤,nan,nan,《普济方》卷三五五,产后霍乱吐利，腹痛转筋，烦闷。,nan,nan,nan,藿香叶1两，当归1两，人参1两，五味子1两，白术1两半，赤茯苓1两半，黄耆1两半，木瓜2两。,上为散。,nan,nan,nan,nan,nan,每服5钱，以水1盏半，煎8分，去滓温服。1方用姜煎。,nan,nan
10023246,藿香汤,nan,nan,《圣济总录》卷一六三,产后呕逆，不下食，心腹虚胀。,nan,nan,nan,藿香（去梗）1两，诃黎勒（炮，去核）1两，甘草（炙）1两，陈橘皮（去白，焙）1两，人参1两，白术1两，白豆蔻（去皮）半两，草豆蔻（去皮）半两，曲半两。,上为粗末。,nan,nan,nan,nan,nan,每服3钱匕，水1盏，加生姜3片，大枣2枚（擘破），煎至7分，去滓温服，不拘时候。,nan,nan
10023265,藿香温胃散,藿香温胃饮,nan,《胎产秘书》卷下,产后血痛已除，劳伤气血，脏腑虚损，不能运化食物，及冷风相乘，以致阴阳升降不顺，乱于肠胃，冷热不调，邪正相搏，上吐下泻，名曰霍乱。,nan,nan,nan,当归3钱，白术3钱，姜炭4分，陈皮4分，藿香4分，厚朴8分，人参1钱，炙甘草3分，生姜1片。,nan,nan,nan,nan,nan,nan,藿香温胃饮（《盘珠集》卷下）。《盘珠集》有丁香。手足逆冷，加附子3分。,nan,nan
10023280,藿香正气散,nan,nan,《普济方》卷一三六,伤寒头疼，憎寒壮热，上喘咳嗽，五劳七伤，八般风疾，五般膈气，心腹冷痛，反胃呕逆，霍乱吐泻，脏腑虚鸣，山岚瘴气，遍身虚肿；妇人胎前产后；小儿脾疳。,nan,nan,nan,大腹皮1两，白芷1两，茯苓1两，枳壳1两，羌活（去芦）1两，独活（去芦）1两，川芎1两，防风1两，半夏1两，荆芥1两，薄荷1两，桑白皮1两。,上口父咀，如法修制。,nan,nan,nan,nan,nan,每服5钱重，水1盏半，加生姜3片，大枣1个，同煎8分，去滓温服，不拘时候，滓再煎。如要汗，加连须葱白1根，同煎。,nan,nan
10023315,鸡粪酒,鸡屎白豆淋酒、鸡矢酒,nan,《千金》卷三,产后中风及百病，并男子中一切风。,nan,nan,nan,鸡粪1升（熬令黄），乌豆1升（熬令声绝，勿焦）。,上以清酒3升半，先淋鸡粪，次淋豆取汁。,nan,nan,nan,nan,nan,鸡屎白豆淋酒（《圣济总录》卷一三九）、鸡矢酒（《济阴纲目》卷十二）。本方方名，《准绳?女科》引作“鸡矢醴”。,nan,《济阴纲目》：鸡粪入肝，治污浊之血；豆、酒去风，通周身之气。盖肝主筋，风主气，气行血流，筋荣风散，故治一切百病。
10023345,鸡茎散,nan,nan,《良方集腋》卷下,产妇小便不通。,nan,nan,nan,雄鸡茎5枚（焙干为末）。,nan,nan,nan,nan,nan,nan,分作2-3次服。空心用旨酒下。,nan,nan
10023369,鸡mq汤,nan,nan,《千金》卷三,产后小便数。,nan,nan,nan,鸡mq20具，鸡肠3具（洗），干地黄2两，当归2两，甘草2两，麻黄4两，厚朴3两，人参3两，生姜5两，大枣20枚。,nan,nan,nan,nan,nan,nan,方中麻黄，《千金方衍义》作“蒲黄”。,nan,《千金方衍义》：热在小肠，不能司膀胱气化而小便频数，小肠尽处傍通膀胱，膀胱渗洄，是必小肠有瑕，故取鸡之mq及肠专利小肠；厚朴、姜、枣专泄滞气；人参，甘草、地黄、当归兼滋气血；蒲黄匡佐mq，专清膀胱血热也。世本作麻黄，热既犯肠，断无复用麻黄之理。
10023391,鸡屎散,nan,nan,《圣济总录》卷一六六,产后妒乳成痈。,nan,nan,nan,鸡屎（炒干）1两，麝香半钱（细研）。,上为细散。,nan,nan,nan,nan,nan,每服1钱匕，煎荆芥酒温调下，不拘时候。,nan,nan
10023461,积气养荣汤,nan,nan,《嵩崖尊生》卷十四,产后血崩，血亡气脱，言语不接续，似喘非喘，无血块者。,nan,nan,nan,川芎2钱，当归4钱，炙草4分，人参2钱，炮姜4分，黄耆1钱，白术1钱，陈皮4分。,nan,nan,nan,nan,nan,nan,手足冷，加熟附5分，麦冬1钱，五味子10粒；伤食，加神曲、麦芽；伤肉，加山楂、砂仁各5分。,nan,nan
10023565,济火养心汤,nan,nan,《会约》卷十五,产后阴虚火炎，似狂非狂，乃血虚假狂，不得认为实证。,nan,nan,nan,熟地5至7钱，当归身2至3钱，泽兰叶4至5钱，怀牛膝（酒煮）1钱3分，茯神1钱3分，枣仁（炒，研）1钱3分，远志7分。,nan,nan,nan,nan,nan,nan,煎就加童便1杯合服。或加柏子（去油）1钱。如因恶露末下，败血攻心，加苏木浓煎汁合服。产后恶露未下，败血攻心，加桃仁（去皮），红花（酒炒）各5-6分；如血虚内热，脉滑，舌黄便燥，少加清火之品，如生地、白芍、丹皮、麦冬、淡竹叶之类。,nan,nan
10023572,济坤丹,回生至宝丹,nan,《胎产秘书》卷下,产后十八症。难产；胎衣不下；死胎不下；眼目昏花；口干心闷；寒热如疟；咳嗽，寒热不定；败血如肝；四肢浮肿；失音不语；血邪癫狂妄语；心腹痛；百节酸疼；舌干津枯，鼻中出血，绕顶生疮；腰痛如角攻；小便短缩；喉中蝉声；胸膈气满，喘逆不食。,nan,nan,nan,川芎1两，当归1两，牛膝1两，蒲黄（酒拌，隔纸炒）1两，茯苓1两，桃仁1两，熟地1两（九蒸九晒），三棱5钱，芍药5钱，羌活5钱，橘红5钱，萸肉5钱，灵脂5钱，木瓜7钱，青皮7钱，良姜4钱，香附1两，延胡1两，苍术1两，益母1两，乳香3钱，没药（去油）3钱，甘草5钱，黄葵子5钱，乌药（去皮）1两5钱，麝香3钱。,上除木香、乳、没、麝另研入外，余共为细未听用；又以大黄1斤（净）为末，苏木3两，河水5碗，煎3碗，去滓存汁，乌豆3升，水6碗，煎豆汁3碗，去豆；红花3两（炒黄）入好酒4碗，煮4-5沸，去花存酒；先将大黄末好醋7碗煮干，再下醋5碗煮干，又下醋3碗，入豆苏、红花酒汁共煎为糊样，取起，其镬焦亦铲起为末，入煎药和匀，同糊捣为丸，重5钱5分，阴干。,nan,nan,nan,nan,nan,每服1丸，酒送下。重者2丸。,nan,nan
10023588,济危上丹,nan,nan,《产育宝庆集》卷上,调和阴阳，补养营血。治产后失血过多，气无所附，以致唇青肉冷，汗出粘凉，目瞑神昏，或痰鸣气喘，生命垂危。,nan,nan,nan,乳香 五灵脂 硫黄（研）太阴玄精石（研）陈皮（去白）桑寄生 真阿胶（炙，捣）卷柏（生）等分,上药八味，分研细末，以后四味混匀，石器内微火上炒，勿令焦，再研极细，后入余药，用生地黄汁糊丸，梧桐子大。,nan,nan,nan,nan,nan,每服20～50丸，空腹时用温酒或当归酒送下。,产后去血过多，阴不敛阳，真阳上浮；气无所附，气不能摄；血不养心，神失所养，故见上述诸证。治当调摄阴阳，补养营血。方中硫黄补火以壮元阳，玄精石补阴以养真精，阿胶补血养营，桑寄生补肾生精，卷柏以调营血，生地汁为丸，意在调阴阳济水火，使营血调和，呼吸如度，自可转危为安。,nan
10023589,济泄丹,nan,nan,《医方类聚》卷一O二引《经验秘方》,脾虚积冷，胃脘停寒，食物多伤，不能克化，心下坚满，二胁胀痛，霍乱吐泻，中酒痰逆；小儿五疳八痢，乳食失节，蛔虫上攻，时发潮热，食癖，奶胎疟，食疟；妇人胎前产后血块。,nan,nan,nan,木香1两，丁香1两，信（另研）1两，粉霜（另研）1钱，五灵脂1两半，肉豆蔻半两，诃子（去油，春4钱半，夏3钱半以上，秋3钱半以下，冬4钱半以上），硇砂（春3钱半，夏3钱，秋3钱，冬3钱半）。,上为末，好糯米粉煮饼为丸，生朱砂，麝香为衣；大人丸如芥菜子大，小儿丸如菜子大。,nan,nan,nan,nan,nan,小儿1岁每服3丸，3岁每服5丸，大小加减服。大人每服1两末加江子末半钱，每服15-20丸，随汤物送下。,nan,nan
10023595,济阴百补丸,nan,nan,《医便》卷四,调脾胃，补虚损。主治女人劳伤，气血不足，阴阳不和，作寒作热，心腹疼痛，胎前产后，诸虚百损。,nan,nan,nan,当归（酒洗，晒干）6两，熟地（酒洗）1钱，香附子1斤（分4制：醋、酒、童便、盐水各浸3日，炒干），白芍药（酒炒）1钱，川芎1钱，益母草（5月5日采者佳，忌铁，净末）半斤，甘草（炙）1两，白茯苓（去皮）3两，玄胡索（炒）2两，人参（去芦）2两，木香（不见火）4两，白术（土炒）4两。,上为细末，炼蜜为丸，如梧桐子大。,nan,nan,nan,nan,nan,每服60-70丸，渐加至80-90丸，空心米汤、酒任下。,nan,nan
10023598,济阴大造丸,nan,nan,《胎产心法》卷上,治妊娠胎气不充，产后肾虚腰痛。,nan,nan,nan,人参、熟地各45克，当归身75克，麦冬（去心）、天冬（去心）、山药（炒）各30克，五味子15克，黄柏24克。,上各为末，加头胎壮盛紫河车1具，水洗，挑去经络污血净，酒蒸捣烂，入诸药末；炼蜜为丸，如梧桐子大。,nan,nan,nan,nan,nan,每服9克，用温开水或桂元汤送下，早、晚服。如脾胃虚患泄泻，去黄柏，减地黄，加土炒白术30克。,nan,nan
10023601,济阴返魂丹,返魂丹、秘方益母丸、益母丸、济阴丹、益母草丸,nan,《医统》卷八十五,横生逆产，胎前产后一切诸证。,nan,nan,nan,益母草8两（端午日或小暑日收采，连根置透风处阴干，用时以手摘去根，不犯铁器，石臼捣烂，磨罗为细末听用），川当归7钱，赤芍药6钱，南木香5钱。,上为末，炼蜜为丸，如弹子大。,nan,nan,nan,nan,nan,每服1丸，好酒、童便各半化下；或丸如梧桐子大，酒、便各半吞30丸。凡产仓卒未合，只生用益母草捣烂，绞汁入蜜少许服之。,nan,nan
10023627,寄生防风汤,nan,nan,《济阴纲目》卷十一,治产后风邪头眩，腰痛不可转侧，四肢沉重，行步艰难。,nan,nan,nan,独活、川芎、芍药（炒黄）、桂心、续断、生姜、桑寄生各1.8克，当归、防风各2.4克。,上药锉碎。,nan,nan,nan,nan,nan,水煎服。,nan,nan
10023629,寄生汤,nan,nan,《产宝诸方》,产后百损，腹胁痛，不下食。,nan,nan,nan,桑寄生（去苗）半两，肉桂（取心）半两，当归半两，白茯苓半两，白芍药半两，人参半两，熟地黄半两，麦门冬（去心）半两，甘草半两，黄耆1两，鳖甲1两（醋炙），牛膝3分。,上(口父)咀，如麻豆大。,nan,忌海藻、菘菜、生葱、猪肉、冷水、桃、李、雀肉等。,nan,nan,nan,nan,nan,nan
10023630,寄生丸,nan,nan,《圣济总录》卷一六一,产后血露不断。,nan,nan,nan,桑寄生1两（锉，炒），附子1两（炮裂，去皮肤），芍药1两，地榆1两半（锉，炒），白龙骨1两半，鸡苏3分。,上为末，炼蜜为丸，如梧桐子大。,nan,nan,nan,nan,nan,每服30丸，温酒或米饮送下，不拘时候。,nan,nan
10023647,鲫鱼汤,鲫鱼酒,nan,《千金》卷二,下乳汁。主治妇人产后乳汁不行。,nan,nan,nan,鲫鱼7寸，猪肪半斤，漏芦8两，石钟乳8两。,nan,nan,nan,nan,nan,nan,鲫鱼酒（《圣惠》卷八十一）。,nan,nan
10023654,加参安肺生化汤,nan,nan,《傅青主女科?产后编》卷下,治产后虚弱，旬日内外感风寒，咳嗽声重有痰，或身热头痛及汗多者。,nan,nan,nan,川芎3克，人参3克，知母3克，桑白皮3克，当归6克，杏仁2.1克（去皮、尖），甘草1.2克，桔梗1.2克，半夏2.1克 ，橘红0.9克。,nan,nan,nan,nan,nan,nan,水煎服。虚人多痰，加竹沥10毫升、姜汁5毫升。,nan,nan
10023657,加参宁肺汤,nan,nan,《胎产秘书》卷下,产后旬日内外感冒风寒，咳嗽鼻塞，声重恶寒，或兼身热头痛。,nan,nan,nan,川芎1钱，当归3钱，人参2钱，杏仁10粒，桔梗4分，橘红4分，款冬1钱，桑皮7分，半夏8分，知母1钱。,nan,nan,nan,nan,nan,nan,虚人痰甚，加竹沥1小盏，姜汁3匙，甘草4分。,nan,nan
10023658,加参宁肺止嗽生化汤,nan,nan,《女科秘要》卷七,产后虚弱，百日内患风寒咳嗽，声重有痰，或身热、头痛、无汗。,nan,nan,nan,川芎1钱，知母1钱，诃子皮1钱，瓜蒌仁1钱，生地1钱，当归3钱，兜铃4分，桔梗4分，甘草4分，款冬花6分。,nan,nan,nan,nan,nan,nan,水煎服。,nan,nan
10023659,加参生化理中汤,nan,nan,《女科秘要》卷六,产后阴气、阳气俱虚，手足冷厥者。,nan,nan,nan,川芎1钱，当归3钱，人参3钱，姜炭5分，炙甘草5分，黄耆1钱。,nan,nan,nan,nan,nan,nan,水煎服。服上方厥回，痛块未除，暂减参、耆，俟块痛已除，仍用参、耆，加桃仁15粒，姜水煎服；如渴，加人参1钱，麦冬1钱，五味子10粒；手足微冷，加熟附子5分；痰，加橘红5分；竹沥半杯，姜汁2匙；汗多，加黄耆1钱；血块痛，加肉桂5分；虚甚，加人参1-2钱；大便不通，加麻仁1钱5分，再服5仁丸。,nan,nan
10023660,加参生化止崩汤,nan,nan,《胎产心法》卷下,产后血块痛，鲜血崩，形色脱，或汗多，或气促。,nan,nan,nan,人参2-3钱，当归身4钱，川芎2钱，干姜（炒黑）4分，炙草4分，白芷5分，荆芥穗（炒黑）5分，桃仁10粒（去皮尖）。,nan,nan,nan,nan,nan,nan,加大枣2个，水煎服。,nan,nan
10023687,加减补益汤,nan,nan,《胎产秘书》,产后阴门发痒。,nan,nan,nan,黄耆1钱5分，人参1钱5分，归身1钱，炙甘草5分，焦术1钱，陈皮5分，升麻3分，川椒20粒，乌梅2个，吴萸3分，川连3分（均炒）。,nan,nan,nan,nan,nan,nan,生姜。大枣为引，水煎服。,nan,nan
10023691,加减补中和疟饮,nan,nan,《慈航集》卷下,产后疟证，寒多热少。,nan,nan,nan,人参1钱，甜于术5钱，黄耆3钱（蜜炙），当归3钱，炙甘草5分，柴胡8分（炒），青皮1钱5分，草蔻仁1钱（研），干姜1钱（蜜炙），益母草3钱。,nan,nan,nan,nan,nan,nan,加大枣3枚，河、井水各半煎，露1宿，疟前2时温服，二煎接服更妙。如热多，加青蒿3钱；如恶心，加灶心土5钱；如腹痛作泻，加煨广木香1钱5分、酒炒元胡索2钱；如胸口不宽，加炒枳壳1钱5分。,nan,nan
10023760,加减和胃汤,nan,nan,《女科旨要》卷三,产后因食热毒太过，后食生冷之物，冷热不和，而为痢疾，里急后重者。,nan,nan,nan,厚朴5钱，陈皮3钱，猪苓3钱，泽泻3钱，归尾3钱，黄连3钱，白芍3钱，黄芩3钱，地榆2钱，豆蔻2钱，升麻5分，甘草2钱。,nan,nan,nan,nan,nan,nan,分5帖。水煎服。,nan,nan
10023776,加减藿朴夏苓汤,nan,nan,《顾氏医径》卷四,产后湿温。因胎前湿伏中焦，致产后缠绵不已，状若阴虚发热者。,nan,nan,nan,藿香、川朴花、半夏、茯苓、杏仁、米仁、大豆卷、泽泻、红花。,nan,nan,nan,nan,nan,nan,热重，去豆卷，加葛根、黄芩。,nan,nan
10023798,加减六物汤,nan,nan,《胎产秘书》卷下,产后痛已除而呕不止，不纳谷者。,nan,nan,nan,川芎1钱，当归2钱，山药1钱5分，人参1钱，茯苓1钱，藿香5分，豆蔻4分，姜炭4分，扁豆2钱，陈皮3分，炙甘5分，姜2片。,nan,nan,nan,nan,nan,nan,呕止，去豆蔻。,nan,nan
10023806,加减茅根汤,nan,nan,《胎产心法》卷下,产后淋，小便痛及血淋。,nan,nan,nan,白茅根1两，瞿麦1钱，车前1钱，冬葵子1钱，通草1钱，鲤鱼齿100个（为末）。,nan,nan,nan,nan,nan,nan,水煎，入鱼齿末，空心温服。,nan,nan
10023834,加减青蒿鳖甲汤,nan,nan,《中医妇科治疗学》,养阴清热。主治产后阴虚血燥，发热数日，午后更甚，肤热颧红，手心发烧，心烦不安，舌质淡，苔薄微黄而干，脉细数。,nan,nan,nan,青蒿梗3钱，鳖甲3钱，生地3钱，丹皮2钱，地骨3钱，皮芍3钱，药麦冬3钱，茯神4钱。,nan,nan,nan,nan,nan,nan,水煎服。,nan,nan
10023875,加减肾气大补汤,nan,nan,《胎产秘书》卷下,产后气血虚弱，督脉不通于脑，髓海空虚，风寒乘入，以致头痛畏风，久则鼻流黄涕，稠粘腥臭，脑痛如破者。,nan,nan,nan,熟地8钱，萸肉4钱，怀山4钱，茯芩3钱，丹皮2钱，泽泻2钱，制附4钱，肉桂2钱，牛膝2钱，黄耆4钱，归身4钱，栀子4钱，丝饼4钱。,nan,nan,nan,nan,nan,nan,水煎服。巅痛，加川芎1钱5分，藁本1钱5分，北细辛7分；两太阳痛，加荆芥、防风、淫羊霍各1钱；牵引两目疼痛，加炒僵蚕1钱，灵仙1钱5分，蝉蜕1钱；面上起块如饼，加全蝎梢8分，海桐皮1钱5分，煅石决明2钱，干蟾蜍1只；面上红肿如游风，加白头翁、牛茅子各2钱，独活、羌活各1钱，钩丁2钱；眼目红沿出泪，加谷精1钱，冬桑叶10片，干蟾蜍1只（香油炙酥），研末，药汁送下。,nan,nan
10023956,加减阴疸汤,nan,nan,《胎产秘书》卷下,产后疸症，汗黄、眼黄，便黄如金汁者。,nan,nan,nan,人参2钱，软柴胡1钱，白芍（酒炒）8分，炙甘草8分，干姜1钱，法夏1钱，西党参（姜汁炒）3钱。,nan,nan,忌茵陈清寒等药。,nan,nan,nan,nan,nan,nan
10023978,加连生化汤,nan,nan,《胎产秘书》卷下,产后痢症。,nan,nan,nan,川穹1钱5分，当归3钱，白芍1钱（炒），川连6分（姜汁炒），枳壳5分，茯苓1钱，甘草4分，木香3分。,nan,nan,nan,nan,nan,nan,水煎服。积重者，加山楂1钱。,nan,nan
10024002,加味八珍猪蹄汤,nan,nan,《不知医必要》卷四,虚弱人，产后气血不足，乳汁不下。,nan,nan,nan,炙耆1钱，党参（去芦，米炒）1钱，陈皮1钱，白芍（酒炒）1钱，当归1钱，熟地1钱，白术（净）1钱，茯苓1钱，川芎6分，木通1钱5分，炙草7分。,nan,nan,nan,nan,nan,nan,以王不留行1钱，同煎去滓，用猪蹄1只洗切，加水同煮，约2碗，任服。须用木梳，在乳上顺梳下。,nan,nan
10024025,加味参苓生化汤,nan,nan,《女科秘要》卷六,产后泄泻。,nan,nan,nan,川芎1钱，当归2钱，干姜5分，甘草5分，茯苓1钱5分，山药1钱，肉果1个（煨），诃子皮1钱（去油），莲子7粒，人参2钱，糯米1大摄。,nan,nan,nan,nan,nan,nan,虚甚，多加人参。,nan,nan
10024026,加味参麦散,nan,nan,《万氏女科》卷三,产后去血大多，心血虚弱，舌萎缩卷短，语言不清，含糊蹇涩，及怔忡。,nan,nan,nan,人参1钱，麦冬1钱，归身1钱，生地1钱，炙草1钱，石菖蒲1钱，五味子12粒。,nan,nan,nan,nan,nan,nan,猪心1个，劈开，水2盏，煮至1盏半，去心，入药煎7分，食后服。,nan,nan
10024032,加味参苏散,nan,nan,《医略六书》卷三十,产后虚寒夹瘀，吐血，脉细涩者。,nan,nan,nan,附子1两半（炮），人参1两半，苏木1两半。,上为散。,nan,nan,nan,nan,nan,水煎，去滓温服。,产后气阳两虚，瘀血滞逆膈间，上出于口，谓之虚寒夹瘀吐血焉。附子补火扶阳，炮黑可以吸血归原；苏木破瘀通经，生用力更峻于利血，人参扶元补气以统血归经也。为散水煎，使气阳内充则瘀血自化，而好血无不归经，何虚寒瘀逆吐血之不痊哉？,nan
10024054,加味大造汤,nan,nan,《傅青主女科?产后编》卷下,产后骨蒸劳热。,nan,nan,nan,人参1两，当归1两，麦冬8分，石斛8分（酒蒸），柴胡6钱，生地2两，胡连5钱，山药1两，枸杞1两，黄柏7分（炒）。,先将麦冬、地黄捣烂，后入诸药同捣为丸，加蒸紫河车另捣，焙干为末，炼蜜为丸。,nan,nan,nan,nan,nan,若服清骨散、梅连丸不效，服此方。,nan,nan
10024092,加味复元通气散,nan,nan,《万氏女科》卷三,产后败血流入肾经，带脉阻塞，有腰痛者。其证胀痛如刺，时作时止，手不可近。有因产时起伏挫闪肾气及带脉者，亦或腰痛。,nan,nan,nan,当归身1钱，川芎1钱，小茴（炒）1钱，故纸（炒热）1钱，玄胡1钱，牛膝1钱，桂心1钱，丹皮1钱。,nan,nan,nan,nan,nan,nan,水煎，用木香5分磨水和之，更调乳香、没药末5分服。,nan,nan
10024119,加味红花散,nan,nan,《中医妇科治疗学》,清热活血。主治产后血晕之血瘀证，偏于热邪者，面带红色，神昏口噤，甚至不省人事，胸满心烦，少腹硬痛拒按，恶露不下，大便秘结，舌质红，苔薄黄，脉数。,nan,nan,nan,生地5钱，秦归2钱，赤芍3钱，干荷叶2钱，牡丹皮2钱，红花1钱，蒲黄（生炒各半）3钱。,nan,nan,nan,nan,nan,nan,水煎，温服。,nan,nan
10024195,加味六皮煎,nan,nan,《产科发蒙》卷四,产后肿满，腰以下更甚，而无光泽，小便短少者。,nan,nan,nan,大腹皮、桑白皮、五加皮、茯苓皮、生姜皮、木瓜、橘皮、姜黄、灯草。,nan,nan,nan,nan,nan,nan,以水2盏，煮取1盏，温服。,nan,nan
10024216,加味麦冬汤,nan,nan,《医钞类编》卷十七,产后语言不清，含糊蹇涩，并治怔忡。,nan,nan,nan,人参1钱，麦冬（去心）1钱，归身1钱，生地1钱，石菖蒲1钱，炙草1钱，五味子12粒。,nan,nan,nan,nan,nan,nan,猪心1个，劈开，水2盏，煎至盏半，去猪心，入药煎服。,nan,nan
10024243,加味芩连四物汤,nan,nan,《金鉴》卷四十八,产后大便出血。,nan,nan,nan,四物汤加黄芩（酒炒黑）、黄连（酒炒黑）、地榆、阿胶、荆芥穗（微炒）、升麻（蜜制）、棕榈皮灰。,nan,nan,nan,nan,nan,nan,nan,nan,nan
