序号,方名,规范名,经典,出处,主治,功用,功用大类,功用小类,处方,炮制,方解,禁忌,化裁,附方,文献,用法用量,名家论述,备注
10008440,赤茯苓饮,nan,nan,《圣济总录》卷一六三,产后上气喘急。,nan,nan,nan,赤茯苓（去黑皮）1两，甜葶苈（纸上炒）1两，桑根白皮（锉）1两，当归（切，焙）1两，枳壳（去瓤，麸炒）1两，细辛（去苗叶）1两，郁李仁（去皮尖，研如膏）1两，桂（去粗皮）1两。,上为粗散。,nan,nan,nan,nan,nan,每服2钱匕，水1盏，煎至7分，去滓温服，不拘时候。,nan,nan
10008456,赤箭散,nan,nan,《圣惠》卷七十八,产后中风，四肢筋豚挛急，腰背强直。,nan,nan,nan,赤箭1两，防风1两（去芦头），羌活1两，酸枣仁1两（微炒），桂心半两，赤芍药3分，附子1两（炮裂，去皮脐），秦艽半两（去苗），海桐皮3分（锉），3分（锉），牛膝1两（去苗），薏苡仁1两。,上为粗散。,nan,nan,nan,nan,nan,每服4钱，以水1中盏，煎至6分，去滓温服，不拘时候。,nan,nan
10008482,赤井龙王汤,nan,nan,《产科发蒙》卷六,产前后诸疾，及打扑折伤、金疮，腹痛食伤，淋疾癫狂，黄胖病，痈疔，诸恶疮，类中风，痘疮后诸症；酒毒，郁冒。,nan,nan,nan,当归、川芎、芍药、黄耆、良姜、萍蓬根、木香、黄芩、黄连、人参、大黄、肉桂、桂心、甘草。,上锉，土器中炒。,nan,nan,nan,nan,nan,每服2钱，沸汤渍绞用，滓再煎服。有热，加柴胡；金疮筋断，加槟榔、丁子；打扑，倍萍蓬根。,nan,nan
10008498,赤龙麟散,nan,nan,《圣惠》卷八十,产后恶露不下，腹内坚痛不可忍。,nan,nan,nan,赤鲤鳞3两（烧为灰），乱发3两（烧灰），水蛭半两（微炒），虻虫半两（微炒，去翅足），桂心3分，川大黄1两（锉，微炒）。,上为细散。,nan,nan,nan,nan,nan,每服1钱，以温酒调下，不拘时候。,nan,nan
10008499,赤龙皮散,nan,nan,《圣惠》卷七十九,产后滞血在脏，致月水不通。,nan,nan,nan,赤鲤鱼皮4两（烧灰），虻虫1分（微炒令黄，去翅足），水蛭1分（微煨令黄），蒲黄半两，琥珀半两，乱发灰半两，麝香1钱（细研）。,上为细末。,nan,nan,nan,nan,nan,每服1钱，食前以热酒调下。,nan,nan
10008511,赤马通散,nan,nan,《圣惠》卷八十,产后血晕，迷闷不醒，面色青黑，腹内胀满，气息欲绝。,nan,nan,nan,赤马通5枚（焙干），生地黄2两（切，炒干）。,上为细散。,nan,nan,nan,nan,nan,每服3钱，以童便暖过，调下，闷绝者灌之，不拘时候。,nan,nan
10008512,赤马通饮子,nan,nan,《圣惠》卷八十,产后血晕，上攻，心腹胀满。,nan,nan,nan,赤马通3枚，酒1小盏，童便1中盏。,nan,nan,nan,nan,nan,nan,上药都和，绞取汁，煎1-2沸，分3次温服。,nan,nan
10008515,赤散,nan,nan,《千金》卷九引华佗方,伤寒头痛身热，腰背强引颈，及风口噤疟不绝，妇人产后中风寒，经气腹大。,nan,nan,nan,丹砂12铢，蜀椒18铢，蜀漆18铢，干姜18铢，细辛18铢，黄芩18铢，防己18铢，桂心18铢，茯苓18铢，人参18铢，沙参18铢，桔梗18铢，女萎18铢，乌头18铢，雄黄24铢，吴茱萸30铢，麻黄2两半，代赭2两半。,上药治下筛。,nan,nan,nan,nan,nan,每服方寸匕，酒下，日3次；耐药者二匕。夏令汗出。欲治疟，先发一时所，服药二匕半，以意消息之。细辛、姜、桂、丹砂、雄黄不熬，余皆熬之。,nan,nan
10008516,赤散,nan,nan,《千金》卷三,产后下痢。,nan,nan,nan,赤石脂3两，桂心1两，代赭3两。,上药治下筛。,nan,nan,nan,nan,nan,每服方寸匕，酒下，日3次。,《千金方衍义》：石脂疗腹痛、下痢赤白，代赭治腹中毒邪、女子赤沃漏下，皆《本经》主治，以其味涩司收，故用桂心之辛而散其滞也。,nan
10008521,赤芍药方,nan,nan,《圣惠》卷七十九,产后血气壅滞，攻刺，腰间疼痛。,nan,nan,nan,赤芍药3分，玄胡索半两，桂心半两，芎半两，当归半两（锉，微炒），牡丹半两，枳壳半两（麸炒微黄，去瓤），牛膝2两（去苗），川大黄1两（锉，微炒），桃仁半两（汤浸，去皮尖双仁，麸炒微黄）。,上为散。,nan,nan,nan,nan,nan,每服4钱，以水2大盏，加生姜半分，煎至5分，次入酒2合，更煎2-3沸，去滓，食前温服。,nan,nan
10008541,赤芍药丸,芍药丸,nan,《圣济总录》卷一六六,产后风气壅结，大小便不通。,nan,nan,nan,赤芍药1两1分，桂（去粗皮）1两，瞿麦（取穗）3分，大黄（锉，炒）1两半，槟榔2两（锉），当归2两（切，炒），羌活（去芦头）2两。,上为末，炼蜜为丸，如梧桐子大。,nan,nan,nan,nan,nan,每服20丸，米饮送下，以利为度。,nan,nan
10008569,赤石脂散,nan,nan,《圣惠》卷七十九,产后脓血痢，腹中疼痛不可忍。,nan,nan,nan,赤石脂1两，龙骨1两，黄连1两（去须，微炒），当归3分（锉，微炒），干姜半两（炮裂，锉），艾叶半两（微炒），阿胶半两（捣碎，炒令黄燥），黄耆半两（锉），黄柏半两（微炙，锉）。,上为细散。,nan,nan,nan,nan,nan,每服3钱，以粥饮调下，日3-4次。,nan,nan
10008577,赤石脂汤,nan,nan,《圣济总录》卷一六五,产后血痢，赤白兼下血。,nan,nan,nan,赤石脂3分，黄连3分（去须），地榆3分，甘草（炙）1分半，厚朴（去粗皮，生姜汁炙，锉）2分半，干姜（炮裂）1分半，当归（切，焙）半两。,上为粗末。,nan,nan,nan,nan,nan,每服3钱匕，水1盏，加薤白3寸（切），同煎7分，去滓，食前温服。,nan,nan
10008580,赤石脂丸,nan,nan,《圣济总录》卷一六四,产后久泻不止。,nan,nan,nan,赤石脂1两，人参1两，干姜（炮）半两，龙骨3分。,上为末，面糊为丸，如梧桐子大。,nan,nan,nan,nan,nan,每服30丸，食前米饮送下。,nan,nan
10008588,赤石脂丸,nan,nan,《千金》卷三,产后虚冷下痢。,nan,nan,nan,赤石脂3两，当归2两，白术2两，黄连2两，干姜2两，秦皮2两，甘草2两，蜀椒1两，附子1两。,上为末，炼蜜为丸，如梧桐子大。,nan,nan,nan,nan,nan,每服20丸，酒送下，日3次。,nan,nan
10008616,赤小豆煎,nan,nan,《奇正方》,脚气疝胀，产后肿满，水肿胀满，不论虚实。,nan,nan,nan,芫花8分，大戟8分，桑白皮1钱，葶苈子1钱2分，商陆20钱，生姜5钱，赤小豆1合。,nan,nan,nan,nan,nan,nan,以水8合，先煮6物，取4合3勺，去滓，纳赤小豆更煮令熟，日一夜吃尽。,nan,nan
10008624,赤小豆散,nan,nan,《医心方》卷十二引《小品方》。为《金匮》卷上“赤小豆当归散”之异名,产后烦闷，不能食，虚满。,nan,nan,nan,赤小豆3-7枚（烧）。,上为末。,nan,nan,nan,nan,nan,以冷水和，顿服之。,nan,nan
10008713,抽刀散,nan,nan,《妇人良方》卷一,散恶血。主产后心腹，胁肋、脚痛不可忍者。,nan,nan,nan,五灵脂（炒令烟尽）。,上为末。,nan,nan,nan,nan,nan,每服3钱，水半盏，酒半盏，童便半盏，煎至8分，通口服。,nan,nan
10008723,抽薪散,nan,nan,《古今医鉴》卷十二,产后血虚发热。,nan,nan,nan,熟地4钱，当归4钱，干姜（炒黑）1钱。,上锉1剂。,nan,nan,nan,nan,nan,水煎服。,《医钞类编》：此以干姜之苦温为从治，收其净散之热，使归依于阴分也。,nan
10008776,樗枝散,nan,nan,《普济方》卷三五七,产后子肠下出，不能收拾，不论年深者。,nan,nan,nan,樗枝（取皮，焙干）1握。,nan,nan,nan,nan,nan,nan,上加连根葱5茎，汉椒1撮，用水5升，同煎3升，去滓，倾盆内，乘热裹候，通手淋洗，倾入5升瓶内，再煎1沸，依前再用，五度洗了，睡少时。,nan,nan
10008908,除痛散,nan,nan,《医级》卷九,产后骨节烦疼，发热头重，胸闷气微，腹胀，恶露不行，四肢不举。,nan,nan,nan,当归、川芎、黄耆、肉桂、独活、牛膝、没药、灵脂、甘草（一方有白术）。,nan,nan,nan,nan,nan,nan,nan,nan,nan
10008924,除邪清肺汤,nan,nan,《会约》卷十五,产后肺冒风寒，寒热咳嗽。,nan,nan,nan,当归2钱，白芍（酒炒）1钱半，前胡1钱半，半夏1钱，陈皮1钱，杏仁1钱，茯苓1钱，甘草1钱，荆芥穗8分，麻黄（留节）4-5分。,nan,nan,nan,nan,nan,nan,加生姜、大枣为引，热服。有汗者，去麻黄，加桂枝8分。,nan,nan
10008949,楮实丸,nan,nan,《圣济总录》卷一六三,主治产后感受风寒，腰部疼痛。,nan,nan,nan,"楮实600克（炒）,牛膝（酒浸，切，焙）,当归（切，焙）,干姜（炮）各30克。",上四味，捣罗为末，炼蜜和丸，如梧桐子大。,nan,nan,nan,nan,nan,每服20丸，空腹时用酒送下。,nan,nan
10009007,川白姜散,nan,nan,《普济方》卷三六一引《直指》,产妇取冷太过，胎中受寒，令儿腹痛，不饮乳。,nan,nan,nan,木香、陈皮、槟榔、官桂、川白姜、甘草（炙）各等分。,上锉。,nan,nan,nan,nan,nan,每取1捻，水1合煎，以绵蘸与之。呕，加木瓜、丁香。,nan,nan
10009101,川乌酒,nan,nan,《普济方》卷三五O,产后中风，身如角弓反张，口噤不语。,nan,nan,nan,川乌5两（锉），黑豆半升（同炒半黑），酒3升。,nan,nan,nan,nan,nan,nan,上药泻于铛内急搅，以绢滤取汁，酒微温，服1小盏。若口不开者，拗开口灌之，未效，加乌粪1合（炒），纳酒中服之，以愈为度。,nan,nan
10009176,川芎汤,nan,nan,《宋?太平惠民和剂局方》,治产后去血过多，运闷不省，及伤胎去血多，崩中去血多，金疮去血多，拨牙齿去血多，不止，悬虚，心烦眩运，头重目暗，耳聋满塞，举头欲倒，并皆治之。,nan,nan,nan,当归（去芦.洗.焙）、川芎，各等分。,上粗散。,nan,nan,nan,nan,nan,每服三钱，水一盏半，煎至一盏，去渣，稍热服，不拘时。,nan,nan
10009182,川芎汤,川芎散,nan,《普济方》卷三五O,产后中风，身背拘急如束，并渴。,nan,nan,nan,川芎4两，羌活4两，羚羊角屑4两，酸枣仁4两，芍药4两，桑肉皮6分，防风。,nan,nan,nan,nan,nan,nan,川芎散（《准绳?女科》卷五）。方中防风用量原缺。,nan,nan
10009184,川芎汤,nan,nan,《宋氏女科》,产后去血过多，血晕不省。,nan,nan,nan,川芎5钱，当归5钱，荆芥穗5钱（炒黑）。,nan,nan,nan,nan,nan,nan,作1服，水煎，入酒、童便服之。,nan,nan
10009216,穿山甲散,nan,nan,《圣惠》卷八十,产后恶血在腹中，痛不可忍。,nan,nan,nan,穿山甲1两，儿孩子头发1两（10岁以下者佳），干漆1两，红兰花子1两，赤鲤鱼鳞2两，灶突墨2两。,上药都入于瓷瓶子内，以瓦子盖瓶口，用盐泥固济，于盖上开一窍，以大火烧令烟白色，住火候冷取出，细研为散。,nan,nan,nan,nan,nan,每服1钱，以热酒调下，不拘时候。,nan,nan
10009350,春蕨散,nan,nan,《圣济总录》卷一六五,主治产后痢疾。,nan,nan,nan,新生蕨菜不限多少,阴干为细散。,nan,nan,nan,nan,nan,每次，6～9克，空腹时用陈米饮调下。,nan,nan
10009408,慈航丹,nan,nan,《全国中药成药处方集》（抚顺方）,活血调经。主治经水不调，赤白带下，症瘕血痨；胎前产后血迷晕耗，生产迟延，胎衣不下，子痫子挛，肝气冲心。,nan,nan,nan,当归4两，川芎3两，坤草6两，香附2两。,上为细末，炼蜜为丸，每丸重2钱或3钱，朱砂为衣。,nan,nan,nan,nan,nan,每服2钱，1日2次，黄酒送下。,nan,nan
10009562,葱白补骨脂汤,nan,nan,《陈素庵妇科补解》卷五,温下焦，行水。主治产前内积冷气，产时尿胞运动，产后腹胀如鼓，小便不通，闷乱欲死。,nan,nan,nan,杜仲、远志、当归、川芎、陈皮、甘草、瞿麦、补骨脂、香附、牛膝、葱白、车前子。,nan,nan,nan,nan,nan,nan,nan,冷气积于膀胱，产后血虚受冷，凝滞不行，以致腹胀闷绝，理或有之，热结寒亦结，《经》所谓脏寒生满病也。方以川芎、当归辛温以补血，远志、骨脂辛热以补暖下焦，陈皮、香附行气，车前、甘草、瞿麦行水，葱白开窍，杜仲、牛膝引药下行，其性最速。方中皆辛温通利之药，庶复冷气除，小便得温而自通矣。,nan
10009576,葱白散,nan,nan,《博济》卷二,温通调经。主治一切冷气不和，及本脏膀胱气攻冲疼痛；妇人产前产后腹痛，胎不安，或血刺者；兼能治血脏宿冷，百节倦疼，肌瘦怯弱，伤劳带癖。脾胃虚冷，攻筑心下，连胁肋刺痛，胸膈病闷，背膊连顶，拘急疼痛，不思饮食，或时呕逆，霍乱转筋，腹冷泄泻，膀胱小肠及外肾肿痛，食伤浮肿，心脾冷痛。,nan,nan,nan,川芎1两，当归1两，枳壳（去白，麸炒）1两，厚朴（去白，姜汁炙）1两，官桂（去皮）1两，干姜（炮）1两，芍药1两，木香1两，青橘皮（去白）1两，神曲人参1两，蓬莪术（醋浸1宿，焙）1两，舶上茴香（炒）1两，荆三棱（炮）1两，苦楝子1两，茯苓（去皮）1两，干地黄1两，大黄半两，诃子半两（去核）（2味酌用）。,上杵为末。,nan,nan,nan,nan,nan,本方方名，《医方类聚》引《管见良方》引作“蟠葱散”。本方改为丸剂，名“葱白丸”（见《中药成方配本》）。,《济阴纲目》：重在冷气不和，恐非胎前所宜，若产后血刺痛，或血脏冷者宜之。人身以气血流行为无病，此方以四物补血，人参助气，枳壳、厚朴行上焦之气，茴香、苦楝行下焦之气，木香、青皮行肝气，干姜温行血中之气，其余消之削之，皆所以温而行之也，气一行则痛自止矣。以盐行入血分，使气下行而主内，以葱引气外通而开表，如是则内外和而痛愈矣。,nan
10009607,葱饼子,nan,nan,《普济方》卷三五四引《余居士选奇方》,妇人未产之前，内积冷气，遂至产时尿胞运动不顺，产后小便不通、腹胀如鼓，闷乱不醒。,nan,nan,nan,盐，葱白（剥去粗皮）10余根。,nan,nan,nan,nan,nan,nan,用盐于产妇脐中，填与脐平，却用葱白作一缚，切作一指厚片，安在盐上，用大艾炷满葱饼子大小，以火灸之，觉热气直入腹中，即时通便。,nan,nan
10009638,葱胶汤,nan,nan,《圣济总录》卷一五七,妊娠大便不通；产后大小便不通。,nan,nan,nan,葱白1茎（切），牛皮胶2片（大者，捶碎）。,nan,nan,nan,nan,nan,nan,上用水1盏半，煎令胶烊尽，去滓顿服。,nan,nan
10009651,葱苏散,nan,nan,《医级》卷七,胎前产后感邪，表症悉具者。,nan,nan,nan,苏叶、葱白、生姜、川芎。,nan,nan,nan,nan,nan,nan,nan,nan,nan
10009666,葱涎丸,nan,nan,《普济方》卷三五四,润肠。主治产后水血俱下，肠虚津液不足，大便秘涩，5-6日不解，腹中闷胀。,nan,nan,nan,麻仁、枳壳各等分。,上为末，葱涎调腊茶为丸。,nan,nan,nan,nan,nan,每服50-70丸，空心、食前葱茶送下。,nan,nan
10009680,葱粥,nan,nan,《圣济总录》卷一九O,妊娠数月未满损动，及产后血运。伤风。,nan,nan,nan,葱3茎，糯米3合。,nan,nan,nan,nan,nan,nan,上以葱煮糯米粥食之。,nan,nan
10009702,醋鸡子,nan,nan,《圣济总录》卷一六O,产后血运迷闷，不省人事，面唇青冷。,nan,nan,nan,酽醋、生鸡子。,nan,nan,nan,nan,nan,nan,先以酽醋半盏，煎数沸，打破鸡子1枚，投于醋中，熟搅令匀，顿服之。,nan,nan
10009703,醋煎散,nan,nan,《杨氏家藏方》卷十六,主治妇人血气，腹胁刺痛不可忍；产后败血，儿枕急痛。,nan,nan,nan,"高良姜30克,当归（洗，焙）,肉桂（去粗皮）,白芍药,陈橘皮（去白）,乌药各15克。",上药共研为细末。,nan,nan,nan,nan,nan,每服9克，用水150毫升、醋150毫升，同煎至210毫升，通口服，不拘时候。,nan,nan
10009712,醋煮散,醋煎散,nan,《女科万金方》,产后胎衣不下，血闷冲心。经行少腹结痛，产后恶露不行。,nan,nan,nan,三棱、莪术、宫桂、赤芍、香附、甘草、乌药。,nan,nan,nan,nan,nan,nan,醋煎散（《张氏医通》卷十五）。《张氏医通》本方用法，通用醋炒，为散，每服三钱，空心砂糖汤调服。血盛，加红花、当归、青皮。,nan,nan
10009722,催乳散,nan,nan,《惠直堂经验方》卷四,散结通乳。主治产后乳汁不通。（下乳）,nan,nan,nan,"漏芦,通草各3克,贝母6克,白芷3克。",共为末。,nan,nan,nan,nan,nan,用猪前蹄1个，酒，水各半，煎汤送下。,nan,nan
10009724,催生安胎救命散,nan,nan,《卫生家宝产科备要》卷六,产难，死胎在腹，死血冲心，血山崩，产后一切血疾。,nan,nan,nan,乌药4两（别用醋炒黄色），前胡半两（拣净），菊花1两（去梗），蓬莪术2两（炮，乘热锉碎），当归半两（去芦须，洗，切，焙）。,上锉，用好米醋炒干为度，同为末，用新瓷罐收，勿令失气味。,nan,nan,nan,nan,nan,如死胎在腹，每服3钱，用炒姜豆淋酒调下，连进3服，立下；死血冲心，每服2钱，用炒姜豆淋酒调下，入童子小便半盏；安胎，每服1钱，用热酒调下；血山崩，每服1钱，用热酒调下；寻常催生；每服3钱，用炒姜豆淋酒调下，只1-2服，立生。,nan,nan
10009727,催生丹,nan,nan,《宋?太平惠民和剂局方》,治产妇生理不顺，产育艰难，或横或逆，并宜服之，神效。,nan,nan,nan,麝香（别研）一字，乳香（别研极细）一分，母丁香（取末）一钱，兔脑髓（腊月者.去皮膜.研）。,nan,nan,nan,nan,nan,nan,每服一圆，温水下，即时产下。随男左，女右，手中握药圆出是验。,nan,nan
10009730,催生丹,催生汤,nan,《产育宝庆集》卷上,胎死腹中，或产母气乏蒌顿，产道干涩。产妇阵疏难产，经2-3日不生。,nan,nan,nan,苍术（米泔浸）2两，桔梗1两，陈皮6钱，白芷3钱，桂心3钱，甘草（炙）3钱，当归2两，川乌头（炮，去皮尖）2两，干姜（炮）2两，厚朴（制）2两，南星（炮）2两，附子（炮，去皮脐）2两，半夏（汤洗7次）2两，茯苓2两，芍药2两，杏仁（炒，去皮尖）2钱5分，阿胶（面炒）2钱5分，川芎1钱半，枳壳（面炒）4钱，南木香1钱。,上为末。,nan,nan,nan,nan,nan,催生汤（《三因》卷十七）。,nan,nan
10009738,催生膏,nan,nan,《理瀹》,安神息力以催生。如生产尚早，亦能安胎。主治难产，数日不安，及交骨不开者。,nan,nan,nan,大龟1个（要板黑者为佳，黄色者不佳，约2-3斤，愈大愈妙。用小磨麻油浸数日，熬枯去滓，再将油炼老，下炒黄丹收，加炒铅粉4两，搅匀）。,临用以黏3钱摊皮纸上，令产妇平身安睡，贴膏脐上，外加敷药：车前子2两，川芎、全当归各1两，冬葵子7钱，枳壳、白芷、半夏、白蔹各4钱，共研末，入榆面3两，益元散2两，和匀。,nan,nan,nan,nan,nan,每用1两，以姜葱汁、陈酒、醋调敷；胞干，用炼猪油调；夏天天热，用麻油、白蜜、鸡清调敷。如下死胎，加附子、官桂。睡醒自生。,nan,nan
10009774,催生汤,nan,nan,《圣济总录》卷一五九,妇人临产，胞伤风冷，腹痛频并，不能分娩。,nan,nan,nan,王不留行1两半，京三棱（煨，锉）1两半，牵牛子（炒）1两半，百合1两半，当归（切，焙）1两半，威灵仙1两半，雷丸1两，大黄（锉，炒）1两，天雄（炮裂，去皮脐）1两，桂（去粗皮）3分，甘草（炙）3分，大腹2两（锉）。,上(口父)咀，如麻豆大。,nan,nan,nan,nan,nan,每服5钱匕，水1盏半，煎至8分，去滓温服。,nan,nan
10009779,催生饮,nan,nan,《回春》卷六,燥涩紧敛，生产难者。临产血亏气滞，不能荣润其胎，故生产艰难，脉涩滞者。,nan,nan,nan,当归、川芎、大腹皮（洗）、枳壳（麸炒）、白芷各等分。,上锉1剂。,nan,nan,nan,nan,nan,水煎，温服。,《医略六书》：方中当归养血，以荣胎气；川芎活血，以行血气；白芷通经散滞；枳壳泻滞化气；大腹皮泻滞气，以推送胎元。水煎温服，使血活气行，则胎元运动而无阻遏之患，何致生产艰难不顺哉！,nan
10009808,寸金丹,nan,nan,《仙拈集》卷四,中风、中寒、中暑，口眼歪斜，牙关紧闭；伤寒时疫；头疼脊强，恶寒发热；霍乱，绞肠痧，吐泻腹痛；疟疾；泻痢脓血；肚痛饱胀；伤食生冷，饱闷嗳气，不服水土；途间中暑，眼黑头痛；小儿伤寒，伤食，发热不解。伤风咳嗽，瘴气，吞酸；产后昏迷，恶露不尽；小儿急，慢惊风。,nan,nan,nan,乌药1两，防风1两，羌活1两，前胡1两，川芎1两，砂仁1两，厚朴1两，藿香1两，半夏1两，木香1两，紫苏1两，薄荷1两，苍术1两，香附1两，赤茯苓1两，白芷1两，陈皮1两，枳壳两半，炙草两半，白豆蔻2两，草果仁1两。,上为末，另用神曲24两，多捣生姜汁拌糊为丸，以水飞朱砂2两为衣，每丸重1钱2分，阴干。,nan,nan,nan,nan,nan,大人服1-2丸，小儿半丸，以愈为度。男妇老幼中风、中寒、中暑，口眼歪斜，牙关紧闭，姜汤送下；伤寒时疫，头痛脊强，恶寒发热，葱、姜汤送下；霍乱、绞肠痧，吐泻腹痛，姜汤送下；初疟久疟，桃枝汤送下；泻痢脓血，肚痛饱胀，木香汤送下；伤食生冷，饱闷嗳气，不服水土，姜汤送下；途间中暑，眼黑头痛，凉水调灌即解；小儿伤寒、伤食、发热不解，清米饮送下。,nan,nan
10009958,大补汤,nan,nan,《千金翼》卷六,产后虚不足，少气乏力，腹中拘急痛；及诸疾痛，内崩伤绝，虚竭里急，腰及小腹痛。,nan,nan,nan,当归3两，干地黄3两，半夏（洗去滑）3两，桂心3两，吴茱萸1升（一本无），人参2两，麦门冬干姜2两，甘草（炙）2两，白芷2两，芍药4两，大枣40枚（擘）。,nan,nan,nan,nan,nan,nan,上(口父)咀。以水1斗，煮取3升，分3服。,nan,nan
10009961,大补汤,nan,nan,《准绳?女科》卷五,产后百日外，面青，浮肿，唇白，气急有汗，乃大虚之证。,nan,nan,nan,当归头、大川芎、大白术、白芍药、白茯苓（多）、人参（多）、黄耆（多）、五味子、熟地黄、干姜（上下）、甘草（少）。,上锉散。,nan,nan,nan,nan,nan,水煎服。服此2帖不退，即加川乌、木香（另磨入服）；有泻，加诃子、肉豆蔻、粟壳。,nan,nan
10009978,大补益当归丸,当归丸、内补当归丸、大效内补丸,nan,《千金》卷四,产后虚羸不足，胸中少气，腹中拘急疼痛，或引腰背痛；或所下过多，血不止，虚竭乏气，昼夜不得眠；及崩中，面目脱色，唇干口燥；亦治男子伤绝，或从高堕下，内有所伤，脏虚吐血，及金疮伤犯皮肉。,nan,nan,nan,当归4两，芎4两，续断4两，干姜4两，阿胶4两，甘草4两，白术3两，吴茱萸3两，附子3两，白芷3两，桂心2两，芍药2两，干地黄10两。,上为末，炼蜜为丸，如梧桐子大。,nan,nan,nan,nan,nan,当归丸（《局方》卷九）、内补当归丸（《直指》卷二十六）、大效内补丸（《得效》卷十五）。,nan,nan
10009980,大补益母丸,大补丸,nan,《履霜集》卷二,调经安胎。主治虚损而经候不调，或因虚损而经闭不行，或因虚损而吐衄崩带，或因虚损而小胎不稳，或因虚损而产后多疾。,nan,nan,nan,益母草8两（用上截），香附2两（7制），嫩黄耆3两（蜜炒），人参2两（去芦），白术3两（土炒），白茯苓2两（蒸透），炙草2两，当归身3两（俱酒洗），白芍2两（酒炒），陈皮2两，熟地3两，砂仁2两（炒）。,nan,nan,nan,nan,nan,nan,为丸服。经不调，龙眼肉、炒枣仁、去心莲子煎汤送下；经闭，炒桃仁，炒红花煎汤送下；下血，生地、炒芩、丹皮煎汤送下；小胎不稳，炒芩、陈皮（去自）、苏梗煎汤送下，俱4、5分为率；产后恶露未净，腹中心硬疼，先用黄酒服救产丸，下净瘀血，继服此丸；若无恶露，多服此九，补虚为主；感寒，加生姜；发热，加童便。,nan,nan
10009985,大补阴阳汤,nan,nan,《会约》卷十五,产后气血两虚，遗尿莫禁。,nan,nan,nan,黄耆3钱（蜜炙），白术1钱半，益智仁1钱半，山药（炒）1钱半，当归（去尾）2钱，熟地2钱，益母草2钱，牡蛎（煅，研粉）3钱，甘草（炙）1钱，白芍（酒炒）1钱，干姜（炒）6分。,nan,nan,nan,nan,nan,nan,生姜、大枣为引。速进2-3剂。或加附子7分，以助药力。,nan,nan
10009986,大补营卫汤,nan,nan,《会约》卷十五,产妇气血虚弱，或胞浆下而不生者。,nan,nan,nan,人参（随便），黄耆（蜜炒）2两，当归（去尾）2两，川芎3-4钱，益母草（用赤花者）1两。,nan,nan,nan,nan,nan,nan,浓煎汤，频频服之。如无参，加附子1钱以助药力。,nan,nan
