序号,方名,规范名,经典,出处,主治,功用,功用大类,功用小类,处方,炮制,方解,禁忌,化裁,附方,文献,用法用量,名家论述,备注
10014463,二圣大宝琥珀散,nan,nan,《妇人良方》卷二,妇人血海不调，膈气，不孕；产后胞衣不下，瘀血犯心，眼见鬼神。,nan,nan,nan,生地黄1斤，生姜1斤（二味各研取自然汁，将地黄汁炒生姜滓，姜汁炒地黄滓，各稍干，焙为细末），当归1两，川芎1两，牡丹皮1两，芍药1两，莪术1两，蒲黄1两，香白芷1两，羌活（八味各炒）1两，桂心（不见火）1两，熟地黄（炒）1两。,上为细末，于瓷盆内收之。,nan,nan,nan,nan,nan,妇人冷气痛，并血海不调，膈气，炒姜、酒下2钱；产后胞衣不下，暖酒调下2钱；产妇临月，每日3次，则滑胎易产，温酒调2钱；产后血犯心，眼见鬼神，用童便半盏、酒半盏同煎，调2钱；一生无子者，久服则有孕。此药治妇人百病，空心，日午食前，每日2次。产后百病，并暖酒调下。,nan,nan
10014481,二圣散,nan,nan,《鸡峰》卷十六,妇人产后血上攻，迷闷不醒人事。,nan,nan,nan,当归、五灵脂各等分。,上为细末。,nan,nan,nan,nan,nan,每服1-2钱，以酒、童便各半盏调服，不拘时候。,nan,nan
10014511,二十四味万灵丸,nan,nan,《博济》卷四,妇人产前产后诸疾，并36种冷血风气等病。,nan,nan,nan,人参半两，茯苓3分（去皮），当归半两，官桂（去皮）半两，吴白芷半两，细辛半两，木香半两，牛膝半两，左山寒水石半两，藁本半两，麻黄（去节）半两，甘草（炙）半两，兰香菜（如无菜，只用子亦得）半两，防风附子（炮）半两，蝉蜕半两（去土），芍药3分，牡丹皮3分，马鸣退1两（炙），沉香1分，石茱萸1分。,上为细末，炼蜜为丸，如弹子大。,nan,nan,nan,nan,nan,每日空心用酒化服1丸。若死在腹中，不过3丸，生下死胎；生衣不出，1丸便出；产后腹内绞痛，绕脐下如刀刺者，1丸便止；产前产后赤白痢，并带下及呕逆，心气烦满，服1丸立愈；如怀胎入产月，但1日1服，至生产时，不觉痛；产前伤寒中风，体如板者，用热煎麻黄汤送下1丸，立止。,nan,nan
10014513,二十四制清宁丸,nan,nan,《全国中药成药处方集》（杭州方）,脏腑积热，湿热秽毒，眼目赤肿，郁热头痛，咽痛牙痛，口鼻热疮，食积腹痛，湿热黄疸，痢疾初起，里急后重，淋浊涩痛，疮肿热毒，以及妇人经水不调，产后瘀血作痛。,nan,nan,nan,锦纹大黄（酒拌，蒸3日，晒干）、鲜桑叶、鲜侧柏叶、鲜桃叶、鲜槐树叶。,nan,nan,nan,nan,nan,nan,四味鲜叶垫蒸底，蒸透取出晒干，每大黄1斤，后药各用7钱。1次用藕汁，2次用甘蔗汁，3次用赤苓汤，4次用泽泻汤，5次用猪苓汤，6次用鲜车前子汤，7次用川黄柏汤，8次用川朴汤，9次用炒白术汤，10次用薄荷汤，11次用米仁汤，12次用当归汤，13次用韭菜汁，14次用牡丹皮汤，15次用木通汤，16次用川石斛汤，17次用连翘汤，18次用陈皮汤，19次用半夏地骨皮汤，22次用玄参汤，23次用知母汤，24次用甘草汤。以上每次均拌蒸透，晒干，研为细末，用黄牛乳、梨汁、陈酒和蜜、水泛丸。每服2至3钱，小儿减半，开水送下。,nan,nan
10014532,二术四神丸,nan,nan,《陈素庵妇科补解》卷五,温肾健脾，兼消食。主治产后血气虚损，饮食不能运化，或受风冷以致泄泻，甚则腹痛。,nan,nan,nan,苍术（泔浸）1两，白术（土炒）2两，补骨脂（盐水拌炒）1两5钱，吴茱萸（汤泡去沫）5钱，厚朴（姜汁制）1两，广皮1两，神曲2两。,姜汁调前药，面糊为丸。,nan,nan,nan,nan,nan,每服3钱，空心砂仁汤送下，1日2次。,脾气虚弱，不能运化水谷，命门火衰，不能蒸腐水谷，加以风冷外袭，故泄泻也。补火以生土，扶土以制水，则泻自止。方中骨脂辛温补右尺；二术补脾，土恶湿而喜燥，故用术以祛湿止泄；茱萸温经散寒；陈、朴、神曲消食运气。,nan
10014581,二仙丹,nan,nan,《会约》卷十五,产妇败血闭塞水沟，小便不通。,nan,nan,nan,瞿麦4钱，蒲黄2钱。,nan,nan,nan,nan,nan,nan,水煎服。,nan,nan
10014617,二香散,nan,nan,《医学心悟》卷五,散寒消食。主治产后外感风寒，内伤饮食，心腹疼痛，口鼻气冷，吞酸满闷者。,nan,nan,nan,砂仁，木香，黑姜，陈皮，炙甘车各30克，香附90克（姜汁炒）。,共为末。,nan,nan,nan,nan,nan,每服6克，生姜汤调下。,nan,nan
10014654,二宜散,nan,nan,《良朋汇集》卷五,胎前产后诸病。,nan,nan,nan,茯苓3钱，黄柏3钱，黄芩3钱，枳壳3钱，甘草3钱，甘菊3钱，熟地5钱，柴胡1钱。,nan,nan,nan,nan,nan,nan,上(口父)咀。水煎服。,nan,nan
10014682,二子饮,nan,nan,《寿世保元》卷七,产后郁冒汗多，大便闭；老人、诸虚人风闭。,nan,nan,nan,苏子半合，火麻子（去壳）半合。,nan,nan,nan,nan,nan,nan,拣净洗，研极细，用水再研，取汁1杯，分3次煮粥食之。,nan,nan
10014727,发灰汤,nan,nan,《圣济总录》卷一六五,产后小便不通。,nan,nan,nan,乱发（烧灰）1两，车前子1两，大黄（锉，炒）1两，桂（去粗皮）1两，当归（切，焙）1两，滑石1两，冬瓜子5合，木通（锉）1两半。,上为粗末。,nan,nan,nan,nan,nan,每服3钱匕，水1盏，煎7分，去滓温服，日2夜1。,nan,nan
10014754,法炼红花散,nan,nan,《普济方》卷三一一,从高坠下，腹心瘀血，及妇人月水不匀，产后诸疾，血晕闷绝，或狂语者。,nan,nan,nan,红蓝花10两，好醋2升。,上以蓝花浸醋中2宿，漉出，火焙干，又入醋焙干，以醋尽为度，焙干为末。,nan,nan,nan,nan,nan,每服3钱，用童子便调下，1日3次。,nan,nan
10014915,燔葱散,nan,nan,《局方》卷三（新添诸局经验秘方）,脾胃虚冷，攻筑心腹，连胁肋刺痛，胸膈痞闷，背膊连项拘急疼痛，不思饮食，时或呕逆，霍乱转筋，腹冷泄泻，膀胱气刺，小肠及外肾肿痛；及治妇人血气攻刺，症瘕块硬，带下赤白，或发寒热，胎前产后恶血不止，脐腹疼痛；一切虚冷，不思饮食。,nan,nan,nan,延胡索3两，苍术（米泔浸1宿，去皮）半斤，甘草莪术6两，三棱（煨）6两，青皮（去白）6两，丁皮4两，缩砂（去皮）4两，槟榔4两，肉桂（去粗皮）2两，干姜（炮）2两。,上为末。,nan,nan,nan,nan,nan,每服2钱，水1盏，连根葱白1茎，煎7分，空心、食前稍热服。,nan,nan
10014942,返魂神白散,返魂散,nan,《博济》卷五,打扑伤损及伤中；妇人产后血晕。,nan,nan,nan,花蕊石5斤（捶碎、如皂子大），硫黄6两（捶碎，如皂子大）。,上用瓷盆子一个，先入蕊石一层，次入硫黄一层，重重铺尽，上用鸭舌草盖之，赤石脂和涂盒子口缝，又用盐泥固济，勿令有小缝纹，用新砖一块，上安盒子，用炭火2斤煅之，耗及三分，渐渐去之，取出盒子，地坑内埋一宿，细研为末。,nan,nan,nan,nan,nan,返魂散（《鸡峰》卷二十二）。方中硫黄用量原缺，据《鸡峰》补。,nan,nan
10014944,返魂汤,nan,nan,《简明医彀》卷三,妇人血逆卒厥，并产后血厥，昏晕目闭，口噤者。,nan,nan,nan,当归（酒洗）、川芎、肉桂、干姜（炮）、赤芍药、甘草、黑豆（炒、去壳）、紫苏各等分。,nan,nan,nan,nan,nan,nan,水煎服；或为细末，每服2钱，酒调下。,nan,nan
10014956,返元汤,nan,nan,《简明医彀》卷七,产后恶露上逆，神昏不省，二便不通，脉洪。,nan,nan,nan,当归5钱，川芎3钱，五灵脂钱半，桃仁钱半，大黄2钱，芍药1钱，肉桂6分，人参5分。,nan,nan,nan,nan,nan,nan,水煎，加童便、沙糖、酒送服。,nan,nan
10014990,防风赤芍汤,nan,nan,《医略六书》卷三十,产后瘀血内滞，湿热不化，下注而致脚气，足胫红肿疼痛不止，脉数涩大者。,nan,nan,nan,双防己2两，木防己3两，赤芍药1两半，秦艽肉2两，苡米仁5两，宣木瓜3两，川续断3两（酒炒），杜牛膝3两（酒炒）。,上为散。,nan,nan,nan,nan,nan,每服3钱，水煎，去滓温服。,汉防己泻血分湿热，木防己散血分风邪，赤芍破瘀血以通经，米仁渗湿热以除痹，秦艽通肌活血，木瓜醒脾舒筋，续断续经脉，牛膝利血脉也。为散水煎，使瘀血消散，则湿热自化而经脉清和，何红肿疼痛之不退哉。,nan
10014996,防风当归散,防风当归汤、防风当归饮,nan,《此事难知》,祛风养血。主治发汗过多，发热头面摇，卒口噤，背反张者，太阳兼阳明及产后痉。,nan,nan,nan,防风1两，当归1两，川芎1两，地黄1两。,上锉。,nan,nan,nan,nan,nan,防风当归汤（《医学正传》卷五）、防风当归饮（《证治汇补》卷三）。,nan,nan
10015014,防风葛根汤,nan,nan,《普济方》卷三五一,产后风虚，头目痛，语言时僻。,nan,nan,nan,防风8分，甘葛8分，茯苓8分，麦门冬（去心）8分，芍药6分，黄芩6分，犀角4分，甘草3两。,nan,nan,nan,nan,nan,nan,以水2升，煎取7合，分为2服。,nan,nan
10015035,防风酒,nan,nan,《千金》卷三,产后中风。,nan,nan,nan,防风1斤，独活1斤，女萎2两，桂心2两，茵芋1两，石斛5两。,nan,nan,nan,nan,nan,nan,以酒2斗，渍3宿。初服1合，稍加至3-4合，每日3次。,nan,nan
10015122,防风丸,nan,nan,方出《千金》卷三，名见《普济方》卷三五二,产后劳损，无子，阴中冷汁溢出。子门闭，积年不愈，身体寒冷。,nan,nan,nan,防风1两半，桔梗30铢，人参1两，菖蒲18铢，半夏18铢，丹参18铢，厚朴18铢，干姜18铢，紫菀18铢，杜衡18铢，秦艽半两，白蔹半两，牛膝半两，沙参半两。,上为末，白蜜为丸，如小豆大。,nan,nan,nan,nan,nan,每食后服15丸，日3次。不知，增至20丸，有妊止。服药后7日，方合阴阳。,nan,nan
10015137,防风羊角汤,防风羚羊角汤,nan,《济阴纲目》卷十二,产后气血不足，血亏寒滞，热郁于经，中风挛痛，肢体挛痛，背项强直。,nan,nan,nan,防风1两，赤芍半两（炒），桂心半两，羚羊角2钱，川芎2钱，羌活2钱，当归2钱，酸枣仁2钱（炒），牛蒡子（炒）2钱。,上锉。,nan,nan,nan,nan,nan,防风羚羊角汤（《医略六书》卷三十）。,《医略六书》：防风疏风邪之外客，羚羊清郁热之炽热，羌活除肢体之痛，牛蒡除项背之强，当归养血脉以荣经，川芎行血气以活络，赤芍泻血中之滞，桂心温血室之寒，枣仁养心润燥以资营血也。水煎温服，使滞化血荣，则热郁自泄而风寒解散，经络清和，肢体项背无不皆受其荫，安有挛急疼痛、牵强挺直之患乎？,nan
10015173,防己膏,nan,nan,《准绳?女科》卷五,产后中风，四肢筋脉挛急，身体麻痹。,nan,nan,nan,汉防己（去皮）半斤，茵芋5两。,用酒5升，浸药一宿，取猪脂肪1斤，文武火熬三上三下成膏，摊在纸花上。,nan,nan,nan,nan,nan,贴病人患处，以热手不住摩膏上。,nan,nan
10015225,防己枳壳汤,nan,nan,《圣济总录》卷一六五,产后肿满喘咳。,nan,nan,nan,防已1两，枳壳（去瓤，麸炒）2两，桑根白皮1两（锉），当归（切，焙）1两，木香半两，紫苏茎1两（锉），槟榔（锉）1两。,上为粗末。,nan,nan,nan,nan,nan,每服5钱匕，水1盏半，煎至1盏，去滓温服，不拘时候。,nan,nan
10015270,飞步饮,nan,nan,《玉案》卷五,产后虚极，足软不能行步。,nan,nan,nan,人参1钱5分，白术1钱5分（土炒），当归1钱5分，牛膝1钱5分，莲子1钱5分（去心）。,nan,nan,nan,nan,nan,nan,加大枣5个，水煎服，不拘时候。,nan,nan
10015305,非风汤,nan,nan,《医方简义》卷六,产后遍身肢节疼痛。,nan,nan,nan,桑寄生3钱，当归3钱，赤芍1钱，川芎2钱，生绵黄耆2钱，炙绵黄耆2钱，桂枝6分，红花6分（酒润），牛膝2钱，独活1钱，木瓜1钱5分。,nan,nan,nan,nan,nan,nan,水煎，冲入陈酒1盏服。,nan,nan
10015391,分膈丸,nan,nan,《鸡峰》卷十七,血气及一切积聚败血为病，以及产后注懑，心腹疾涎，腹秘不通。,nan,nan,nan,人参1两，槟榔2个，肉豆蔻仁2个，木香1两，茯苓1两，水银4两（水煮1伏时，枣肉内研星尽），没药1两，青橘1两，当归8两，不蛀皂角1挺，麒麟竭半两。,上为细末，分一半，别入灯上燎者巴豆21个，杏仁21个，同用面糊为丸，如梧桐子大。,nan,nan,nan,nan,nan,一半药末只炼蜜为剂，杵1000下。吃时旋丸小豆大，并每服5-7丸。汤使临时。,nan,nan
10015572,风湿汤,nan,nan,《普济方》卷一八五,风寒湿痹，腰脚疼，着床不能走；妇人产后血气虚损，伤风寒湿，口急项强，腰脚疼痹。,nan,nan,nan,当归半两，芍药半两，麻黄（去根节）半两，白术半两，甘草（炙）半两，川乌（炮，去皮）1两。,nan,nan,nan,nan,nan,nan,上(口父)咀。每服3钱，水1盏半，加生姜3片，煎至7分，去滓，食前温服，日3次。,nan,nan
10015612,封脐膏,nan,nan,《宋氏女科》,产后虚汗不止。,nan,nan,nan,五倍子不拘多少。,上为末。,nan,nan,nan,nan,nan,津吐调匀，填脐内，封固，用绵缚之。,nan,nan
10015647,蜂房散,nan,nan,《圣济总录》卷一六六,妒乳。产后乳汁不出，蕴积在内，结成痈肿。,nan,nan,nan,露蜂房（烧灰）。,上为细末。,nan,nan,nan,nan,nan,每服2钱匕，水1盏，煎至6分，温服，不拘时候。,nan,nan
10015676,凤凰散,nan,nan,《良朋汇集》卷四,妇人产后大热发烧。,nan,nan,nan,公鸡粪（焙干）2两。,nan,nan,nan,nan,nan,nan,水2钟，煎6分，凉冷，一饮而止。,nan,nan
10015716,佛手散,nan,nan,《妇人大全良方》卷二十一,主治产后血虚劳倦，盗汗，多困少力，咳嗽。,nan,nan,nan,当归，川芎，黄耆各30克，北柴胡，前胡各7.5克。,上药哎咀。,nan,nan,nan,nan,nan,每服9克，用水300毫升，加桃、柳枝各9厘米，枣子、乌梅各1枚，生姜3片，煎至180毫升，去滓温服。如有痰，去乌梅。,nan,nan
10015793,伏龙肝散,黄土酒,nan,《圣惠》卷七十八,产后中风，口噤不能语，腰背着床不得。,nan,nan,nan,伏龙肝1两半，干姜半两（炮裂，锉）。,上为细散。,nan,nan,nan,nan,nan,黄土酒（《圣济总录》卷一六一）。,nan,nan
10015804,伏龙肝汤丸,nan,nan,《张氏医通》卷十四,胎前下痢，产后不止，及元气大虚，瘀积小腹结痛，不胜攻击者。,nan,nan,nan,炮黑楂肉1两，熬枯黑糖2两。,上2味，一半为丸，一半为末。,nan,nan,nan,nan,nan,用伏龙肝2两煎汤代水，煎末2钱，送前丸2钱。日3夜2服，1昼夜令尽。气虚，加人参2-3钱，以驾驭之；虚热，加炮姜、肉桂、茯苓、甘草；兼感风寒，加葱白、香豉；膈气不舒，磨沉香汁数匙调服。,nan,nan
10015824,扶解调肝汤,nan,nan,《中医妇科治疗学》,扶气养血舒郁。主治产后血崩，头晕目眩，精神抑郁，嗳气太息，心烦善怒，胸闷，两胁胀痛，血色淡红，食欲减退，大便不调或溏薄不畅，舌苔薄白，脉弦，重按无力。,nan,nan,nan,泡参5钱，白术3钱，炒白芍3钱，阿胶珠2钱，茯神3钱，软柴胡2钱，甘草1钱。,nan,nan,nan,nan,nan,nan,nan,nan,nan
10015861,扶阳饮,nan,nan,《产科发蒙》卷三,产后血晕，恶露下多而晕，病人低头，昏闷烦乱，而心下不硬满。,nan,nan,nan,当归1钱半，川芎1钱半，桂枝1钱半，干姜（炒黑）1钱半，附子（熟）1钱半，人参1钱半。,nan,nan,nan,nan,nan,nan,以水2合，煎取1合，温服。,nan,nan
10015981,茯苓黄耆汤,nan,nan,《圣济总录》卷一六二,产后伤风，头痛，目昏眩。,nan,nan,nan,白茯苓（去黑皮）1两，黄耆（锉）1两，菊花1两，独活（去芦头）1两，枳壳（去瓤，麸炒）1两，当归（切，焙）1两，生干地黄（焙）1两，人参1两，乌头（炮裂，去皮脐）1两。,上锉，如麻豆大。,nan,nan,nan,nan,nan,每服3钱匕，水1盏，煎至7分，去滓温服，不拘时候。,nan,nan
10015984,茯苓建中汤,nan,nan,《产科发蒙》卷四,产后下利不止。,nan,nan,nan,小建中汤加茯苓。,nan,nan,nan,nan,nan,nan,烧黑鱼狗末5分点服。,nan,nan
10016000,茯苓前胡汤,nan,nan,《圣济总录》卷一六二,产后伤风头痛，眩闷倒旋。,nan,nan,nan,白茯苓（去黑皮）1两，前胡（去芦头）1两，菊花1两，白术1两，附子（炮裂，去皮脐）1两，细辛麻黄（去根节）1两。,上锉，如麻豆大。,nan,nan,nan,nan,nan,每服2钱匕，水1盏，煎至7分，去滓温服，不拘时候。,nan,nan
10016016,茯苓散,nan,nan,《妇人良方》卷十九,产后狂语，志意不定，精神昏乱，心气虚，风邪所致。,nan,nan,nan,茯苓（一方使茯神）12分，生地黄12分，远志10分，白薇10分，龙齿10分，防风8分，人参8分，独活8分（同为末）。,nan,nan,忌菘菜、猪肉、生冷。,nan,nan,nan,nan,nan,nan
10016031,茯苓生化汤,nan,nan,《梅氏验方新编》卷四,产后泄泻。,nan,nan,nan,川芎1钱，当归2钱（土炒），姜炭5分，炙甘草5分，茯苓1钱，陈皮1钱，白术1钱半，人参2钱，肉果（煨）1钱，诃子1钱，莲子8分，糯米1撮。,nan,nan,nan,nan,nan,nan,水煎服。寒痛泻，加砂仁5分；热泄，加炒连3分；泻久，加升麻3分；泻水，加苍术1钱；泻出食肉如败卵及噫气，加神曲、砂仁各8分，山楂、麦芽各5分，或加豆蔻、丁香各1钱；渴，加麦冬1钱、五味6分。,nan,nan
10016042,茯苓汤,nan,nan,《圣济总录》卷一六二,产后气血虚，头痛不定。目眩呕逆。,nan,nan,nan,白茯苓（去黑皮）1两，羌活（去芦头）1两，当归（切，焙）1两，人参1两，附子石膏（火煨）1两，黄耆（锉）1两。,上锉，如麻豆大。,nan,nan,nan,nan,nan,每服3钱匕，水1盏，煎至7分，去滓温服，不拘时候。,nan,nan
10016046,茯苓汤,nan,nan,《圣济总录》卷一六O,产后心气不足，血邪狂言，眠卧不安。,nan,nan,nan,白茯苓（去黑皮）1两半，甘草（炙，锉）1两，远志（去心）半两，白薇1两，龙齿（研）1两，熟干地黄（焙）1两半，人参1两，防风（去叉）1两，独活（去芦头）半两。,上为粗末。,nan,nan,nan,nan,nan,每服3钱匕，水1盏，煎至7分，去滓温服，不拘时候。,nan,nan
10016050,茯苓汤,nan,nan,《圣济总录》卷一六四,产后虚汗不止，心悸恍惚，怵惕多惊。,nan,nan,nan,白茯苓（去黑皮）1两半，甘草（炙黄）1两，芍药（锉，炒）1两，桂（去粗皮）1两，当归（切，炒）1两，麦门冬（去心，焙）1两，黄耆1两半（锉）。,上为粗末。,nan,nan,nan,nan,nan,每服5钱匕，水1盏半，加生姜半分（切），大枣2个（擘），煎至8分，去滓温服，不拘时候。,nan,nan
10016090,茯苓饮,nan,nan,《圣济总录》卷一六二,产后气血虚，头痛不定。目眩呕逆。,nan,nan,nan,白茯苓（去黑皮）1两，羌活（去芦头）1两，当归（切，焙）1两，人参1两，附子石膏（火煨）1两，黄耆（锉）1两。,上锉，如麻豆大。,nan,nan,nan,nan,nan,每服3钱匕，水1盏，煎至7分，去滓温服，不拘时候。,nan,nan
10016094,茯苓饮,nan,nan,《圣济总录》卷一六O,产后心气不足，血邪狂言，眠卧不安。,nan,nan,nan,白茯苓（去黑皮）1两半，甘草（炙，锉）1两，远志（去心）半两，白薇1两，龙齿（研）1两，熟干地黄（焙）1两半，人参1两，防风（去叉）1两，独活（去芦头）半两。,上为粗末。,nan,nan,nan,nan,nan,每服3钱匕，水1盏，煎至7分，去滓温服，不拘时候。,nan,nan
10016098,茯苓饮,nan,nan,《圣济总录》卷一六四,产后虚汗不止，心悸恍惚，怵惕多惊。,nan,nan,nan,白茯苓（去黑皮）1两半，甘草（炙黄）1两，芍药（锉，炒）1两，桂（去粗皮）1两，当归（切，炒）1两，麦门冬（去心，焙）1两，黄耆1两半（锉）。,上为粗末。,nan,nan,nan,nan,nan,每服5钱匕，水1盏半，加生姜半分（切），大枣2个（擘），煎至8分，去滓温服，不拘时候。,nan,nan
10016124,茯苓粥,白茯苓粥,nan,《圣济总录》卷一九O,健脾益胃，利水消肿。主治产后无所苦，欲睡而不得睡。老年性浮肿，肥胖症，脾虚泄泻，小便不利，水肿。,nan,nan,nan,白茯苓（去黑皮，取末）半两，粳米2合。,上药，以米淘净煮粥，米熟即下茯苓末。,nan,老年人脱肛和小便多者不宜服食。,nan,nan,nan,nan,nan,nan
10016148,茯神散,nan,nan,《传家秘宝》,积热劳瘦，产后血虚，潮热蓐劳，五心有热。,nan,nan,nan,茯神、牡丹皮、地骨皮、官桂、山茵陈、人参、芍药、甘草、丹参、玄胡、黄连、石斛、柴胡、麦冬、犀角末、羚羊角末各等分。,上为细末。,nan,nan,nan,nan,nan,每服2钱，水1盏，生姜3片，同煎5-7沸，和滓温服。,nan,nan
10016194,浮麦散,nan,nan,《竹林女科》卷三,产后阳虚盗汗。,nan,nan,nan,人参2钱，当归1钱5分，熟地黄1钱5分，麻黄根5分，黄连（酒炒）5分，浮小麦1撮。,nan,nan,nan,nan,nan,nan,水1钟半，煎7分服。,nan,nan
10016254,辅正除邪汤,nan,nan,《会约》卷十五,产后疟疾。,nan,nan,nan,北柴胡1钱半，陈皮1钱半，半夏1钱半，茯苓1钱半，甘草1钱半，川芎8分，归身2钱，干姜1钱（炒），肉桂1钱，黄芩1钱，白豆蔻肉1钱（微炒，研），生姜1钱。,nan,nan,nan,nan,nan,nan,头煎要轻，先3个时服；次煎加鳖甲（醋炙）2钱，先1个时服。如寒多者，重加姜、桂；如热多者，重加黄芩，并加知母；如久疟汗甚者，加蜜炒黄耆1-2钱；若1-2剂不应者，加酒炒常山1钱。,nan,nan
10016265,妇宝宁坤丸,nan,nan,《全国中药成药处方集》（杭州方）,调经种子，养血安胎。主治妇人气血两亏，月经不调，崩漏带下，诸虚百损，久不受孕，一切胎前产后诸病。,nan,nan,nan,吉林人参2钱，大熟地5钱，制香附5钱，紫苏叶2钱5分，大生地5钱，驴皮胶2钱5分，全当归5钱，广橘红5钱，川牛膝2钱，于术5钱，沉香1钱，川芎5钱，台乌药5钱，西砂仁1钱5分，炒黄芩5钱，西琥珀2钱5分，白茯苓5钱，广木香2钱5分，炙甘草1钱5分，东白芍5钱，益母草3两。,各取净粉，用柏子仁1两，煎汤去滓，和炼白蜜为丸，每重3钱，蜡壳封固。,nan,nan,nan,nan,nan,每服1丸，开水化服。,nan,nan
10016266,妇宝胜金丹,nan,nan,《中国医学大辞典》,调经活血，止带除浊。主胎前产后一切杂证。经水不调，或经前腹痛，或经后淋漓，或赤白带下，或血症血瘕；妊娠呕恶冲逆，腹痛腰酸，胎气不安，饮食少进，或带下见红，似欲小产，或临月阵痛，腰酸下坠；产后偏身发热，不省人事，或风寒发热，或停食发热，或儿枕骨痛，或血晕，血崩，头热心烦，有汗，或恶露不尽，腰痛发热。,nan,nan,nan,人参3两，全当归3两，白芍药3两，赤芍药3两，川芎3两，白芷3两，熟地黄9两，茯苓5两，桂心5两，牛膝5两，牡丹皮5两，藁本5两，血珀1两，朱砂（飞）1两，白薇8两，赤石脂2两，白石脂2两，乳香2两，没药2两，粉草1两5钱，香附（制）2斤。,先将赤、白石脂醋浸三日，炭火上煅七次，再淬，醋干为度，研细；次将各药用好黄酒浸，春五、夏三、秋七、冬十二日，晒干为末，与石脂和匀，炼蜜为丸，每重3钱，辰砂、金箔为衣。,nan,孕妇忌服。,nan,nan,nan,nan,nan,nan
10016273,妇科花蕊石散,nan,nan,《全国中药成药处方集》（福州方）,产后败血不尽，血迷血晕，胎衣不下，不省人事。,nan,nan,nan,花蕊石1斤，土色硫黄4两。,上为末，和匀，用瓦罐1个，入二药，以纸泥封口，晒干，用炭火煅二柱香，次日取出研细。,nan,nan,nan,nan,nan,每服1钱，童便和热酒调下。甚者用2-3钱。,nan,nan
10016274,妇科回生丹,nan,nan,《全国中药成药处方集》（天津方）,通经活血，化瘀止痛。主治经闭不通，肚腹疼痛，及产后恶露不净，腹胀头痛。,nan,nan,nan,大黄1斤，红花3两，苏木3两，黑豆1斤，黄酒1斤，醋3斤（先将大黄轧成小碎块，红花、黑豆、苏木3味用清水熬汁，熬透去滓滤净，用汁煮大黄，待汁浸入，次将醋倒入，用微火徐徐煮之，须用铲不停地搅动，至稠膏形，再将黄酒倒入，微煮后起入盆内），当归2两，川芎2两，熟地2两，茯苓2两（去皮），炒苍术2两，香附2两（醋制），乌药2两，元胡2两（醋制），桃仁2两（去皮），炒蒲黄2两，川牛膝2两，生白芍5钱，广皮5钱，广木香5钱，三棱5钱（醋制），五灵脂5钱（醋炒），地榆炭5钱，羌活5钱，山萸肉（酒制）5钱，人参3钱（去芦,上为细粉，炼蜜为丸，3钱5分重，蜡皮或蜡纸筒封固。,nan,孕妇及产后下血过多者忌服。,nan,nan,nan,nan,nan,nan
